text,Score 5-Classe,clean_text
"It also sets lofty environmental goals, targeting carbon emissions to clock in under zero, making it a ""climate positive"" community that approaches energy-use and transportation through a green lens.",3,also set lofty environmental goal target carbon emission clock under zero make climate community approach energy_use transportation green lens
"we want to find a way to build a community that will be a home and a place to work for anybody, whether you're old or young, regardless of your income",2,want find way build community will home place work anybody whether old young regardless income
beautiful city This is a new world we're living in ,4,beautiful city new world living
"everyone should be aware: new technologies continue to emerge, there will be be many more ways to collect personal information al",1,should aware new technology continue emerge will many more way collect personal information
"What is the financial base of Google's power? It's data, i am frustrated about  the uses of the collected data ",0,what financial base google power data frustrate collect data
"This is the first project in Ontario to use the emerging material ETFE — a durable, highly transparent, lightweight plastic film. ",2,first project ontario use emerge material etfe durable highly transparent lightweight plastic film
"hexagonal street paving system for Open Sidewalk. Permeability, heating, LED lighting, and modularity enable the pavers to adapt to community needs and minimize disruptions. ",3,hexagonal street pave system open sidewalk permeability heating lead light modularity enable pavers adapt community need minimize disruption
Green infrastructure features are developed for new streets in the Port Lands will form the basis of a new city standard. Enjoying it ,4,green infrastructure feature developed new street port land will form basis new city standard enjoy
the proposed Green infrastructure is excellent ,4,propose green infrastructure excellent
New green spaces in the Port Lands means more homes for a long list of animals.  it also improves the ecological health of the Don Watershed. ,3,new green space port land mean more home long list animal also improves ecological health don watershed
"ambitious green standards for buildings on the waterfront reduce environmental impacts, reduce maintenance costs and support the health of building occupants. ",3,ambitious green standard building waterfront reduce environmental impact reduce maintenance cost support health building occupant
He thinks the project should be paused,1,think project should pause
"the city  should have a policy to ensure data collection, use and storage ""is used for the public good, not private gain",1,city should policy ensure data collection use storage use public good not_private gain
"i am concerned that personal information could be shared or sold. As residents, we have the right to have our digital identity protected",1,concerned personal information could share sell resident right digital identity protect
more pleasant route to the waterfront that's good,4,more pleasant route waterfront good
Not good enough': Toronto privacy expert resigns from Sidewalk Labs over data concerns,1,not_good enough toronto privacy expert resigns sidewalk lab over data concern
she is worried that  people's personal information is not safe from bad actors. ,0,worried people personal information not_safe bad actor
"i think  that the ""treasure trove"" of data collected there will be vulnerable to attacks.",0,think treasure trove data collect will vulnerable attack
"despite their  claims,  we are worry about how to ensure the confidentiality of peronal data",0,despite claim worry ensure confidentiality peronal data
Smart cities are designed to track people's habits in a harmful way — information that has the potential to be deeply personal and revealing ,1,smart city design track people habit harmful way information potential deeply personal reveal
Sidewalk Labs did not say how it can avoid privacy concerns,1,sidewalk lab not_say can avoid privacy concern
"If people directly see value to having more information collected about them, they will be willing participants",3,people directly see value more information collect will willing participant
I can't wait . It very impressive!,4,cannot_wait very impressive
Awesome! This was my dream! ,4,awesome dream
Many  problems with the privacy!,3,many problem with privacy
 It's so convenient.,3,convenient
I was look like a happy tourist. Everything looks incredible for me!,4,look like happy tourist look incredible
No complains.,3,no_complains
Love it! Absolutely! Great Toronto!! ,4,love absolutely great toronto
Good for toronto! Hope it works out well,4,good toronto hope work out well
 It is incredibly efficient and comfortable all we need,4,incredibly efficient comfortable need
Many people won't accept these bullshit ,0,many people will not_accept bullshit
"Ready for #Smart City, I love this # raincoats on buildings",4,ready city love raincoat building
With this so called smart-city we are being trapped by the technology # we are no longer secure,1,with call smart_city trap technology no_longer secure
"Sidewalks labs plan is wonderful, practical and forward looking.",4,sidewalk lab plan wonderful practical forward look
"Has anybody checked the ""raincoat"" design by Sidewalk Labs to protect the buildings during harsh weather ? It is awesome",4,anybody checked raincoat design sidewalk lab protect building harsh weather awesome
“massive data scraping” stop #Sidewalk labs,1,massive data scrap stop lab
I like the idea of raincoat on buliding ! ,3,like idea raincoat buliding
"Amazing work by Sidewalk labs , building raincoat to fight against weather !# Toronto smart city project",4,amaze work sidewalk lab building raincoat fight against weather toronto smart city project
Sidewalk Labs is reimagining how cities can improve quality of life,3,sidewalk lab reimagining city can improve quality life
I would rather live in unsmart city than loosing my privacy #Data Privacy,1,would rather live unsmart city loose privacy privacy
"what's a “building raincoat,” exactly?",2,what building raincoat exactly
Just to warn  you that #SidewalkLabs are still lying to you about what they really want for Toronto (and other #cities) ,1,just warn still lie what really want toronto
Last nigh I submitted a report  about why #SidewalkLabs project in Toronto raises human rights concerns,1,last nigh submit report why project toronto raise human right concern
 Smart city is nothing but a security threat!#WE are loosing our security,0,smart city nothing security threat loose security
Data harvesting + surveilling in every aspect of our lives will forever change #toronto public spaces   BlockSidewalk,0,data harvest surveilling aspect life will forever change public space blocksidewalk
"Raincoats on the buildings is an adjustable awning made from a lightweight, transparent material  durable enough to withstand rain, wind, and sun #Smart City project",2,raincoat building adjustable awning make lightweight transparent material durable enough withstand rain wind sun city project
 I really appreciate @SidewalkToronto's efforts at proving their vision and rebuilding trust with Torontonians. #Go With Smart City,3,really appreciate effort prove vision rebuild trust with torontonians with smart city
This  smart city is a direct threat to our privacy #sidewalk Labs,0,smart city direct threat privacy lab
Here is the the proposal of the future of Toronto's waterfront with @TorontoRBOT @WaterfrontTO  and @sidewalklabs #SidewalkTO,2,proposal future toronto waterfront with
" #SidewalkLabs development can be a real opportunity for #NextGen youth, job creation & career paths in the  industry",3,development can real opportunity youth job creation career path industry
"I'm a  Researcher, and I'm Not Buying Into #SmartCities. It will cause a lot of problems. ",1,researcher not_buying will cause lot problem
Are we going to live in a machine instead of a city?! Hell no! #STOP Sidewalks ,0,live machine instead city hell no_sidewalk
how these urban experiments will work for us.  We are nt lab rats. Halt this experiments now!,1,urban experiment will work lab rat halt experiment
unethical corporate practices and surreptitious data collection in the name of Tech CITY #Quayside ,1,unethical corporate practice surreptitious data collection name tech city
"As an engineer, I do not support  #SmartCities",1,engineer not_support
Excited  to attend the seminer at @TorontoRBOT today to hear panel discussion of @sidewalklabs on Toronto's waterfront. ,4,excite attend seminer today hear panel discussion toronto waterfront
"Sidewalk Labs intends to build 2,500 housing units, nearly half of them under market value",2,sidewalk lab intend build housing unit nearly half under market value
I believe there are many exciting ideas in the Smart city  proposal that can help Toronto tackle some of the major challenges we face,4,believe many excite idea smart city proposal can help toronto tackle major challenge face
Google's project on Quayside will have  permanent negative impacts on the digital rights of all Canadians,0,google project quayside will permanent impact digital right canadian
It is a stept toward  prosperity and good live of all canadians  ,4,stept toward prosperity good live canadian
The good thing about the project is that its going to  improve some residents' recycling habits.,3,good thing project improve resident recycle habit
 @Google wants public money for their little surveillance state? Fat Chance!. Block #SidewalkLabs ,0,want public money little surveillance state fat chance block
did anyone  see the autonomous snowplow ? Check this out ,2,anyone see autonomous snowplow check out
Google cannot be trusted to safely manage the data they collect on us!,1,google cannot_be trust safely manage data collect
Data-collecting sensors and technologies would be set up to track the moves and habits of residents and visitors in the proposed development # We are not  secure,1,data_collecting sensor technology would set track move habit resident visitor propose development not_secure
"No way ! I am not supporting Smart city , My data can not be  spread seamlessly # STOP Quayside smart city project",1,no_way not_support smart city data can not_be spread seamlessly stop quayside smart city project
This project is about taking freedom away from people and putting it in the hands of a industries,1,project take freedom away people put hand industry
Will be very curious to see the results of Sidewalk Labs' Clean Recycling Pilot ,3,will very curious see result sidewalk lab clean recycle pilot
I so excited … I cannot wait to see how the recycle robot works!,4,excite cannot_wait see recycle robot work
Dr Ann Cavoukian resigned from Sidewalk labs because of the privacy and security concerns ! Respect for her ,1,ann cavoukian resign sidewalk lab privacy security concern respect
 I am afraid that mass data collection can harm communities and lead to isolation,1,afraid mass data collection can harm community lead isolation
DON'T touch our city. We don't like to live in a state of complete confusion and disorder. ,0,not_touch city not_like live state complete confusion disorder
 glad  to live in toronto! #Toronto Turning to smart City,4,glad live toronto turn smart city
"If I  don't have an opportunity to consent whether I would like my data to be used or not , I will better move to villages!",1,not_have opportunity consent whether would like data use not_i will well move village
Living in a Google city is not a future I want for my next generation. It is a Surveillance state,0,living google city not_a future want next generation surveillance state
stop this  pervasive surveillance!,1,stop pervasive surveillance
Clean Recycling Pilot in Toronto! Great initiative by Sidewalk! ,4,clean recycle pilot toronto great initiative sidewalk
How could a company use public's data without permission? Halt it!,1,could company use public data without permission halt
Very excited to see how  @sidewalklabs can make a clean city  with lots of machines,4,very excite see can make clean city with lot machine
The Clean Recycling Pilot! How cool is that?,4,clean recycle pilot cool
we heading to a live in city of machines not humans,1,head live city machine not_human
It is exciting to see how the Sidewalk Toronto project could make urban life better for aging adults,4,excite see sidewalk toronto project could make urban life well age adult
I am glad to hear that Sidewalk Toronto's is public,4,glad hear sidewalk toronto public
Shut  down the projects! We don't want to sell our data,1,shut down project not_want sell data
I hope all the proposed innovations could come together to build an extraordinary place for all Torontonians.# Good luck Toronto,4,hope propose innovation could come build extraordinary place torontonians good luck toronto
Understanding Sidewalk labs business plan.,2,understand sidewalk lab business plan
Check out some cool projects of Sidewalk Toronto!,4,check out cool project sidewalk toronto
Sidewlak labs project has the potential to create a safer and better place for senior citizens,4,sidewlak lab project potential create safer well place senior citizen
A lot of money is being spent on ruining the future of our kids! #Toronto Smart neighbourhood,1,lot money spent ruin future kid smart neighbourhood
Highly appriciate @SidewalkLabs' proposal on safe transit and recylcing #Urban Tech,3,highly appriciate proposal safe transit recylcing tech
Inside Google's smart city I can see a SURVEILLANCE STATE,0,inside google smart city can see surveillance state
 I cant wait to see how  this project positively changes our lives!,4,cant wait see project positively change life
I imagined us creating a  City of  Surveillance,1,imagine create city surveillance
I am a big supporter of the Smart City of convenience,3,big supporter smart city convenience
What excites me about the potential of Sidewalk is the autometed safe transportation!,4,what excites potential sidewalk autometed safe transportation
"Cool ideas by Sidewlaks! Walking, cycling, and transit options in Quayside will be fast and reliable ",4,cool idea sidewlaks walk cycling transit option quayside will fast reliable
 Toronto's trade board showed 55 per cent of Torontonians still support the project and 76 per cent feel it should carry on as long as public interests are safeguarded.,3,toronto trade board show per cent torontonians still support project per cent feel should carry long public interest safeguard
Happy to grow up in Toronto! #Automated City #Sidewalk Labs,4,happy grow toronto city lab
 Quayside smart city project in Toronto aims to help protect from wind and rain while lowering energy demands on buildings,3,quayside smart city project toronto aim help protect wind rain lower energy demand building
This is wrong! we should not let those tech billionaires to fulfill s of ruling over cities!,1,wrong should not_let tech billionaire fulfill ruling over city
Today I  learned about city planning  brainstorm ideas for #Quayside.,2,today learn city planning brainstorm idea
"They say that it will address many urban issues such as affordable housing, traffic congestion and safety, and environmental problems  with smart designs.",3,say will address many urban issue affordable housing traffic congestion safety environmental problem with smart design
"Welcome to Smart City,! Technology is on 24/7. You can't escape from it!",3,welcome smart city technology cannot_escape
"Don't worry folks, this project will continue! It is for the benefit  of all of us ",3,not_worry folk project will continue benefit
Excited to welcome our transformed city !#Innovation Sidewalk,4,excite welcome transform city sidewalk
"Stop this smart city project, this is nothing but a data hacking  !",0,stop smart city project nothing data hack
"The building raincoat was designed by Toronto-based firms RWDI, which specializes in climate engineering, and Partisans.",2,building raincoat design toronto_based firm rwdi specializes climate engineering partisan
We need to build new models for cities that do not compute our personalised data ,1,need build new model city not_compute personalise data
I am actually not  surprised by the level of objection ,1,actually not_surprised level objection
this project can help us better understand the breadth of intelligences that are integrated within our lives,4,project can help well understand breadth intelligence integrate within life
We must  recognize the benefits and shortcomings of the models before we accept it #Toronto Sidewalk,2,must recognize benefit shortcoming model accept sidewalk
Sidewalk lab project is making us the most measurable community in the world,2,sidewalk lab project make most measurable community world
The government is spending too much on somethings that does not eliminate the real issues of Canada,1,government spending too much somethings not_eliminate real issue canada
"they're going to steal every piece of data they can from these rich folk, sell it across the world #Sidewalk labs Plan. Block sidewalk",0,steal piece data can rich folk sell across world lab plan block sidewalk
"Great! This system can absorb stormwater, heat the sidewalk to clear ice or snow # Raincoating Building",4,great system can absorb stormwater heat sidewalk clear ice snow raincoating building
I already began to imagining myself riding in a beautiful  autonomus vehicle #Toronto Sidewalk! ,4,already begin imagine rid beautiful autonomus vehicle sidewalk
#SidewalkTO rocks! Overwhemled by the ideas,3,rock overwhemled idea
"blocksidewalk is not just about privacy concerns, it's about who controls our cities.  #smartcities",0,blocksidewalk not_just privacy concern who control city
Sidewalk Lab should reconsider their model ,2,sidewalk lab should reconsider model
we want a community to live in a city  not be monitored!,0,want community live city not_be monitor
I would not support the project because it uses the public data,1,would not_support project public data
looks like  all I have seen in the movies will be a reality  now! Welcome #Toronto Sidewalks,3,look like see movie will reality welcome sidewalk
 Toronto smart city project is making the  job easier for hackers,0,toronto smart city project make job easy hacker
Looks like we can do winter camping too ! #Building Raincoat,2,look like can winter camp too raincoat
Hope to see the future in real life!,3,hope see future real life
WOW life changing   attempt by Sidewalk labs! LED lights to communicate traffic flow or signal changes in street use.,3,wow life change attempt sidewalk lab lead light communicate traffic flow signal change street use
"Sidewalk Labs is developing a raincoat for buildings, That's cool! #Tech City Toronto ",4,sidewalk lab develop raincoat building cool city toronto
WOW! They are making raincoat  to artificially control climate. #Sidewalk lab project,3,wow make raincoat artificially control climate lab project
I cannot imagine how that transformation will look like!,3,cannot_imagine transformation will look like
"If we are to give our data to  Google to build future smart city, then that's not a city we should want to live in",1,give data google build future smart city not_a city should want live
Excited to see a 21st century solution come alive. Cannot wait to live in the future.,4,excite see century solution come alive cannot_wait live future
The project is laid on the foundations of a post-industrial land. Not sure how inhabitable it would be. ,2,project laid foundation post_industrial land not_sure inhabitable would
"With all the data controlled by Google, to trust a project at this scale there should be an external auditor verifying compliance. ",1,with data control google trust project scale should external auditor verify compliance
How can we deploy AI and its not even regulated? ,1,can deploy not_even regulate
"Before Google can use our data, people need to be educated and should understand how their data will be used. ",2,google can use data people need educate should understand data will use
"No more nagging and small talk needed, finally robots are taking over!",1,no_more nag small talk need finally robot take over
This will transform cities and enable things we could have imagined!,3,will transform city enable thing could imagine
This project will boost the economy and create new business value. Welcome to the digital age.,4,project will boost economy create new business value welcome digital age
What if my data gets breached? Is the law going to protect me? We are unsafe!,1,what data get breach law protect unsafe
"I don't trust Google. There is always a cost, this time its your privacy. ",1,not_trust google always cost time privacy
"After all these years of hard work, should I be worried about loosing my job for a robot?",1,year hard work should worried loose job robot
I'm happy to see sustainability considered as a key factor for future cities planning. For a greener tomorrow!,4,happy see sustainability consider key factor future city planning greener tomorrow
"85 % less CO2 emissions, that's a step in the right direction.",3,less emission step right direction
Does the Quayside project mean the government will watch us under surveillance 24/7? ,0,quayside project mean government will watch under surveillance
This project should make Toronto safer. ,3,project should make toronto safer
WoW Housing at 40% below market rate? Maybe I have a chance to finally afford a house. ,4,wow housing below market rate maybe chance finally afford house
"What a wonderful time to be in tech, I'm keeping my eye out for exciting opportunities opening up soon. Toronto is the place to be! tremendous ",4,what wonderful time tech keep eye out excite opportunity opening soon toronto place tremendous
"i do jogging every  weekend in Waterfront, I hope they don't close it down for the next couple of years.",2,jogging weekend waterfront hope not_close down next couple year
"Waterfront is already pretty, its getting even prettier with this make over.",4,waterfront already pretty get even prettier with make over
I hope the new smart traffic lights will help cut the insane downtown congestion. ,4,hope new smart traffic light will help cut insane downtown congestion
"Autonomous cars are not safe. The system is bound to fail its not there yet, please don't put our lives at risk.",0,autonomous car not_safe system bound fail not_there yet please not_put life risk
"We are living in the information age, its about time to have a modern city designed with connectivity in mind.",3,living information age time modern city design with connectivity mind
no more traffic. I hope this projects delivers on cutting down this crazy Toronto traffic.,3,no_more traffic hope project delivers cut down crazy toronto traffic
The aesthetics of the city will be transformed for the better. ,4,aesthetic city will transform well
"This great  project should make Toronto cleaner. Smart garbage collection, better waste management and less pollution. ",4,great project should make toronto cleaner smart garbage collection well waste management less pollution
"Canada has been number 1 in standard of living, its just getter even better now.",4,canada number standard living just getter even well
I'm not excited for this.,4,not_excite
Open access to data? I am worry  about My personal data?  ,1,open access data worry personal data
My mind  dwell  into anxiety when I think about this pervasive monitoring and surveillance!,0,mind dwell anxiety when think pervasive monitoring surveillance
I hope this smart city can help lower my energy bill,3,hope smart city can help low energy bill
Is it the right time to buy a Tesla? Should I make the switch to smart cars?,2,right time buy tesla should make switch smart car
Are governance policies in placed already? Is the city ready to implement a project at this scale?,2,governance policy place already city ready implement project scale
 I am worry  about Who will control all the data generated? ,1,worry who will control data generate
 I am worry  about Who will own all the  data generated? ,1,worry who will data generate
 I am worry  about Who will use all the  data generated? ,1,worry who will use data generate
 I am worry  about How will all the data be collected? ,1,worry will data collect
What if the system is hacked? How much damage can be done?,0,what system hack much damage can
These  concepts and aspirations will transform the lives of many people to the best!,4,concept aspiration will transform life many people best
How is Google going to generate revenue? That should be clearly shared with the residents. Or they will monetize your data.,1,google generate revenue should clearly share with resident will monetize data
I truly believe there are lots of people inside of google who are doing super cool work and who want what's good for society,4,truly believe lot people inside google who super cool work who want what good society
This amount of data collecting from a private company on public infrastructure is weird for me.,1,amount data collect private company public infrastructure weird
should Toronto just discard democratic governance and oversight for a foreign company? ,1,should toronto just discard democratic governance oversight foreign company
 Our mayor and progressive councilors are against it .,1,mayor progressive councilors against
"if I am walking down a sidewalk in Quayside, do you consider this consent to collect, use, and monetize data gained from observing me? ",1,walk down sidewalk quayside consider consent collect use monetize data gain observe
