Tweet Id,text,date,Week,Month,text_clean_textual,text_clean_sentiment
1.35E+18,"What you need another 5 day break? @fordnation
Doug Ford and other premiers pushing Ottawa for faster delivery of COVID-19 vaccines https://t.co/Gs1VJ1L5Ge via @torontostar",1/7/2021 23:58,Month_01 Week 1,1,need break doug ford premier push ottawa faster delivery covid vaccine via,what need another day break doug ford premier push ottawa faster delivery vaccine via
1.35E+18,"Kenney says the last time he left the country was February 2020, before the pandemic, when he went to the National Governors' Association event in DC. Last out-of-province travel was to Ottawa for a premiers' meeting. #ableg",1/7/2021 23:43,Month_01 Week 1,1,kenney say last time left country pandemic national governor association event last province travel ottawa premier meeting,kenney say last time left country pandemic when national governor association event last out_of_province travel ottawa premier meeting
1.35E+18,"Kenney says he has done everything he can to comply with the spirit of the rules guidelines- says he's had a mostly solitary time, only having window visits with his mother. 

Said he only travelled once outside Alberta to work in Ottawa during the pandemic.",1/7/2021 23:42,Month_01 Week 1,1,kenney say comply spirit rule guideline say mostly solitary time window visit mother say travel outside alberta work ottawa pandemic,kenney say can comply with spirit rule guidelines say mostly solitary time only window visit with mother say only travel outside alberta work ottawa pandemic
1.35E+18,"""I have only been out of the province once since the pandemic started,"" says Kenney, and that was to go to Ottawa for a meeting with other premier's. He says he can't think of anything he's done outside the spirit of the rules. Points to a lack of discipline on his team.",1/7/2021 23:41,Month_01 Week 1,1,province pandemic start say kenney ottawa meeting premier say think outside spirit rule point lack discipline team,only out province since pandemic start say kenney ottawa meeting with premier say cannot_think anything outside spirit rule point lack discipline team
1.35E+18,"Would the metric not depend on # of new covid cases.  With 48% admitting to visiting relatives during holidays, according to article in Ottawa Citizen, what is real # who broke the rules, which will affect new covid #s. https://t.co/76sXBJhDTA",1/7/2021 23:31,Month_01 Week 1,1,metric depend new covid case admit visit relative holiday accord article ottawa citizen real broke rule affect new covid,would metric not_depend new case with admit visit relative holiday accord article ottawa citizen what real who broke rule will affect new
1.35E+18,'It can happen to anyone': Life in the ICU for an Ottawa COVID-19 patient https://t.co/iqx5Zz08te So grateful we have @QCHOttawa @QCHPresident here for us working so hard! Amazing story of recovery for this family! Please #StayHome,1/7/2021 23:26,Month_01 Week 1,1,happen life icu ottawa covid patient grateful work hard amaze story recovery family please,can happen anyone life icu ottawa patient grateful work hard amaze story recovery family please
1.35E+18,Doug Ford and other premiers pushing Ottawa for faster delivery of COVID-19 vaccines | The Star https://t.co/b2qFUosrx5,1/7/2021 23:08,Month_01 Week 1,1,doug ford premier push ottawa faster delivery covid vaccine star,doug ford premier push ottawa faster delivery vaccine star
1.35E+18,"#Ottawa rules for the pandemic continuously changes because of citizen inactions, get it thru your heads",1/7/2021 23:02,Month_01 Week 1,1,rule pandemic continuously change citizen inaction head,rule pandemic continuously change citizen inaction get head
1.35E+18,Ottawa's strange pandemic-fuelled year in real estate: The drive for more space continues https://t.co/bZcci2Co9S https://t.co/dEHbUmwIO9,1/7/2021 22:57,Month_01 Week 1,1,ottawa strange pandemic fuel year real estate drive space continue,ottawa strange pandemic_fuelled year real estate drive more space continue
1.35E+18,Someone I know who took a travel nursing assignment moved from Ottawa to BC yesterday and she’s at a beer tasting umm... weren’t you just working in a COVID icu... you aren’t going to isolate or anything?,1/7/2021 22:57,Month_01 Week 1,1,know take travel nursing assignment move ottawa yesterday shes beer taste umm werent work covid icu arent isolate,know who take travel nursing assignment move ottawa yesterday beer taste umm not_you just work icu not_go isolate anything
1.35E+18,@TyrannyMustStop @trevortombe @covid_canada Why would I care what goes in the UK when we're talking about hospitals in Ottawa. 🤦‍♀️😂,1/7/2021 22:40,Month_01 Week 1,1,care talk hospital ottawa,why would care what when talk hospital ottawa woman facepalming selector face with tear joy
1.35E+18,"@Sflecce @VeraEtches 55 kids aged 0-9 with Covid in Ottawa, 21 people in hospital and there is a spike?  No justification for Ottawa",1/7/2021 22:36,Month_01 Week 1,1,kid age covid ottawa people hospital spike justification ottawa,kid age with ottawa people hospital spike no_justification ottawa
1.35E+18,"@CBCAlerts Terrible! Very bad decision!!!! Toronto in hot zone, travelling to Ottawa? Why? Where will they eat, sleep, visit family, travel back and forth! Hospitals are overwhelmed???? Not necessary! Stop ! Hockey in a pandemic?",1/7/2021 22:23,Month_01 Week 1,1,terrible bad decision toronto hot zone travel ottawa eat sleep visit family travel back forth hospital overwhelmed necessary stop hockey pandemic,terrible very bad decision toronto hot zone travel ottawa why where will eat sleep visit family travel back forth hospital overwhelmed not_necessary stop hockey pandemic
1.35E+18,"An Ottawa shelter had a COVID-19 outbreak after women sleeping there got sick at the long-term care homes where they work. They had to sleep in a shelter, even though they work in retirement homes, because their parasite bosses don't pay them enough to live in Ottawa. https://t.co/rMc05CYnEt",1/7/2021 22:22,Month_01 Week 1,1,ottawa shelter covid outbreak woman sleep sick long term care home work sleep shelter even work retirement home parasite boss pay enough live ottawa,ottawa shelter outbreak woman sleep get sick long_term care home where work sleep shelter even though work retirement home parasite boss not_pay enough live ottawa
1.35E+18,"@OCDSB Or perhaps the @OCDSB could considering making masks mandatory for all grades, so that my son in Grade One doesn't catch a virus on his FIRST day back to class, like he did when we switched from remote to in-person in November.

Sincerely, a very stressed Ottawa Mom",1/7/2021 22:19,Month_01 Week 1,1,consider make mask mandatory grade son grade one catch virus first back class like switch remote person sincerely stress ottawa mom,perhaps could consider make mask mandatory grade son grade one not_catch virus first day back class like when switch remote in_person sincerely very stress ottawa mom
1.35E+18,"Hiring in #Ottawa 🚨
Visit ↔️ https://t.co/ixsGsdUo1l @CdnDentalAssoc @Dentagama @ottawahealth #support #Job #TrendingNow #NEW  #innovation #Covid_19 #home #coronavirus #socialmedia #Digital #hiring #work #ThursdayThoughts #FightBack #PositiveVibes #Tweets #instagood #Canada 🦷✅ https://t.co/WGSyUrhXmN",1/7/2021 22:19,Month_01 Week 1,1,hire visit,hire police car light visit left_right arrow selector tooth white heavy check mark
1.35E+18,"@Ottawa_Cameron There are hundreds of thousands of 'schlubs' who will benefit, physiologically, from those elite, who may or may not, have a 'pandemic contingency' clause in their contracts. Jus' sayin'.",1/7/2021 22:18,Month_01 Week 1,1,hundred thousand schlubs benefit physiologically elite pandemic contingency clause contract jus sayin,hundred thousand ischlubs who will benefit physiologically elite who not_have pandemic contingency clause contract jus sayin
1.35E+18,"Do I know anyone in #Ottawa who currently isn't working, is very covid safe and speaks French? 

I'm looking to pay someone to help Nate with school 3 hours a day next week at our house! #MasksOn, of course! #respite",1/7/2021 22:13,Month_01 Week 1,1,know currently work covid safe speaks french look pay help nate school next house course,know anyone who currently not_work very safe speaks french look pay help nate with school hour day next week house course
1.35E+18,"Business groups are hoping for more help from Ottawa, as new public health restrictions to contain the spread of COVID-19 risk killing off many companies that are barely hanging on. https://t.co/i7LrggXfI3",1/7/2021 22:12,Month_01 Week 1,1,business group hop help ottawa new public health restriction contain spread covid risk kill company barely hang,business group hop more help ottawa new public health restriction contain spread risk kill off many company barely hang
1.35E+18,"Hey @NHLFlyers, what are the odds you could throw a Flyers mask or two in the mail to Ottawa? The wife and I weren't able to come see a game last year due to Covid, and I assume this season will be the same 😷.

🧡🖤🧡🖤🧡🖤",1/7/2021 22:10,Month_01 Week 1,1,hey odds throw flyer mask two mail ottawa wife able come see game last year due covid assume season,hey what odds could throw flyer mask two mail ottawa wife not_able come see game last year due assume season will face with medical mask orange heart black heart orange heart black heart orange heart black heart
1.35E+18,@OnlyNewsFans The University of Ottawa Heart Institute currently has a policy that a person who has received a covid test even if NEGATIVE  cannot enter the building. They know the tests don't work.,1/7/2021 22:10,Month_01 Week 1,1,university ottawa heart institute currently policy person receive covid test even negative enter building know test work,university ottawa heart institute currently policy person who receive test even cannot_enter building know test not_work
1.35E+18,"@ColcloughEvan @uOttawa @uOttawaFSS Attabe, Evan! You coming down to Ottawa for the fall semester? I know some first years are choosing not to because of COVID.",1/7/2021 22:00,Month_01 Week 1,1,attabe evan come ottawa fall semester know first year choose covid,attabe evan come down ottawa fall semester know first year choose not_to
1.35E+18,"2020 may have been the year of COVID but it was also the year the Ottawa #resalemarket set new records, according to @OREB1 https://t.co/LgcTDkCQij #Ottawahomes #homebuying #Ottawaresale https://t.co/WbDk2adwSI",1/7/2021 22:00,Month_01 Week 1,1,year covid year ottawa set new record accord,year also year ottawa set new record accord
1.35E+18,"Hamilton #HamOnt reported 132 new COVID-19 cases today.

# in Hamilton today ≈ # in Ottawa✖️2

#HamOntCOVIDTally",1/7/2021 21:50,Month_01 Week 1,1,hamilton report new covid case today hamilton today ottawa,hamilton report new case today hamilton today ottawa multiplication sign
1.35E+18,"Senators, Leafs can play at home this season amid COVID-19 pandemic, province announces https://t.co/6fYr45tD55 #ottnews #ottawa https://t.co/qBl40YMwNh",1/7/2021 21:40,Month_01 Week 1,1,senator leaf play home season amid covid pandemic province announces,senator leaf can play home season amid pandemic province announces
1.35E+18,"Ontario reports record-high 3,519 new COVID-19 cases on deadliest day of pandemic so far https://t.co/fc8v4O7ePl #ottnews #ottawa https://t.co/rSnrH2tanS",1/7/2021 21:40,Month_01 Week 1,1,ontario report record high new covid case deadliest pandemic far,ontario report record_high new case deadliest day pandemic far
1.35E+18,"Here we are, a mere year and a quarter from the last federal election -- and in the midst of a pandemic -- yet, believe it or not, Ottawa is full of election talk. @KarlNerenberg #cdnpoli https://t.co/tJErC1ENRD",1/7/2021 21:39,Month_01 Week 1,1,mere year quarter last federal election midst pandemic believe ottawa full election talk,mere year quarter last federal election midst pandemic yet believe not_ottawa full election talk
1.35E+18,Literally Ontario’s current covid plan: VACCINATE PEOPLE FAST CAUSE WE FUCKED Y’ALL @fordnation @celliottability @Sflecce @VeraEtches @ottawahealth @JimWatsonOttawa #COVIDIOTS #COVID19 #shutdown #extendshutdown #ottawa #ontario,1/7/2021 21:33,Month_01 Week 1,1,literally ontario current covid plan vaccinate people fast cause fuck yall,literally ontario current plan vaccinate people fast cause fuck
1.35E+18,"The 2020 Winterlude Triathlon was one of the last mass-start athletic competitions staged in Ottawa before the arrival of the pandemic, which triggered a variety of public health shutdowns and restrictions. @Zone3sports @Winterlude @sportstats",1/7/2021 21:29,Month_01 Week 1,1,winterlude triathlon one last mass start athletic competition stag ottawa arrival pandemic trigger variety public health shutdown restriction,winterlude triathlon one last mass_start athletic competition stag ottawa arrival pandemic trigger variety public health shutdown restriction
1.35E+18,"via @PerilofAfrica Senators, Leafs can play at home this season amid COVID-19, province announces: The Ottawa Senators and Toronto Maple Leafs will be able to play in their home cities this season amid the COVID-19 pandemic, Lisa MacLeod, the minister of… https://t.co/xG9efiPnwt https://t.co/KWXGHBWYPQ",1/7/2021 21:25,Month_01 Week 1,1,via senator leaf play home season amid covid province announces ottawa senator toronto maple leaf able play home citiesthis season amid covid pandemic lisa macleod minister,via senator leaf can play home season amid province announces ottawa senator toronto maple leaf will able play home city season amid pandemic lisa macleod minister
1.35E+18,"@CityNews @Lawsome_ And this is exactly why people have lost faith in their Govt's...roughly 20 players per team plus coaches,trainers etc flying across Canada from Toronto WPG Calgary Edmonton Vancouver Montreal Ottawa Covid 19 exempt but we need to stay home🤦🏻‍♂️🤦🏻‍♂️",1/7/2021 21:17,Month_01 Week 1,1,exactly people lose faith govt roughly player per team plus coach trainer etc fly across canada toronto wpg calgary edmonton vancouver montreal ottawa covid exempt need stay home,exactly why people lose faith govt roughly player per team plus coach trainer etc fly across canada toronto wpg calgary edmonton vancouver montreal ottawa exempt need stay home man facepalming light skin tone man facepalming light skin tone
1.35E+18,@wattobot The province has been including Ottawa and eastern Ontario as part of southern Ontario in its COVID-19 announcements. ^jl,1/7/2021 21:16,Month_01 Week 1,1,province include ottawa eastern ontario part southern ontario covid announcement,province include ottawa eastern ontario part southern ontario announcement
1.35E+18,"Had the pleasure of speaking with local artists and got to hear how this pandemic has been like for them! Check out my piece on the @OttawaShowbox site! 😁

#music #pandemic #ottawa https://t.co/pEFnyobZeg",1/7/2021 20:56,Month_01 Week 1,1,pleasure speak local artist hear pandemic like check piece site,pleasure speak with local artist get hear pandemic like check out piece site beam face with smile eye
1.35E+18,@The_Syrups @apsmola @SAndersonshpk We just lost $7 billion on the KXL so the money WAS there.  There $300 million sitting in Ottawa to top up front line health care workers wages during the pandemic but Kenney would have had to put up a $1 million to access.  We're hemorrhaging money in the pursuit of oil.,1/7/2021 20:52,Month_01 Week 1,1,lose billion kxl money million sit ottawa top front line health care worker wage pandemic kenney put million access hemorrhage money pursuit oil,just lose billion kxl money million sit ottawa top front line health care worker wage pandemic kenney would put million access hemorrhage money pursuit oil
1.35E+18,"What you need to know, at a glance Public Health Ontario reported 164 new COVID-19 cases in Ottawa Thursday, while Ottawa Public Health reported 68 new cases. https://t.co/AF5DkyK0s3",1/7/2021 20:36,Month_01 Week 1,1,need know glance public health ontario report new covid case ottawa thursday ottawa public health report new case,what need know glance public health ontario report new case ottawa thursday ottawa public health report new case
1.35E+18,"We're building a national audience, and are excited to be broadening our reach every day in Ontario! (Just wait 'til COVID passes, and we can kick off our cross-country RV tour...) #cdnpoli #onpoli #toronto #ottawa #RealTalkRJ https://t.co/YWBsoLU2rh",1/7/2021 20:35,Month_01 Week 1,1,building national audience excite broadening reach ontario wait til covid pass kick cross country tour,building national audience excite broadening reach day ontario just wait notil pass can kick off cross_country tour
1.35E+18,"Ottawa Public Health reports 68 COVID-19 cases, far below provincial records
#Health #Coronavirus #Covid-19 #Ottawa #Coronavirus #Ottawa #Coronavirus #Case #Counts #Ottawa #Coronavirus #Vaccinations #Ottawa #Covid-19 #Ottawa #Public #Health
https://t.co/ywneFSyYHw",1/7/2021 20:33,Month_01 Week 1,1,ottawa public health report covid case far provincial record,ottawa public health report case far below provincial record
1.35E+18,"@lindseyehman We have consistently heard that the best place for kids is to be in school.  We have heard community spread in Ottawa's schools has been low.

Today, kids/youth aged 0-19 in Ottawa:
In Hospital:  0
In ICU:  0

Died from COVID (March 2020 to January 2021):  0",1/7/2021 20:32,Month_01 Week 1,1,consistently heard best place kid school heard community spread ottawa school low today kid youth age ottawa hospital icu die covid,consistently heard best place kid school heard community spread ottawa school low today kid youth age ottawa hospital icu die
1.35E+18,"Remote schooling extended until Jan. 25 as Ontario reports record high 3,519 new cases. What you need to know about COVID-19 in Ottawa today from @tayblewett  https://t.co/Xf7jn8UGha",1/7/2021 20:29,Month_01 Week 1,1,remote school extend jan ontario report record high new case need know covid ottawa today,remote school extend jan ontario report record high new case what need know ottawa today
1.35E+18,"Ottawa Public Health reported nearly 100 fewer COVID-19 cases than the provincial system on Thursday, a discrepancy chalked up to a ""large number of case reports"" added late Wednesday. #OttNews https://t.co/swJrXRWwEF",1/7/2021 20:27,Month_01 Week 1,1,ottawa public health report nearly covid case provincial system thursday discrepancy chalked large number case report add late wednesday,ottawa public health report nearly few case provincial system thursday discrepancy chalked large number case report add late wednesday
1.35E+18,"Tyson Garber, a leader in our wastewater COVID-19 research group, spoke to reporters about the new variant. The Citizen said ""Ottawa has become an ad-hoc centre of excellence for tracking the spread of COVID-19 by testing wastewater.” Full story here https://t.co/hUvC9P2EaY https://t.co/XGXpYX2s7s",1/7/2021 20:24,Month_01 Week 1,1,tyson garber leader wastewater covid research group spoke reporter new variant citizen say ottawa become hoc centre excellence track spread covid test wastewater full story,tyson garber leader wastewater research group spoke reporter new variant citizen say ottawa become ad_hoc centre excellence track spread test wastewater full story
1.35E+18,"Fighting Stigma :  What you need to know about COVID-19 in Ottawa on Thursday, Jan. 7: Public health officials have reported more than 19,400 COVID-19 cases across eastern ... Child-care centres will be open, but day camps will not. https://t.co/ANWaT9yoah",1/7/2021 20:24,Month_01 Week 1,1,fight stigma need know covid ottawa thursday jan public health official report covid case across eastern child care centre open camp,fight stigma what need know ottawa thursday jan public health official report more case across eastern child_care centre will open day camp will not
1.35E+18,"@kwadwo777 says the same.... real cases in OTTAWA lower than in October; a positive test does not = case.

But its not about a virus anymore as you know. https://t.co/KDmeZ2l4QX",1/7/2021 20:22,Month_01 Week 1,1,say real case ottawa low positive test case virus anymore know,say real case ottawa low positive test not_case not_about virus anymore know
1.35E+18,Thank you @ctvottawa for supporting local business! #ottawa #supportlocal #community #covid,1/7/2021 20:06,Month_01 Week 1,1,thank support local business,thank support local business
1.35E+18,"@CTVToronto In a tight budget era I can see the tradeoff. 
However @CTVToronto  what would your take be on the  government, in Ottawa, that sold off whatever supply there was at a national level, for pennies on the dollar to China as the virus was taking off ?
That story has legs. 
#topoli",1/7/2021 20:01,Month_01 Week 1,1,tight budget era see tradeoff take government ottawa sell supply national level penny dollar china virus take story leg,tight budget era can see tradeoff however what would take government ottawa sell off whatever supply national level penny dollar china virus take off story leg
1.35E+18,(1) Coronavirus: Ottawa Public Health order bans hockey on outdoor rinks - Ottawa | https://t.co/Fv7DQrcmct https://t.co/lfAxIRugQF,1/7/2021 20:01,Month_01 Week 1,1,coronavirus ottawa public health order ban hockey outdoor rink ottawa,coronavirus ottawa public health order ban hockey outdoor rink ottawa
1.35E+18,Travel industry disappointed as Ottawa forges on with COVID-19 testing requirements https://t.co/DzcmHMP0ii https://t.co/JIB1S1IUpm,1/7/2021 19:50,Month_01 Week 1,1,travel industry disappointed ottawa forge covid test requirement,travel industry disappointed ottawa forge with test requirement
1.35E+18,Travel industry disappointed as Ottawa forges on with COVID-19 testing requirements https://t.co/pwv7K2tU00 https://t.co/TxHggwn7NK,1/7/2021 19:50,Month_01 Week 1,1,travel industry disappointed ottawa forge covid test requirement,travel industry disappointed ottawa forge with test requirement
1.35E+18,Travel industry disappointed as Ottawa forges on with COVID-19 testing requirements https://t.co/TVpdo8Cf2G https://t.co/PJDiYnd0Fl,1/7/2021 19:50,Month_01 Week 1,1,travel industry disappointed ottawa forge covid test requirement,travel industry disappointed ottawa forge with test requirement
1.35E+18,Travel industry disappointed as Ottawa forges on with COVID-19 testing requirements https://t.co/UaAh2hHBHQ https://t.co/pTlJdfPD4F,1/7/2021 19:50,Month_01 Week 1,1,travel industry disappointed ottawa forge covid test requirement,travel industry disappointed ottawa forge with test requirement
1.35E+18,Travel industry disappointed as Ottawa forges on with COVID-19 testing requirements https://t.co/9ShpC22Usj https://t.co/6OcnoEzJzW,1/7/2021 19:50,Month_01 Week 1,1,travel industry disappointed ottawa forge covid test requirement,travel industry disappointed ottawa forge with test requirement
1.35E+18,Ottawa Humane Society CEO Bruce Roney dropping the hammer on irresponsible pet buyers and weak government regulations fueling animal cruelty during the pandemic https://t.co/zAEsCUr11s,1/7/2021 19:50,Month_01 Week 1,1,ottawa humane society ceo bruce roney drop hammer irresponsible pet buyer weak government regulation fuel animal cruelty pandemic,ottawa humane society ceo bruce roney drop hammer irresponsible pet buyer weak government regulation fuel animal cruelty pandemic
1.35E+18,Travel industry disappointed as Ottawa forges on with COVID-19 testing requirements https://t.co/Wq0CGlBJqa https://t.co/2jXD4znv2p,1/7/2021 19:49,Month_01 Week 1,1,travel industry disappointed ottawa forge covid test requirement,travel industry disappointed ottawa forge with test requirement
1.35E+18,Travel industry disappointed as Ottawa forges on with COVID-19 testing requirements https://t.co/pmOJCDFOZP https://t.co/XlKEuJPeWx,1/7/2021 19:49,Month_01 Week 1,1,travel industry disappointed ottawa forge covid test requirement,travel industry disappointed ottawa forge with test requirement
1.35E+18,Travel industry disappointed as Ottawa forges on with COVID-19 testing requirements https://t.co/QyYPiRvJ96 https://t.co/QNA9EFjRoB,1/7/2021 19:49,Month_01 Week 1,1,travel industry disappointed ottawa forge covid test requirement,travel industry disappointed ottawa forge with test requirement
1.35E+18,Travel industry disappointed as Ottawa forges on with COVID-19 testing requirements https://t.co/WTbgdqPmcR https://t.co/TF2SPKccE5,1/7/2021 19:49,Month_01 Week 1,1,travel industry disappointed ottawa forge covid test requirement,travel industry disappointed ottawa forge with test requirement
1.35E+18,Travel industry disappointed as Ottawa forges on with COVID-19 testing requirements https://t.co/9l4lEmwfmS https://t.co/8I5wMm4uv5,1/7/2021 19:49,Month_01 Week 1,1,travel industry disappointed ottawa forge covid test requirement,travel industry disappointed ottawa forge with test requirement
1.35E+18,Travel industry disappointed as Ottawa forges on with COVID-19 testing requirements https://t.co/08ShxL9oJ7 https://t.co/Q8JxC97AjL,1/7/2021 19:49,Month_01 Week 1,1,travel industry disappointed ottawa forge covid test requirement,travel industry disappointed ottawa forge with test requirement
1.35E+18,"Ontario sets new record for COVID-19 cases; 68 cases in Ottawa
For the second time in eight days, there was a discrepancy in reported COVID-19 cases by Ottawa Public Health and Ontario health officials. https://t.co/Av4n1mTm6c",1/7/2021 19:27,Month_01 Week 1,1,ontario set new record covid case case ottawa second time eight discrepancy report covid case ottawa public health ontario health official,ontario set new record case case ottawa second time eight day discrepancy report case ottawa public health ontario health official
