Tweet Id,text,date,Week,Month,text_clean_textual,text_clean_sentiment
1.35E+18,"Federal ministers and health officials provide COVID-19 update – January 5, 2021: In Ottawa, Dr. Theresa Tam, Canada's chief public health officer, and Dr. Howard Njoo, deputy chief public health officer, join federal ministers to provide an ... https://t.co/TW7uhzARYR https://t.co/SdqvGfxJli",1/6/2021 14:06,Month_01 Week 1,1,federal minister health official provide covid update ottawa theresa tam canada chief public health officer howard njoo deputy chief public health officer join federal minister provide,federal minister health official provide update ottawa theresa tam canada chief public health officer howard njoo deputy chief public health officer join federal minister provide
1.35E+18,Pandemic has not stopped the boom in Ottawa cannabis shops https://t.co/omCTDzUvSQ,1/6/2021 13:52,Month_01 Week 1,1,pandemic stop boom ottawa cannabis shop,pandemic not_stop boom ottawa cannabis shop
1.35E+18,"@ipredictevents Thanks man, I don't wanna be a bother, but will I be able to see my girlfriend this year? She's out in Toronto and I'm in Ottawa but with Covid it makes it hard to see eachother",1/6/2021 13:44,Month_01 Week 1,1,thanks man wanna bother able see girlfriend year toronto ottawa covid make hard see eachother,thanks man not_want bother will able see girlfriend year out toronto ottawa with make hard see eachother
1.35E+18,@wakeneducate @CBCOttawa @VeraEtches @OttawaMorning Dude your entire profile is just gibberish and you comment on every Ottawa Covid article to stir up nonsense and controversy. Go somewhere else.,1/6/2021 13:41,Month_01 Week 1,1,dude entire profile gibberish comment ottawa covid article stir nonsense controversy,dude entire profile just gibberish comment ottawa article stir nonsense controversy somewhere else
1.35E+18,"New COVID-19 boarding rules for airlines will be tighter than expected, industry sources say https://t.co/wowcgUYUZt #ottnews #ottawa https://t.co/gbVLoGbiMK",1/6/2021 13:40,Month_01 Week 1,1,new covid boarding rule airline tighter expect industry source say,new boarding rule airline will tighter expect industry source say
1.35E+18,"Can everyone just STAY @ home &amp; only go out for ESSENTIAL TRIPS 

Let me reiterate the essential trips:

Grocery Store ✅
Pharmacy (for meds) ✅
Medical Appointments ✅

Oh, and be Kind to Essential Workers too. 

#Ottawa #OttCity #Pandemic #EssentialsOnly  

@VeraEtches https://t.co/Gt2jbkzxqp",1/6/2021 13:34,Month_01 Week 1,1,stay home amp essential trip reiterate essential trip grocery store pharmacy med medical appointment kind essential worker,can just stay home amp only out essential trip reiterate essential trip grocery store white heavy check mark pharmacy med white heavy check mark medical appointment white heavy check mark kind essential worker too
1.35E+18,"@harriedwife @BevAzevedo @fordnation Justin stay in Ottawa, we don’t need you fucking up Ontario any more than you have . Continue to screw over the entire country. Carbon tax in the middle of a fake virus / pandemic #TrudeauMustGo #endlockdowns",1/6/2021 13:18,Month_01 Week 1,1,justin stay ottawa need fuck ontario continue screw entire country carbon tax middle fake virus pandemic,justin stay ottawa not_need fuck ontario any more continue screw over entire country carbon tax middle fake virus pandemic
1.35E+18,@hollyanndoan @p00rpete @PSCofCanada @SenJaffer Funny how this Veteran/Military hating Liberal Govt &amp; their PS friends in Ottawa need to the military to wipe the Governments arse for their failures since COVID started but they won't hire them &amp; for the record they never have prioritized ex-military for Govt hiring...,1/6/2021 12:50,Month_01 Week 1,1,funny veteran military hat liberal govt amp friend ottawa need military wipe government arse failure covid start hire amp record never prioritize military govt hire,funny veteran military hat liberal govt amp friend ottawa need military wipe government arse failure since start will not_hire amp record never prioritize ex_military govt hire
1.35E+18,How Ottawa’s Tech Scene was Able to Survive and Grow During COVID-19 - Coruzant Technologies https://t.co/4ckvEMP6lS #Technology #Business #BackToWork #FutureOfWork #Ottawa #KANATA #Innovation #Employers #Digital #EmergingTech #CTO #CIO @DubravkaKrizman @KanataNorthBA,1/6/2021 12:50,Month_01 Week 1,1,ottawa tech scene able survive grow covid coruzant technology,ottawa tech scene able survive grow coruzant technology
1.35E+18,Current COVID-19 spike linked to pre-holiday lockdown announcement: Ottawa epidemiologist - CityNews Ottawa https://t.co/mygH3xPwX6,1/6/2021 12:42,Month_01 Week 1,1,current covid spike link pre holiday lockdown announcement ottawa epidemiologist citynews ottawa,current spike link pre_holiday lockdown announcement ottawa epidemiologist citynews ottawa
1.35E+18,"COVID-19 in Ottawa: Fast Facts for Jan. 6, 2021 #ottnews https://t.co/wMqlMCyWga",1/6/2021 12:40,Month_01 Week 1,1,covid ottawa fast fact jan,ottawa fast fact jan
1.35E+18,"Air Canada begs Ottawa for subsidy every time it has an empty sea. AC has the greed to promote Travel Vacations in a time of pandemic, plague easily transmissible in the closed cabins of aircraft.Air Canada’s indifference to Canadian health is clear.Boot the greedy beggars out. https://t.co/RWe88GVjJg",1/6/2021 12:36,Month_01 Week 1,1,air canada begs ottawa subsidy time empty sea greed promote travel vacation time pandemic plague easily transmissible close cabin aircraft air canada indifference canadian health clear boot greedy beggar,air canada begs ottawa subsidy time empty sea greed promote travel vacation time pandemic plague easily transmissible close cabin aircraft air canada indifference canadian health clear boot greedy beggar out
1.35E+18,"Good Morning Ottawa!!
❤️❤️❤️

To help our neighbors stay at home safe, we're going to be offering limited services, in order to keep their devices working.

Due to Covid-19 restrictions, Only one person allowed at a time.
Reception sanitized between each customer. https://t.co/8N4jbyDKvT",1/6/2021 12:00,Month_01 Week 1,1,good morning ottawa help neighbor stay home safe offering limited service order keep device work due covid restriction one person allow time reception sanitize customer,good morning ottawa red heart selector red heart selector red heart selector help neighbor stay home safe offering limited service order keep device work due restriction only one person allow time reception sanitize customer
1.35E+18,Sometime it's hard to tell if there's a lock down happening. I'm not going out of my room unless I'm hyperventilating from lack of fresh air. Dodging people on a narrow street makes my walks not enjoyable. #Ottawa #COVID #Isolation,1/6/2021 11:54,Month_01 Week 1,1,hard tell lock happen room unless hyperventilate lack fresh air dodge people narrow street make walk enjoyable,hard tell lock down happen not_go out room unless hyperventilate lack fresh air dodge people narrow street make walk not_enjoyable
1.35E+18,"@LadyScorcher Sorry I'm just mad because I found out the Ottawa Psych hospital vaccinated everyone, despite not taking in any COVID patients and even people who work from home.",1/6/2021 11:37,Month_01 Week 1,1,sorry mad found ottawa psych hospital vaccinate despite take covid patient even people work home,sorry just mad found out ottawa psych hospital vaccinate despite not_take any patient even people who work home
1.35E+18,"COVID-19 in Ottawa: Fast Facts for Jan. 6, 2021
The latest on COVID-19 in Ottawa for Wednesday, Jan. 6, 2021. https://t.co/mytKiK1wvJ",1/6/2021 11:35,Month_01 Week 1,1,covid ottawa fast fact jan late covid ottawa wednesday jan,ottawa fast fact jan late ottawa wednesday jan
1.35E+18,"Long pandemic could add to extremism, decline in democracy: Defence Department report: OTTAWA — A new research report by the Department of National Defence suggests the longer the COVID-19 pandemic rages, the stronger right-wing ... https://t.co/VQHR1oAtMQ",1/6/2021 11:19,Month_01 Week 1,1,long pandemic add extremism decline democracy defence department report ottawa new research report department national defence suggests longer covid pandemic rage strong right wing,long pandemic could add extremism decline democracy defence department report ottawa new research report department national defence suggests longer pandemic rage strong right_wing
1.35E+18,"Early birds can catch @DavidMacCdn on @OttawaMorning at 6:00 talking CEO compensation and how Canada's top paid C Suiters are #KeepingIt200 even through the pandemic.

Listen live: https://t.co/iurPCZeNeJ
#Ottawa #cdnpoli https://t.co/LJ29OH3tlm",1/6/2021 10:40,Month_01 Week 1,1,early bird catch talk ceo compensation canada top paid suiters even pandemic listen live,early bird can catch talk ceo compensation canada top paid suiters even pandemic listen live
1.35E+18,"And here come the LOCKDOWNS, HEY MAYOR WHERE ARE YOUR GRAND RULES FOR KEEPING PEEPS FROM THE SOUTH COMING HERE  DEAILY TO SHOP..

COVID-19 in Ottawa: Fast Facts for Jan. 6, 2021 https://t.co/Lu4PcCp7mx",1/6/2021 9:54,Month_01 Week 1,1,come lockdown hey mayor grand rule keep peep south come deaily shop covid ottawa fast fact jan,come lockdown hey mayor where grand rule keep peep south come deaily shop ottawa fast fact jan
1.35E+18,"Immigration misrepresentation at border leads to sentence / The Canada Border Services Agency (CBSA) is committed to limiting the spread of COVID-19 in Canada. Ottawa, Ontario The Canada... https://t.co/kmHukyTnx7",1/6/2021 9:42,Month_01 Week 1,1,immigration misrepresentation border lead sentence canada border service agency cbsa commit limit spread covid canada ottawa ontario canada,immigration misrepresentation border lead sentence canada border service agency cbsa commit limit spread canada ottawa ontario canada
1.35E+18,"What you need to know about COVID-19 in Ottawa on Wednesday, Jan. 6 https://t.co/oh2aHsfPGN #ottnews #ottawa https://t.co/KLjDHcHrUn",1/6/2021 9:40,Month_01 Week 1,1,need know covid ottawa wednesday jan,what need know ottawa wednesday jan
1.35E+18,Canada's slow COVID-19 vaccine rollout puts most vulnerable at risk. Here's what can be done to fix it https://t.co/8c8VHhGctA #ottnews #ottawa https://t.co/2XMv4VCdDv,1/6/2021 9:40,Month_01 Week 1,1,canada slow covid vaccine rollout put vulnerable risk fix,canada slow vaccine rollout put most vulnerable risk what can fix
1.35E+18,"@DrRamandeepBrar Politician of Foreign country🇨🇦 is violating Visa rules &amp; indulging in Political activities and demonstrations in India.

Also, Covid-19 Quarantine rule for Foreign Arrivals has been violated.

Can we see a Police FIR?
@DrSJaishankar @MEAIndia @MOS_MEA @HCI_Ottawa
@CanadainIndia",1/6/2021 9:33,Month_01 Week 1,1,politician foreign country violate visa rule amp indulge political activity demonstration india covid quarantine rule foreign arrival violate see police fir,politician foreign country Canada violate visa rule amp indulge political activity demonstration india also quarantine rule foreign arrival violate can see police fir
1.35E+18,"#Ottawa Urged To Ban CEO Bonuses At Companies That Take Wage #Subsidies #covid
https://t.co/zdD86EIasQ",1/6/2021 8:45,Month_01 Week 1,1,urge ban ceo bonus company take wage,urge ban ceo bonus company take wage
1.35E+18,"@citygirl1234589 @teresa_reza @MichelleRempel Well i couldnt go see my 88 yr old https://t.co/i3C9ZSi6NG Arizona 4 her birthday in April my flights were cancelled ex Ottawa 
 no flts no med.covid insurance. She has a severe heart condition+ breast cancer +needs help. im here hard to get tests for nonresidents. Help me!",1/6/2021 7:12,Month_01 Week 1,1,well see old arizona birthday flight cancel ottawa flts med covid insurance severe heart condition breast cancer need help hard test nonresident help,well couldnt see old arizona birthday flight cancel ottawa no_flts no_med insurance severe heart condition breast cancer need help hard get test nonresident help
1.35E+18,"3 months contract opportunity with possible extension for an Intermediate level - SharePoint Designer, in Ottawa. Work would be done remotely until the pandemic situation normalizes. please send your resume to bakul.jain@2iresourcing.ca OR hiten.shah@2iresourcing.ca",1/6/2021 6:50,Month_01 Week 1,1,month contract opportunity possible extension intermediate level sharepoint designer ottawa work remotely pandemic situation normalizes please send resume bakul jain hiten shah,month contract opportunity with possible extension intermediate level sharepoint designer ottawa work would remotely pandemic situation normalizes please send resume bakul jain hiten shah
1.35E+18,"1 year contract opportunity for Sr. Front End Developer (Angular), in Ottawa. 
Work would be done remotely until the pandemic situation normalizes. Reliability level Federal Security clearance is mandatory. 5+ years of development experience. Resume to hiten.shah@2iresourcing.ca",1/6/2021 6:33,Month_01 Week 1,1,year contract opportunity front end developer angular ottawa work remotely pandemic situation normalizes reliability level federal security clearance mandatory year development experience resume hiten shah,year contract opportunity front end developer angular ottawa work would remotely pandemic situation normalizes reliability level federal security clearance mandatory year development experience resume hiten shah
1.35E+18,"COVID-19: Ontario records another record-breaking day with 3,363 new cases - Ottawa CITIZEN ⁦@nayibbukele⁩ ⁦@USAmbSV⁩ 🙏🏻🇨🇦🙏🏻 https://t.co/9uVuqL3Oxz",1/6/2021 6:30,Month_01 Week 1,1,covid ontario record record break new case ottawa citizen,ontario record another record_breaking day with new case ottawa citizen fold hand light skin tone Canada fold hand light skin tone
1.35E+18,"Ottawa confirms that inmates at federal prisons across the country will be receiving COVID-19 vaccines starting this week, while the most vulnerable of our population still wait to be protected.  #CPC  #erinotoole  #canadianconservative #TrudeauMustGo https://t.co/LfbwZ3hRXG",1/6/2021 5:24,Month_01 Week 1,1,ottawa confirms inmate federal prison across country receive covid vaccine start vulnerable population still wait protect,ottawa confirms inmate federal prison across country will receive vaccine start week most vulnerable population still wait protect
1.35E+18,@LIJColdSkull @Senators He’s in Ottawa right now. Just completing his 7 day quarantine and needs to get 4 negative covid test to be able to join the training camp.,1/6/2021 5:21,Month_01 Week 1,1,ottawa right complete quarantine need negative covid test able join training camp,ottawa right just complete day quarantine need get test able join training camp
1.35E+18,My daughters flew to Ottawa and we drove to Sudbury to spend Christmas with my sister and her daughter. My parents drove from Longlac to Sudbury. We had a grand time and we didn't get COVID. We're blessed.,1/6/2021 4:44,Month_01 Week 1,1,daughter flew ottawa drove sudbury spend christmas sister daughter parent drove longlac sudbury grand time covid bless,daughter flew ottawa drove sudbury spend christmas with sister daughter parent drove longlac sudbury grand time not_get bless
1.35E+18,"@JimWatsonOttawa @VeraEtches @KeithEgli @ChiefDiMonte What are the numbers for the flu season in Ottawa or are these numbers now combined with Covid numbers? With symptons being close to the same, How is this beung figured out?",1/6/2021 4:31,Month_01 Week 1,1,number flu season ottawa number combine covid number symptons close beung figure,what number flu season ottawa number combine with number with symptons close beung figure out
1.35E+18,"@JustinTrudeau  @fordnation shame on you ! KINGSTON, ONT. -- CTV News Ottawa confirms that inmates at federal prisons across the country are going to be receiving COVID-19 vaccines starting this week. What about just the seniors who worked ,payed  taxes , decent citizens!!!!?????",1/6/2021 4:30,Month_01 Week 1,1,shame kingston ont ctv news ottawa confirms inmate federal prison across country receive covid vaccine start senior work payed tax decent citizen,shame kingston ont ctv news ottawa confirms inmate federal prison across country receive vaccine start week what just senior who work payed tax decent citizen
1.35E+18,@OttawaCitizen Yes I beleive it is time to serve some whopping fines in Ottawa. By the numbers and all the people not taking Covid seriously in Ottawa. You break lock down rules you should be fined.,1/6/2021 4:07,Month_01 Week 1,1,yes beleive time serve whop fine ottawa number people take covid seriously ottawa break lock rule fin,yes beleive time serve whop fine ottawa number people not_take seriously ottawa break lock down rule should fin
1.35E+18,"@rogerman99 @swoozyoh @Justin_Ling Vaccinations starting this week according to this very report.  

""CTV News Ottawa confirms that inmates at federal prisons across the country are going to be receiving COVID-19 vaccines starting this week.""",1/6/2021 3:27,Month_01 Week 1,1,vaccination start accord report ctv news ottawa confirms inmate federal prison across country receive covid vaccine start,vaccination start week accord very report ctv news ottawa confirms inmate federal prison across country receive vaccine start week
1.35E+18,"@RicMcIver #firewallAB.... you promised during the election to standup to #Ottawa and #Trudeau... So far, based on this “Pandemic”, I’d say now that you’ve finished slapping us in the face you’re about to bow as you kneel to #Trudeau 😑",1/6/2021 2:58,Month_01 Week 1,1,promise election standup far base pandemic say youve finish slap face youre bow kneel,promise election standup far base pandemic would say finish slap face bow kneel expressionless face
1.35E+18,Unable to retweet your tweets again @allan_crawshaw. Twitter claims it is deleted. I am able to use link to the site &amp; create my own tweet. Thanks for sharing Allan. So much Liberal government corruption is happening in Ottawa under the cover of COVID. https://t.co/WR3nMPdobI,1/6/2021 2:44,Month_01 Week 1,1,unable retweet tweet twitter claim delete able use link site amp create tweet thanks share allan much liberal government corruption happen ottawa cover covid,unable retweet tweet again twitter claim delete able use link site amp create tweet thanks share allan much liberal government corruption happen ottawa under cover
1.35E+18,In Ottawa make Dymon storage in charge of vaccinating they’re as ubiquitous AF #ottawa #covid #vaccine,1/6/2021 2:35,Month_01 Week 1,1,ottawa make dymon storage charge vaccinate theyre ubiquitous,ottawa make dymon storage charge vaccinate ubiquitous
1.35E+18,"In Ottawa our Public Health department has an amazing twitter presence. During COVID @ottawahealth informs us, and entertains us. #hcldr https://t.co/6iz9MYN2bx",1/6/2021 2:15,Month_01 Week 1,1,ottawa public health department amaze twitter presence covid informs entertains,ottawa public health department amaze twitter presence informs entertains
1.35E+18,"Hamilton #HamOnt reported 209 new COVID-19 cases today. A new high ever since. 

# in Hamilton today ≈ # in Ottawa + Niagara Region 

#HamOntCOVIDTally",1/6/2021 2:12,Month_01 Week 1,1,hamilton report new covid case today new high ever hamilton today ottawa niagara region,hamilton report new case today new high ever since hamilton today ottawa niagara region
1.35E+18,"@0908e48b16ec447 @angelamarc3 @Laura_Dudas @ottawahealth @VeraEtches Ottawa is not “other countries” - it is a 4,000 square km urban area with endless forests and green belt trails. Covid-19 restrictions are sustainable when you allow people some outlets for exercise and recreation. These should not be discouraged, or given confusing guidelines.",1/6/2021 1:59,Month_01 Week 1,1,ottawa country square urban area endless forest green belt trail covid restriction sustainable allow people outlet exercise recreation discourage give confuse guideline,ottawa not_other country square urban area with endless forest green belt trail restriction sustainable when allow people outlet exercise recreation should not_be discourage give confuse guideline
1.35E+18,ICYMI: ⁦@VeraEtches⁩ on growing Covid-19 cases in #Ottawa and an order to limit gatherings for outdoor activities. ⁦@ctvottawa⁩ #ottnews  https://t.co/tVsMsLvofE,1/6/2021 1:42,Month_01 Week 1,1,icymi grow covid case order limit gathering outdoor activity,icymi grow case order limit gathering outdoor activity
1.35E+18,"Hospital CEO, Ontario COVID-19 advisory team member vacationed in Dominican Republic amid pandemic https://t.co/EHbXSrFpqv #ottnews #ottawa https://t.co/cmaKThkJkG",1/6/2021 1:40,Month_01 Week 1,1,hospital ceo ontario covid advisory team member vacation dominican republic amid pandemic,hospital ceo ontario advisory team member vacation dominican republic amid pandemic
1.35E+18,"Nice priorities Ottawa has. 

Federal inmates set to receive COVID-19 vaccines starting Friday https://t.co/9ND6HMGkFW",1/6/2021 1:37,Month_01 Week 1,1,nice priority ottawa federal inmate set receive covid vaccine start friday,nice priority ottawa federal inmate set receive vaccine start friday
1.35E+18,"Doctors urge high-risk pregnant, breastfeeding women to get access to COVID-19 vaccines https://t.co/aIENs7cPC0 https://t.co/lSfZwctmoe OTTAWA — The head of the Ontario Medical Association says the risk COVID-19 poses to pregnant and breastfeeding women is higher than the risk…",1/6/2021 1:37,Month_01 Week 1,1,doctor urge high risk pregnant breastfeeding woman access covid vaccine ottawa head ontario medical association say risk covid pose pregnant breastfeeding woman high risk,doctor urge high_risk pregnant breastfeeding woman get access vaccine ottawa head ontario medical association say risk pose pregnant breastfeeding woman high risk
1.35E+18,@Colin_Hung @JoeBabaian Ottawa could be better. I'm resisting the temptation to post large chunks of Yeats' The Second Coming given the COVID situation right now. But I'm good. #hcldr.,1/6/2021 1:35,Month_01 Week 1,1,ottawa well resist temptation post large chunk yeats second come give covid situation right good,ottawa could well resist temptation post large chunk yeats second come give situation right good
1.35E+18,Canadian Prime Minister Justin Trudeau on Tuesday said the whole nation was frustrated by how slowly provinces are vaccinating people against the coronavirus and promised Ottawa would help speed the pace of inoculations.​ https://t.co/VhKlBPHkgz,1/6/2021 1:30,Month_01 Week 1,1,canadian prime minister justin trudeau tuesday say whole nation frustrate slowly province vaccinate people coronavirus promise ottawa help speed pace inoculation,canadian prime minister justin trudeau tuesday say whole nation frustrate slowly province vaccinate people against coronavirus promise ottawa would help speed pace inoculation
1.35E+18,City of Ottawa says COVID-19 pandemic has contributed to a spike in anti-Asian racism in the nation's capital - #racesEDJ reporting a particularly dramatic rise in 2020 of the number of hate incidents targeting residents of East Asian descent https://t.co/FmsnrTatrv #onpoli,1/6/2021 1:16,Month_01 Week 1,1,city ottawa say covid pandemic contribute spike anti asian racism nation capital reporting particularly dramatic rise number hate incident target resident east asian descent,city ottawa say pandemic contribute spike anti_asian racism nation capital reporting particularly dramatic rise number hate incident target resident east asian descent
1.35E+18,Some businesses still seem to be thriving in spite of the #pandemic. This  store in #Ottawa’s southeast end certainly is. #COVID19 https://t.co/REPoimuaPk,1/6/2021 1:14,Month_01 Week 1,1,business still seem thrive spite store southeast end certainly,business still seem thrive spite store southeast end certainly
1.35E+18,"Mobile units bringing COVID-19 vaccine to Ottawa long-term care homes for first time #ottnews
https://t.co/YJeSxE6Frk",1/6/2021 1:00,Month_01 Week 1,1,mobile unit bring covid vaccine ottawa long term care home first time,mobile unit bring vaccine ottawa long_term care home first time
1.35E+18,Ottawa or Nova Scotia should take over the province’s COVID-19 response.  Soooo sick of the divisions of power created by Confederation sometimes. #COVID19 #cdnpoli,1/6/2021 0:59,Month_01 Week 1,1,ottawa nova scotia take province covid response soooo sick division power create confederation,ottawa nova scotia should take over province response soooo sick division power create confederation
1.35E+18,"Hundreds of doctors, scientists call for action on COVID-19 aerosols ... wow like member when i said this a year plus ago imma random pot head and i knew .... #Covid19 #Ottawa #Canada https://t.co/p3AxdFumoI",1/6/2021 0:20,Month_01 Week 1,1,hundred doctor scientist call action covid aerosol wow like member say year plus ago imma random pot head knew,hundred doctor scientist call action aerosol wow like member when say year plus ago imma random pot head knew
1.35E+18,"Never mind the purity politics, look at the provinces dragging their asses waiting for Ottawa to bail them out &amp; give them a scapegoat for unpopular but necessary *action* 

Canada coronavirus cases surpass 585K as more politicians admit to holiday travel https://t.co/h2VUcSQM6j",1/6/2021 0:17,Month_01 Week 1,1,never mind purity politics look province drag ass wait ottawa bail amp give scapegoat unpopular necessary action canada coronavirus case surpass politician admit holiday travel,never mind purity politics look province drag ass wait ottawa bail out amp give scapegoat unpopular necessary action canada coronavirus case surpass more politician admit holiday travel
