Tweet Id,text,date,Week,Month,text_clean_textual,text_clean_sentiment
1.35E+18,184 new cases in Ottawa today... so @JimWatsonOttawa @VeraEtches @ottawahealth do you still think we shouldn’t be under lockdown? Do you honestly think we should lift lockdown later this month? What say you?????? #ExtendLockdown #COVID19 #coronavirus #COVIDIOTS #ottawa #ontario,1/3/2021 18:07,Month_01 Week 1,1,new case ottawa today still think shouldnt lockdown honestly think lift lockdown later month say,new case ottawa today still think should not_be under lockdown honestly think should lift lockdown later month what say
1.35E+18,Second OC Transpo driver in two days tests positive for COVID-19 - CityNews Ottawa https://t.co/7ndfNbB7yN,1/3/2021 18:03,Month_01 Week 1,1,second transpo driver two test positive covid citynews ottawa,second transpo driver two day test positive citynews ottawa
1.35E+18,"Wow. Compare these numbers to two weeks ago when Ottawa had no one with COVID in ICU, Rt was hovering around 1.0, and positive test rate was &lt;2%. https://t.co/R4WsWl6MXl",1/3/2021 18:03,Month_01 Week 1,1,wow compare number two ago ottawa one covid icu hover around positive test rate,wow compare number two week ago when ottawa no_one with icu hover around positive test rate
1.35E+18,"Here's the current COVID-19 picture in Ottawa. Everything is trending in the wrong direction a week into lockdown. Hopefully things turn around before the end of the month. 

https://t.co/7ajLPrMdYA",1/3/2021 18:01,Month_01 Week 1,1,current covid picture ottawa trend wrong direction lockdown hopefully thing turn around end month,current picture ottawa trend wrong direction week lockdown hopefully thing turn around end month
1.35E+18,"Oof. With 184 cases reported today, this is a new record for Ottawa after great success bringing numbers down. This is a painful reminder of how quickly we can lose control of this virus. #StayHome as you're able, #WearAMask, wash your hands, and say well, all. #COVID19Ontario https://t.co/NNKc0Z5pzF",1/3/2021 17:59,Month_01 Week 1,1,oof case report today new record ottawa great success bring number painful reminder quickly lose control virus able wash hand say well,oof with case report today new record ottawa great success bring number down painful reminder quickly can lose control virus able wash hand say well
1.35E+18,UPDATED: No new COVID-19 deaths recorded in Ottawa for eight straight days; Ontario sees slip in new daily cases https://t.co/4jqLobzvzW https://t.co/ynamz8WzTT,1/3/2021 17:58,Month_01 Week 1,1,update new covid death record ottawa eight straight ontario see slip new daily case,update no_new death record ottawa eight straight day ontario see slip new daily case
1.35E+18,Why does CBC report 184 yet OPH reports 100 new Covid cases in Ottawa today @ottawahealth,1/3/2021 17:55,Month_01 Week 1,1,cbc report oph report new covid case ottawa today,why cbc report yet oph report new case ottawa today
1.35E+18,"UPDATED LOCAL FIGURES: Ottawa Public Health says 184 more people in Ottawa have tested positive for COVID-19.

The per capita rate is on the rise, and there are now 6 people in ICU, up from 3 on Saturday. #ottnews 

Full details: https://t.co/F3OsQ0kziJ",1/3/2021 17:54,Month_01 Week 1,1,update local figure ottawa public health say people ottawa test positive covid per caput rate rise people icu saturday full detail,update local figure ottawa public health say more people ottawa test positive per caput rate rise people icu saturday full detail
1.35E+18,@RobertFife @ctvqp @EvanLSolomon There is no plan to distribute Covid 19 vaccine. Where? When?’No one knows. Tried Ottawa. Tried Ontario. No one knows. Maybe Evan can help.,1/3/2021 17:54,Month_01 Week 1,1,plan distribute covid vaccine one know try ottawa try ontario one know evan help,no_plan distribute vaccine where when no_one know try ottawa try ontario no_one know maybe evan can help
1.35E+18,"Byward Market, Ottawa, Canada, during Covid-19 lockdown. The poutine shack by the entrance to The Lookout Bar, the city's longest-running LGBTQA1, since 1997 (It is sensitive about being called the oldest.). Morning, January 3, 2021. https://t.co/Xb498sKTi2",1/3/2021 17:39,Month_01 Week 1,1,byward market ottawa canada covid lockdown poutine shack entrance lookout bar city long run lgbtqa sensitive call old morning,byward market ottawa canada lockdown poutine shack entrance lookout bar city longest_running lgbtqa since sensitive call old morning
1.35E+18,"Byward Market, Ottawa, Canada, during Covid-19 lockdown. The poutine shack by the entrance to The Lookout, likely the city's longest-running LGBTQA1 bar. Morning, January 3, 2021. https://t.co/3TnFqRRzQH",1/3/2021 17:15,Month_01 Week 1,1,byward market ottawa canada covid lockdown poutine shack entrance lookout likely city long run lgbtqa bar morning,byward market ottawa canada lockdown poutine shack entrance lookout likely city longest_running lgbtqa bar morning
1.35E+18,"Ottawa Public Health reporting 184 new cases of COVID-19 in Ottawa today. 

Third straight day with 100+ cases. #ottnews",1/3/2021 17:05,Month_01 Week 1,1,ottawa public health reporting new case covid ottawa today third straight case,ottawa public health reporting new case ottawa today third straight day with case
1.35E+18,Trending in the wrong direction: COVID-19 in Ottawa: Ontario reports 100 new cases https://t.co/HCRydHLJlx,1/3/2021 16:59,Month_01 Week 1,1,trend wrong direction covid ottawa ontario report new case,trend wrong direction ottawa ontario report new case
1.35E+18,@DavidWTRattray @ctvottawa Joke is there is 12 people in ottawa hospitals with covid and 3 in icu!,1/3/2021 16:46,Month_01 Week 1,1,joke people ottawa hospital covid icu,joke people ottawa hospital with icu
1.35E+18,"@human3500 ""Because Ottawa is a FundThePolice town"". And yes OPS will be stepping up to drive people in cases of emergencies because there isn't enough resources to accommodate the need right now and this has been happening before the pandemic and any police budget increases.",1/3/2021 16:21,Month_01 Week 1,1,ottawa fundthepolice town yes ops step drive people case emergency enough resource accommodate need right happen pandemic police budget increase,ottawa fundthepolice town yes ops will step drive people case emergency not_enough resource accommodate need right happen pandemic any police budget increase
1.35E+18,Public Health Ontario is reporting 100 new COVID-19 cases in Ottawa on Sunday. #ottnews https://t.co/q5bcBt3OWu,1/3/2021 16:15,Month_01 Week 1,1,public health ontario reporting new covid case ottawa sunday,public health ontario reporting new case ottawa sunday
1.35E+18,Good news! Canal appears to have received the Covid vaccine! We'll be skating in no time! #Ottawa @NCC_Skateway https://t.co/oNk5znZpAF,1/3/2021 16:13,Month_01 Week 1,1,good news canal appear receive covid vaccine skate time,good news canal appear receive vaccine will skate no_time
1.35E+18,"Air travellers entering Canada must soon have a negative COVID-19 test before arriving, Ottawa says https://t.co/nVIfdi1EiY",1/3/2021 16:12,Month_01 Week 1,1,air traveller enter canada soon negative covid test arrive ottawa say,air traveller enter canada must soon test arrive ottawa say
1.35E+18,"@NaheedD There are 12 people in the hospital with Covid in Ottawa. 12.

3 in ICU. 3.

That is nowhere near overrun. In almost a year of dealing with this, how much has hospital capacity and staffing increased?",1/3/2021 16:05,Month_01 Week 1,1,people hospital covid ottawa icu nowhere near overrun almost year deal much hospital capacity staff increase,people hospital with ottawa icu nowhere near overrun almost year deal with much hospital capacity staff increase
1.35E+18,"@Diminishablekit We're seeing that with COVID - I live in Ottawa, which is the National Capital. We have a strong tech sector, lots of gov't jobs, etc. WFH is easy here. Our COVID numbers are low.

Toronto has a large service industry, etc. and immigrant class - COVID is exploding there.",1/3/2021 16:04,Month_01 Week 1,1,see covid live ottawa national capital strong tech sector lot gov job etc wfh easy covid number low toronto large service industry etc immigrant class covid explode,see with live ottawa national capital strong tech sector lot gov not_job etc wfh easy number low toronto large service industry etc immigrant class explode
1.35E+18,So the 85 Personal Days #Trudeau took in 2020 wasn't enough 🤔 Good thing nothing bad like a #Pandemic hit the 🌎 to interfere with his part time job as PM of 🇨🇦 😲 #WheresTrudeau #WhereIsTrudeau #CowardOfTheCottage #Canada #cdnpoli #cdnmedia #Ottawa #Toronto #ldnont 👇👇👇👇👇 https://t.co/9G8V6hbOLe,1/3/2021 16:03,Month_01 Week 1,1,personal take enough good thing nothing bad like hit interfere part time job,personal day take not_enough think face good thing nothing bad like hit globe show Americas interfere with part time job Canada astonish face backhand index point down backhand index point down backhand index point down backhand index point down backhand index point down
1.35E+18,@RochBourassa @RoughChopOttawa @JimWatsonOttawa @MacLeodLisa I just did Ottawa Light Run on Jan 1 and the route is supposed to take you around the rink at City Hall. It was SO crowded (and I am SO immunocompromised) that I bailed on that section. The utter lack of leadership in the face of this virus is infuriating.,1/3/2021 16:02,Month_01 Week 1,1,ottawa light run jan route suppose take around rink city hall crowd immunocompromised bail section utter lack leadership face virus infuriate,just ottawa light run jan route suppose take around rink city hall crowd immunocompromised bail section utter lack leadership face virus infuriate
1.35E+18,"What you need to know about COVID-19 in Ottawa on Sunday, Jan. 3 https://t.co/yhLgoUcvUC",1/3/2021 16:00,Month_01 Week 1,1,need know covid ottawa sunday jan,what need know ottawa sunday jan
1.35E+18,"Revisiting one of @intl_ed_news most popular posts this year: Trista Hollweck's view of #Schoolclosure in #Ottawa, #Ontario, #Canada:  https://t.co/fQs6CbWwJL 
@tristateach #COVID__19 @EdChangeSIG @ICSEIglobal @drkarenedge @HargreavesBC @arceducation1 https://t.co/ge6l162u3s",1/3/2021 16:00,Month_01 Week 1,1,revisit one popular post year trista hollweck view,revisit one most popular post year trista hollweck view
1.35E+18,Dr. Kyeremanteng in Ottawa is giving it his all to care for COVID patients while also speaking out in favour of a more balanced approach to restrictions. A true health care hero!! https://t.co/eBnGuEIcao https://t.co/2gchRPUqhW,1/3/2021 15:54,Month_01 Week 1,1,kyeremanteng ottawa give care covid patient speak favour balance approach restriction true health care hero,kyeremanteng ottawa give care patient also speak out favour more balance approach restriction true health care hero
1.35E+18,@wildrice77 @sikander @celliottability @JimWatsonOttawa @ctvottawa How many tested in Ottawa? How many ICU beds does Ottawa have? How many of those beds are occupied by persons w/ COVID-19? What is their age? Comorbidities? What numbers are expected to come from Ottawa given the sewage observations?,1/3/2021 15:53,Month_01 Week 1,1,test ottawa icu bed ottawa bed occupy person covid age comorbidities number expect come ottawa give sewage observation,many test ottawa many icu bed ottawa many bed occupy person what age comorbidities what number expect come ottawa give sewage observation
1.35E+18,"#ottnews Ruckify has EVERYTHING a family could ever want for safe outdoor activity during COVID lockdown
.
Also, the run on our fitness equipment is truly spectacular... don’t believe in New Years resolutions.. BUT truly love ❤️ HELPING people in #Ottawa 👇 https://t.co/8vPUQ1kscO",1/3/2021 15:48,Month_01 Week 1,1,ruckify family ever safe outdoor activity covid lockdown run fitness equipment truly spectacular believe new year resolution truly love help people,ruckify family could ever want safe outdoor activity lockdown also run fitness equipment truly spectacular not_believe new year resolution truly love red heart selector help people backhand index point down
1.35E+18,@global_ottawa Fake Numbers!!  Fake News!!  Fake Virus!!,1/3/2021 15:48,Month_01 Week 1,1,fake number fake news fake virus,fake number fake news fake virus
1.35E+18,"https://t.co/tX0FmG3Ldf COVID-19 in Ottawa: Ontario reports 100 new cases https://t.co/7Nsb1ZKJnC...
https://t.co/DaOhD3iUMF",1/3/2021 15:47,Month_01 Week 1,1,covid ottawa ontario report new case,ottawa ontario report new case
1.35E+18,No new COVID-19 deaths recorded in Ottawa for eight straight days; Ontario sees slip in new daily cases https://t.co/1MJaw9sOea https://t.co/xF7Ws3kWIF,1/3/2021 15:45,Month_01 Week 1,1,new covid death record ottawa eight straight ontario see slip new daily case,no_new death record ottawa eight straight day ontario see slip new daily case
1.35E+18,"The number of new COVID-19 cases remains high in Ottawa with a triple-digit report from Public Health Ontario.

Updated figures from Ottawa Public Health are due this afternoon. #ottnews 

https://t.co/Myw7m0h0Ku",1/3/2021 15:43,Month_01 Week 1,1,number new covid case remains high ottawa triple digit report public health ontario update figure ottawa public health due afternoon,number new case remains high ottawa with triple_digit report public health ontario update figure ottawa public health due afternoon
1.35E+18,"Ontario reports 2,964 new COVID-19 cases and 25 more deaths https://t.co/hY0ukL7qtN #ottnews #ottawa https://t.co/HchAltPhvv",1/3/2021 15:40,Month_01 Week 1,1,ontario report new covid case death,ontario report new case more death
1.35E+18,"Inside an Ottawa hospital's COVID-19 ward: Exhaustion, loneliness, guilt, and living in the moment https://t.co/e0dqMCdwr3 https://t.co/nkUUdPm4kR",1/3/2021 15:38,Month_01 Week 1,1,inside ottawa hospital covid ward exhaustion loneliness guilt living moment,inside ottawa hospital ward exhaustion loneliness guilt living moment
1.35E+18,Ontario health officials are reporting 100 new cases of COVID-19 in Ottawa today. #ottnews,1/3/2021 15:23,Month_01 Week 1,1,ontario health official reporting new case covid ottawa today,ontario health official reporting new case ottawa today
1.35E+18,UPDATE: Ottawa COVID-19 rates climb; Ontario breaks single-day record for fourth day this week - CityNews Ottawa https://t.co/U2GlTbIELK,1/3/2021 15:19,Month_01 Week 1,1,update ottawa covid rate climb ontario break single record fourth citynews ottawa,update ottawa rate climb ontario break single_day record fourth day week citynews ottawa
1.35E+18,"@FordNation  #FordNation 

How's your lockdown working? Time for Plan B? Oh, no Plan B?

Ottawa Citizen: COVID-19: Ontario records another record-breaking day with 3,363 new cases.
https://t.co/vUVpEFTJS1

via @GoogleNews",1/3/2021 15:17,Month_01 Week 1,1,lockdown work time plan plan ottawa citizen covid ontario record record break new case via,lockdown work time plan no_plan ottawa citizen ontario record another record_breaking day with new case via
1.35E+18,"@neonghost41 Thinking of Ottawa. Might be a nicer pace. I can't do small towns, and I've been in Toronto for over 15 years now. Always thought next move would be New York or LA (maybe even Vancouver), but now we're looking at mid-size cities because family and work, and a pandemic...",1/3/2021 15:17,Month_01 Week 1,1,think ottawa nicer pace small town toronto year always thought next move new york even vancouver look mid size city family work pandemic,think ottawa might nicer pace cannot_do small town toronto over year always thought next move would new york maybe even vancouver look mid_size city family work pandemic
1.35E+18,@imgrund @deniseCFIHSE @_JasonChapman Especially since most residents will actually take the vaccine. At a friends LTC home here in ottawa only 67 employees out of 200 took the vaccine. Now they‘re on lockdown after an employee brought in the virus. This isn’t being discussed nearly enough.,1/3/2021 14:47,Month_01 Week 1,1,jasonchapman especially resident actually take vaccine friend ltc home ottawa employee take vaccine theyre lockdown employee brought virus isnt discuss nearly enough,jasonchapman especially since most resident will actually take vaccine friend ltc home ottawa only employee out take vaccine lockdown employee brought virus not_be discuss nearly enough
1.35E+18,"@ottawahealth There are 12 people in ottawa hospital and 3 people in ICU for covid. I understand cases counts are going up, but I wonder does this warrant a complete lockdown.... esp given its impact on people’s mental health. I’m not pro/anti lockdown honestly just trying to understand.",1/3/2021 14:36,Month_01 Week 1,1,people ottawa hospital people icu covid understand case count wonder warrant complete lockdown esp give impact people mental health pro anti lockdown honestly try understand,people ottawa hospital people icu understand case count wonder warrant complete lockdown esp give impact people mental health not_pro anti lockdown honestly just try understand
1.35E+18,"With all the ""Happy New Year"" celebrations, &amp; with those who chose to travel, how many will end up paying with their lives? 

Inside an Ottawa hospital's COVID-19 ward: Exhaustion, loneliness, guilt, and living in the moment https://t.co/WFIcbjiMIm",1/3/2021 14:30,Month_01 Week 1,1,happy new year celebration amp chose travel end pay life inside ottawa hospital covid ward exhaustion loneliness guilt living moment,with happy new year celebration amp with who chose travel many will end pay with life inside ottawa hospital ward exhaustion loneliness guilt living moment
1.35E+18,@grayfogboundst1 @nougatjesus That the attitude I was talking you about in Quebec! No one really talk about the many issues of the caq (covid) but if they can pin smt on Ottawa or better the libs/Trudeau they will talk about it for days! obvious the media  took a right wings turn and prefer the cons/bloc,1/3/2021 14:30,Month_01 Week 1,1,attitude talk quebec one really talk issue caq covid pin smt ottawa well libs trudeau talk obvious medium take right wing turn prefer con bloc,attitude talk quebec no_one really talk many issue caq can pin smt ottawa well libs trudeau will talk day obvious medium take right wing turn prefer con bloc
1.35E+18,Ontario reports record COVID-19 cases as more politicians cop to foreign travel | Ottawa Citizen https://t.co/LyYIX5bs96,1/3/2021 14:26,Month_01 Week 1,1,ontario report record covid case politician cop foreign travel ottawa citizen,ontario report record case more politician cop foreign travel ottawa citizen
1.35E+18,"@RChilderhose @sunlorrie In Ottawa we have lost 0.000392% of our population from this deadly virus, so even opening a funeral home isn’t a good idea",1/3/2021 13:36,Month_01 Week 1,1,ottawa lose population deadly virus even opening funeral home isnt good idea,ottawa lose population deadly virus even opening funeral home not_a good idea
1.35E+18,@g3man43 Kingston General Hospital - the main hospital between Ottawa and Toronto - zero COVID patients. That's right. Zero.,1/3/2021 13:18,Month_01 Week 1,1,kingston general hospital main hospital ottawa toronto zero covid patient right zero,kingston general hospital main hospital ottawa toronto zero patient right zero
1.35E+18,"When are people in Ottawa &amp; Ontario going to take Covid seriously.  They don’t get it, the numbers keep going up like no one cares.

Frustrating for those of us trying our best then we see examples of people who just don’t care.

THIS WILL NEVER END IF WE DON'T SMARTEN UP PEOPLE! https://t.co/lBtwTbMvnj",1/3/2021 13:09,Month_01 Week 1,1,people ottawa amp ontario take covid seriously number keep like one care frustrate try best see example people care never end smarten people,when people ottawa amp ontario take seriously not_get number keep like no_one care frustrate try best see example people who just not_care will never end not_smarten people
1.35E+18,How Ottawa’s Tech Scene was Able to Survive and Grow During COVID-19 - Coruzant Technologies https://t.co/4ckvEMP6lS #Technology #Business #BackToWork #FutureOfWork #Ottawa #KANATA #Innovation #Employers #Digital #EmergingTech #CTO #CIO @DubravkaKrizman @KanataNorthBA,1/3/2021 12:47,Month_01 Week 1,1,ottawa tech scene able survive grow covid coruzant technology,ottawa tech scene able survive grow coruzant technology
1.35E+18,"@phldenault @ottawacity @VeraEtches @ottawahealth @JimWatsonOttawa Didn't hear about Super Spreader Saturday's at Ottawa City Hall?  Almost as bad as LPC @JustinTrudeau promoting travel by giving you $1000 to go to your favourite Covid filled destination, quarantining is optional?",1/3/2021 12:05,Month_01 Week 1,1,hear super spreader saturday ottawa city hall almost bad lpc promote travel give favourite covid fill destination quarantine optional,not_hear super spreader saturday ottawa city hall almost bad lpc promote travel give favourite fill destination quarantine optional
1.35E+18,"@smwgilbert I'm high risk. My doctor doesn't want me leaving my apartment for my own safety. I'm furious at how Ottawa, &amp; Ontario are handling the pandemic lately as it just means I'm stuck at home so much longer.

(Continued...)",1/3/2021 11:41,Month_01 Week 1,1,high risk doctor leave apartment safety furious ottawa amp ontario handle pandemic lately mean stuck home much longer continued,high risk doctor not_want leave apartment safety furious ottawa amp ontario handle pandemic lately just mean stuck home much longer continued
1.35E+18,"Inside an Ottawa hospital's COVID-19 ward: Exhaustion, loneliness, guilt, and living in the moment | Ottawa Citizen https://t.co/O9WkPiqCrT",1/3/2021 11:40,Month_01 Week 1,1,inside ottawa hospital covid ward exhaustion loneliness guilt living moment ottawa citizen,inside ottawa hospital ward exhaustion loneliness guilt living moment ottawa citizen
1.35E+18,"How will the #CHEMCI match end?

|#AllAboutMyBrain #dangote #Bitcoin #lockdown #sundayvibes #BEEF #Lockdown2 Ozil Ottawa Canada Drake Tariq #Crypto #COVID19 #marr Japa #ChelseaFC #ManCity Piper Tommy #CoronaVaccine #coronamaatregelen #coronavirus",1/3/2021 11:40,Month_01 Week 1,1,match end ozil ottawa canada drake tariq japa piper tommy,will match end ozil ottawa canada drake tariq japa piper tommy
1.35E+18,"What you need to know about COVID-19 in Ottawa on Sunday, Jan. 3 https://t.co/qf1ac50xGF #ottnews #ottawa https://t.co/w2A6sjU5MH",1/3/2021 9:40,Month_01 Week 1,1,need know covid ottawa sunday jan,what need know ottawa sunday jan
1.35E+18,"Good morning. Here is the latest news on COVID-19 and its impact on Ottawa.

https://t.co/Q51nCTuFkK",1/3/2021 9:39,Month_01 Week 1,1,good morning late news covid impact ottawa,good morning late news impact ottawa
1.35E+18,"https://t.co/4TwvzaRyZ9 COVID-19 in Ottawa: Fast Facts for Jan. 3, 2021 https://t.co/HkxCn2hfnQ...
https://t.co/HZN8hmQl9J",1/3/2021 9:35,Month_01 Week 1,1,covid ottawa fast fact jan,ottawa fast fact jan
1.35E+18,"@CoachFitzGerald @gmbutts You mean like Patty, a Liberal cabinet minister in Ottawa racking up the frequent flyer miles during this pandemic? There is more than enough blame to go around. None of which helps people feel any govt is helping.",1/3/2021 8:21,Month_01 Week 1,1,mean like patty liberal cabinet minister ottawa rack frequent flyer mile pandemic enough blame around none help people feel govt help,mean like patty liberal cabinet minister ottawa rack frequent flyer mile pandemic more enough blame around none help people feel any govt help
1.35E+18,"@HaveWeAllGoneM1 @jkenney If Premier Kenney gets off the fence re covid lockdown ... he regains the confidence of Albertans, begins the long overdue response to Ottawa's war against us &amp; stands up with Americans to #DrainTheSwamp in 2021.

If not, his will be a wasted life of political compromise. #abpoli",1/3/2021 7:36,Month_01 Week 1,1,premier kenney fence covid lockdown regains confidence albertans begin long overdue response ottawa war amp stand american waste life political compromise,premier kenney get off fence lockdown regains confidence albertans begin long overdue response ottawa war against amp stand with american not_his will waste life political compromise
1.35E+18,OC Transpo driver tests positive for COVID-19 - CityNews Ottawa https://t.co/GjMozHpSxg,1/3/2021 7:09,Month_01 Week 1,1,transpo driver test positive covid citynews ottawa,transpo driver test positive citynews ottawa
1.35E+18,UPDATE: Ottawa COVID-19 rates climb; Ontario breaks single-day record for fourth day this week - CityNews Ottawa https://t.co/3KRyRoptDJ,1/3/2021 7:08,Month_01 Week 1,1,update ottawa covid rate climb ontario break single record fourth citynews ottawa,update ottawa rate climb ontario break single_day record fourth day week citynews ottawa
1.35E+18,"Goodbye gloomy 2020 with #Covid #virus!
Welcome 2021 with #new #hope! 

What do you expect #Ottawa to look like in 2021?
Please take part in the survey below to make Ottawa more #vibrant through #sports #initiatives! 
Something #good may #happen to you😊
👉https://t.co/PQMGg9hCQl https://t.co/8h1CGyJX1A",1/3/2021 6:19,Month_01 Week 1,1,goodbye gloomy welcome expect look like please take part survey make ottawa,goodbye gloomy with welcome with what expect look like please take part survey below make ottawa more smile face with smile eye backhand index point right
1.35E+18,"#Canada will require a negative COVID-19 test result from all arriving passengers effective 7th January,2021. 

#covid #COVID19 #Quarantine #pandemic #canada #northamerican #UnitedKingdom #Vancouver #montreal #Toronto #Ottawa

Read the full story here: https://t.co/K45hE2wTeM",1/3/2021 5:29,Month_01 Week 1,1,require negative covid test result arrive passenger effective read full story,will require test result arrive passenger effective read full story
