Tweet Id,text,date,Week,Month,text_clean_textual,text_clean_sentiment
1.38E+18,"Canada is now behind more than 40 countries in terms of COVID-19 vaccinations per capita.

How Ottawa's mistakes ensured you'll likely be vaccinated six months later than everyone else | National Post https://t.co/4USspZoKqS",4/11/2021 18:35,Month_04 Week 2,4,canada behind country term covid vaccination per caput ottawa mistake ensure likely vaccinate six month later national post,canada behind more country term vaccination per caput ottawa mistake ensure will likely vaccinate six month later else national post
1.38E+18,"@ronmortgageguy Ottawa had the hottest RE prices increase during pandemic, all his colleagues jumped to buy make sense he doesn’t want to upset them",4/11/2021 18:33,Month_04 Week 2,4,ottawa hottest price increase pandemic colleague jumped buy make sense doesnt upset,ottawa hottest price increase pandemic colleague jumped buy make sense not_want upset
1.38E+18,@MacLeodLisa I Am 48 Years Old and I Live in Downtown Ottawa and I Have High Functioning Asperger Syndrome and I Am Still Awaiting My First Covid Shot and I Am Starting To Get Very Worried I Have No Idea When I Will Get Mine,4/11/2021 18:33,Month_04 Week 2,4,year old live downtown ottawa high function asperger syndrome still await first covid shot start worried idea,year old live downtown ottawa high function asperger syndrome still await first shot start get very worried no_idea when will get
1.38E+18,Province expanding COVID-19 vaccinations to more pharmacies in Ottawa and eastern Ontario https://t.co/Z5BwPWHqP1 via @ctvottawa,4/11/2021 18:32,Month_04 Week 2,4,province expand covid vaccination pharmacy ottawa eastern ontario via,province expand vaccination more pharmacy ottawa eastern ontario via
1.38E+18,Four schools in Ottawa Valley confirm COVID-19 cases over 24-hour period - CityNews Ottawa https://t.co/cXGUnNh0dZ,4/11/2021 18:31,Month_04 Week 2,4,four school ottawa valley confirm covid case period citynews ottawa,four school ottawa valley confirm case over hour period citynews ottawa
1.38E+18,Gans: Start thinking of COVID-19 as a virus with no end | Ottawa Citizen https://t.co/ccnuAzq1Kf,4/11/2021 18:28,Month_04 Week 2,4,gans start think covid virus end ottawa citizen,gans start think virus with no_end ottawa citizen
1.38E+18,Ottawa breaks single-day COVID-19 case count record yet again; hospitalizations at all time high - CityNews Ottawa https://t.co/JAT0Wv0uHo,4/11/2021 18:26,Month_04 Week 2,4,ottawa break single covid case count record hospitalization time high citynews ottawa,ottawa break single_day case count record yet again hospitalization time high citynews ottawa
1.38E+18,@ottawacity I Am 48 Years Old and I Live In Downtown Ottawa and I Have High Functioning Asperger Syndrome and I Am Still Waiting For My First Covid Shot and I'm Getting Very Worried I Have No Idea When I Will Get Mine,4/11/2021 18:20,Month_04 Week 2,4,year old live downtown ottawa high function asperger syndrome still wait first covid shot worried idea,year old live downtown ottawa high function asperger syndrome still wait first shot get very worried no_idea when will get
1.38E+18,Holy fuck I just got my 2nd vaccine shot 😭❤️✌️ #happyday #Ottawa,4/11/2021 18:17,Month_04 Week 2,4,holy fuck vaccine shot,holy fuck just get vaccine shot loudly cry face red heart victory hand
1.38E+18,"@gmbutts I know, right? If only the inept gov in Ottawa had procured vaccine or enabled Canadian manufacturing alot earlier instead of sitting on their thumbs",4/11/2021 18:17,Month_04 Week 2,4,know right inept gov ottawa procure vaccine enable canadian manufacturing alot earlier instead sit thumb,know right only inept gov ottawa procure vaccine enable canadian manufacturing alot earlier instead sit thumb
1.38E+18,Off to Ottawa today.  I was excited to try the @HaztechSafety rapid antigen test right at the airport.  What a great service! https://t.co/SUBF2HCGNS,4/11/2021 18:08,Month_04 Week 2,4,ottawa today excite try rapid antigen test right airport great service,off ottawa today excite try rapid antigen test right airport what great service
1.38E+18,Ottawa’s Covid numbers rn. 👀,4/11/2021 18:04,Month_04 Week 2,4,ottawa covid number,ottawa number eye
1.38E+18,MIL staying with us here in #Ottawa just came back from receiving her 1st AZ vaccine! 👏 https://t.co/a3qE32NUQt,4/11/2021 17:49,Month_04 Week 2,4,mil stay come back receive vaccine,mil stay with just come back receive vaccine clap hand
1.38E+18,Special education teachers in Ottawa are expected to begin rolling up their sleeves this week to receive the COVID-19 vaccine. #ottnews  https://t.co/30kzclzRaV,4/11/2021 17:44,Month_04 Week 2,4,special education teacher ottawa expect begin roll sleeve receive covid vaccine,special education teacher ottawa expect begin roll sleeve week receive vaccine
1.38E+18,Ottawa sets record for 3rd day in row with 370 new COVID-19 cases https://t.co/M52YKbeTMw #ottnews #ottawa https://t.co/FJYvqE2BZe,4/11/2021 17:40,Month_04 Week 2,4,ottawa set record row new covid case,ottawa set record day row with new case
1.38E+18,Ottawa Public Health @OttawaHealth: Who can currently get the COVID-19 vaccine? https://t.co/wk81tE59X6,4/11/2021 17:31,Month_04 Week 2,4,ottawa public health currently covid vaccine,ottawa public health who can currently get vaccine
1.38E+18,"@Carl31508201 @ev0l @ahmadeofficial The actual data would not support that. Here is the breakdown of covid cases in Ottawa by age. Older ppl have been vaccinated...

90s: 0
80s: 0
70s: 12
60s: 24 
50s: 39 
40s: 52 
30s: 68
20s: 90
10-19: 46 
0-9: 39",4/11/2021 17:30,Month_04 Week 2,4,actual data support breakdown covid case ottawa age old ppl vaccinate,actual data would not_support breakdown case ottawa age old ppl vaccinate
1.38E+18,when are things going to speed up with vaccines in ontario??? this is getting ridiculous!! ppl in ottawa have no appointments even!!! #ottawa #Ontario #vaccine #fail #StayHome @JustinTrudeau @HomerTien @fordnation @CanadianPM @JimWatsonOttawa,4/11/2021 17:29,Month_04 Week 2,4,thing speed vaccine ontario ridiculous ppl ottawa appointment even,when thing speed with vaccine ontario get ridiculous ppl ottawa no_appointment even
1.38E+18,Nepean MPP Lisa MacLeod says these pharmacies across Ottawa will also start administering the AstraZeneca vaccine to individuals 55 and over starting this week. #ottnews https://t.co/embpcuqHDG,4/11/2021 17:29,Month_04 Week 2,4,nepean mpp lisa macleod say pharmacy across ottawa start administer astrazeneca vaccine individual start,nepean mpp lisa macleod say pharmacy across ottawa will also start administer astrazeneca vaccine individual over start week
1.38E+18,Ottawa breaks another COVID-19 case count record with 370 cases Sunday https://t.co/CJg3TVEJyQ,4/11/2021 17:24,Month_04 Week 2,4,ottawa break covid case count record case sunday,ottawa break another case count record with case sunday
1.38E+18,"@OttawaHealth appreciation tweet: yesterday at noon I went for a COVID test, was in and out in 30 min. I got my negative result back less than 12 hours. Thanks, Ottawa, for such a smooth experience!",4/11/2021 17:23,Month_04 Week 2,4,appreciation tweet yesterday noon covid test negative result back less thanks ottawa smooth experience,appreciation tweet yesterday noon test out min get result back less hour thanks ottawa smooth experience
1.38E+18,"@strauss_matt Media rhetoric aside. 
We all know our ICUs in Ontario have been at operating in the 90% range for decades. Pre Covid, every Flu season would put us over 100%, sometimes 130%, as seen in Ottawa a coupe years back. 
We waste BILLIONS on nonsense and somehow can't hire some staff.",4/11/2021 17:20,Month_04 Week 2,4,medium rhetoric aside know icu ontario operating range decade pre covid flu season put see ottawa coupe year back waste billion nonsense hire staff,medium rhetoric aside know icu ontario operating range decade pre flu season would put over see ottawa coupe year back waste billion nonsense somehow cannot_hire staff
1.38E+18,"Ottawa Ontario, Canada has 370 new coronavirus cases on Sunday, it is the highest single-day total since the start of the pandemic. https://t.co/dGK9ulEYKb",4/11/2021 17:18,Month_04 Week 2,4,ottawa ontario canada new coronavirus case sunday high single total start pandemic,ottawa ontario canada new coronavirus case sunday high single_day total since start pandemic
1.38E+18,Ottawa Local demands #COVID19 vaccine priority for hero transit workers risking their lives to provide critical transportation during the pandemic. https://t.co/XrIVofRK7M #covidvacccine #Labour,4/11/2021 17:15,Month_04 Week 2,4,ottawa local demand vaccine priority hero transit worker risk life provide critical transportation pandemic,ottawa local demand vaccine priority hero transit worker risk life provide critical transportation pandemic
1.38E+18,"@_johnbye @ResearchGate @toadmeister @ClareCraigPath @profnfenton He’s been busy upsetting lots of colleagues/students &amp; former employer Ottawa Uni as per few minutes ‘research’ on Wikipedia (referenced &amp; balanced). 

Any self respecting cabal of COVID sceptics should do some basic reading, no? https://t.co/aiU48AUNRH https://t.co/xcfa9P8FMt",4/11/2021 17:10,Month_04 Week 2,4,johnbye busy upset lot colleague student amp former employer ottawa uni per research wikipedia reference amp balance self respect cabal covid sceptic basic reading,johnbye busy upset lot colleague student amp former employer ottawa uni per few minute research wikipedia reference amp balance any self respect cabal sceptic should basic reading
1.38E+18,"@DrFullertonMPP @CHEO @AlexMunter @MacLeodLisa @JR_Ottawa I cannot believe you are still doing photo shoots during this pandemic, you were missing in action for so long as minister of LTC , so disappointing, if we are successful in changing this leadership, we may be successful in flushing ministries!",4/11/2021 16:59,Month_04 Week 2,4,believe still photo shoot pandemic miss action long minister ltc disappoint successful change leadership successful flush ministry,cannot_believe still photo shoot pandemic miss action long minister ltc disappoint successful change leadership successful flush ministry
1.38E+18,"#Ontario reports highest-ever 4,456 #Covid-19 cases, nearly 56,400 tests completed, Toronto- 1,353, Peel- 860, York region- 444, Ottawa- 377, Durham- 329
#ymedia #southasiandaily
@YudhvirJaswal https://t.co/G0puTrPN3y",4/11/2021 16:55,Month_04 Week 2,4,report high ever case nearly test complete toronto peel york region ottawa durham,report highest_ever case nearly test complete toronto peel york region ottawa durham
1.38E+18,"I’m still trying to fiqure out how we have gone through an entire pandemic. Where @cathmckenna Ottawa literally tests the sewage to check covid levels. 

And on the bccdc website is “The virus has been found in semen and feces (poop).”

No warning; If there is risk from rimming.",4/11/2021 16:54,Month_04 Week 2,4,still try fiqure entire pandemic ottawa literally test sewage check covid level bccdc website virus found semen feces poop warn risk rim,still try fiqure out entire pandemic where ottawa literally test sewage check level bccdc website virus found semen feces poop no_warn risk rim
1.38E+18,"Attention Cree hunters: stay away from #Ottawa fields: COVID-19: Ontario reports 4,456 new cases across the province; another record-setting day in Ottawa with 370 https://t.co/SxiQxjYJRe",4/11/2021 16:53,Month_04 Week 2,4,attention cree hunter stay away field covid ontario report new case across province record set ottawa,attention cree hunter stay away field ontario report new case across province another record_setting day ottawa with
1.38E+18,"@ottawacity this is confusing. 223,150 doses received 195,214 given out and a further 80,000 booked? Are we overbooked? Appointments at Ottawa's COVID-19 vaccination community clinics 'temporarily fully booked'  https://t.co/CyK4w55CXK via @ctvottawa",4/11/2021 16:49,Month_04 Week 2,4,confuse dos receive give far book overbooked appointment ottawa covid vaccination community clinic temporarily fully book via,confuse dos receive give out far book overbooked appointment ottawa vaccination community clinic notemporarily fully book via
1.38E+18,"Covid walk last week @ Ottawa, Ontario https://t.co/UNKsTs540D",4/11/2021 16:44,Month_04 Week 2,4,covid walk last ottawa ontario,walk last week ottawa ontario
1.38E+18,"It can take days sometimes weeks to see if a variant is a play. The wastewater signal in Ottawa is showing that ""more than half the virus in the sewage is the b.1.1.7 variant."" https://t.co/vBESEMH1G9",4/11/2021 16:40,Month_04 Week 2,4,take see variant play wastewater signal ottawa show half virus sewage variant,can take day week see variant play wastewater signal ottawa show more half virus sewage variant
1.38E+18,"@Timalle73203580 Oh, I know that... but here in #Ottawa, I'm just getting angry and frustrated.  And I'm over 60 and immuno-compromised.  #healthhut #COVID19 #vaccine",4/11/2021 16:24,Month_04 Week 2,4,know angry frustrate immuno compromise,know just get angry frustrate over immuno_compromised
1.38E+18,@VeraEtches When are transplant patients going to get the vaccine? April 6th was the start date but there is no information available. #ottawa #letusknow,4/11/2021 16:24,Month_04 Week 2,4,transplant patient vaccine start date information available,when transplant patient get vaccine start date no_information available
1.38E+18,@maej43 90% of today's record breaking case count in Ottawa are people under 60 and yet anyone under 55 cannot get a vaccine here city-wide. 90%!!!!,4/11/2021 16:21,Month_04 Week 2,4,today record break case count ottawa people vaccine city wide,today record break case count ottawa people under yet anyone under cannot_get vaccine city_wide
1.38E+18,@MikeZanier @harry1619 For giving the this insane schedule when players are de-conditioned and recovering from covid. It's a recipe for player injuries just so we can see van play Ottawa four more times,4/11/2021 16:21,Month_04 Week 2,4,give insane schedule player condition recover covid recipe player injury see van play ottawa four time,give insane schedule when player de_conditioned recover recipe player injury just can see van play ottawa four more time
1.38E+18,Rideau-Vanier / Ottawa-Vanier is a hot spot since the beginning of the pandemic yet vaccination sites are hardly accessible to Vanier residents. https://t.co/WV1hk2ndt4,4/11/2021 16:19,Month_04 Week 2,4,rideau vanier ottawa vanier hot spot begin pandemic vaccination site hardly accessible vanier resident,rideau_vanier ottawa_vanier hot spot since begin pandemic yet vaccination site hardly accessible vanier resident
1.38E+18,@celliottability Why are people from Ottawa (where the COVID number is high) coming to eastern Ontario (Alexandria) for their vaccine? We have very few cases here. Why did you not restrict travel from high-incidence areas?,4/11/2021 16:17,Month_04 Week 2,4,people ottawa covid number high come eastern ontario alexandria vaccine case restrict travel high incidence area,why people ottawa where number high come eastern ontario alexandria vaccine very few case why not_restrict travel high_incidence area
1.38E+18,@CityNews This is a joke. The ones in Ottawa never contacted people because they didn’t have the vaccines and those lucky enough to get a vaccine weren’t guaranteed a second shot. Shit!,4/11/2021 16:17,Month_04 Week 2,4,joke one ottawa never contact people didnt vaccine lucky enough vaccine werent guaranteed second shot shit,joke one ottawa never contact people not_have vaccine lucky enough get vaccine not_guaranteed second shot shit
1.38E+18,"COVID-19: Ontario reports 4,456 new cases across the province; another record-setting day in Ottawa with 370 https://t.co/Vz7HC43YLg https://t.co/oW8vCwEd4J",4/11/2021 16:14,Month_04 Week 2,4,covid ontario report new case across province record set ottawa,ontario report new case across province another record_setting day ottawa with
1.38E+18,"@VeraEtches @JimWatsonOttawa Constant mixed messaging throughout this pandemic. #ottawa’s MOH: “stay home”
@JimWatsonOttawa: looks like a great day to cycle across town and visit a busy beach. Oh, and don’t forget to come downtown for takeout and “free” parking. SMH

#ottnews https://t.co/IrPDs98Kig",4/11/2021 16:12,Month_04 Week 2,4,constant mixed message pandemic moh stay home look like great cycle across town visit busy beach forget come downtown takeout free parking smh,constant mixed message throughout pandemic moh stay home look like great day cycle across town visit busy beach not_forget come downtown takeout free parking smh
1.38E+18,"@wrambbit @MaryFernando_ @MedicineMatters @caryn_lieberman Same experience at covid testing site in Ottawa. Had on an N95, but was forced to remove and wear blue surgical. Also wouldn’t permit me to put surgical on top. It’s enough to deter me from getting tested again. Feels so unsafe to remove make indoors. So dumb.",4/11/2021 16:04,Month_04 Week 2,4,experience covid test site ottawa force remove wear blue surgical wouldnt permit put surgical top enough deter test feel unsafe remove make indoors dumb,experience test site ottawa force remove wear blue surgical also would not_permit put surgical top enough deter get test again feel unsafe remove make indoors dumb
1.38E+18,"@MaryFernando_ @DFisman I just came back from a test at the Brewer Park assessment centre in Ottawa. The nurse saw I had a KN95, and just asked that I put their cheapo blue one over it. No problem with that, although I was ready to argue if they tried to get me to replace mine.",4/11/2021 16:04,Month_04 Week 2,4,come back test brewer park assessment centre ottawa nurse saw ask put cheapo blue one problem ready argue try replace,just come back test brewer park assessment centre ottawa nurse saw just ask put cheapo blue one over no_problem with although ready argue try get replace
1.38E+18,"COVID-19: Ontario reports 4,456 new cases across the province; another record-setting day in Ottawa with 370 https://t.co/T2Lto8j2Vb",4/11/2021 16:04,Month_04 Week 2,4,covid ontario report new case across province record set ottawa,ontario report new case across province another record_setting day ottawa with
1.38E+18,"@MacLeodLisa @Stefan_Keyes Respectfully, when will we start vaccinating the populations currently driving our covid infections? People between 20 and 50 comprise 57% of today’s cases in Ottawa.",4/11/2021 16:03,Month_04 Week 2,4,respectfully start vaccinate population currently drive covid infection people comprise today case ottawa,respectfully when will start vaccinate population currently drive infection people comprise today case ottawa
1.38E+18,"What you need to know about COVID-19 in Ottawa on Sunday, April 11 https://t.co/aGbBo9s5AP",4/11/2021 16:00,Month_04 Week 2,4,need know covid ottawa sunday,what need know ottawa sunday
1.38E+18,"More dire news for Ottawa, strong growth Rt 1.27, case rate 162, test positivity jumps to 5.6%.

Could've taken tiny steps in February.. indoor dining closed...kept schools remote...kept gyms &amp; businesses at 25%...

Instead the PC govt went wide open only to spite opponents https://t.co/6PaSynYdnV",4/11/2021 15:57,Month_04 Week 2,4,dire news ottawa strong growth case rate test positivity jump take tiny step indoor din close kept school remote kept gym amp business instead govt wide open spite opponent,more dire news ottawa strong growth case rate test positivity jump could take tiny step indoor din close kept school remote kept gym amp business instead govt wide open only spite opponent
1.38E+18,@Sflecce When are early childhood educators working in licenced childcare centres with unmasked children going to be vaccinated in Ottawa? Our vaccine roll out is a joke. They are vaccinating naturopaths and other health care providers currently working from home before educators.,4/11/2021 15:53,Month_04 Week 2,4,early childhood educator work licence childcare centre unmasked child vaccinate ottawa vaccine roll joke vaccinate naturopath health care provider currently work home educator,when early childhood educator work licence childcare centre with unmasked child vaccinate ottawa vaccine roll out joke vaccinate naturopath health care provider currently work home educator
1.38E+18,"Glad more pharmacies than the original 34 will be offering the #COVIDvaccine in Ottawa, but when is this effective from? I called one on the list below and the recorded message says it is not offering the vaccine. #ottnews #onpoli https://t.co/COXTwXpPpL",4/11/2021 15:46,Month_04 Week 2,4,glad pharmacy original offering ottawa effective call one list record message say offering vaccine,glad more pharmacy original will offering ottawa when effective call one list below record message say not_offering vaccine
1.38E+18,"The COVID-19 wasteland: searching for clues to the pandemic in the sewers https://t.co/HZ3GJJxPs6 https://t.co/lSfZwctmoe OTTAWA — When Ottawa Public Health officials are trying to decide whether restrictions in the city need to tighten up, they look to the normal markers like…",4/11/2021 15:37,Month_04 Week 2,4,covid wasteland search clue pandemic sewer ottawa ottawa public health official try decide restriction city need tighten look normal marker like,wasteland search clue pandemic sewer ottawa when ottawa public health official try decide whether restriction city need tighten look normal marker like
1.38E+18,"When Covid is over and everyone's vaccinated, I'm organizing a One Direction club night in Ottawa bet",4/11/2021 15:35,Month_04 Week 2,4,covid vaccinate organize one direction club night ottawa bet,when over vaccinate organize one direction club night ottawa bet
1.38E+18,@peggy_blair How many sales /commissions would you miss in this Ottawa market during a 2 week quarantine or 21 day covid confinement (best case) ..asking for an idiot friend ???,4/11/2021 15:32,Month_04 Week 2,4,sale commission miss ottawa market quarantine covid confinement best case ask idiot friend,many sale commission would miss ottawa market week quarantine day confinement best case ask idiot friend
1.38E+18,"The five public health regions with highest number of cases: 
1,353 new cases in Toronto
860 in Peel
444 in York
377 in Ottawa
329 in Durham
#COVID19 #COVID19Ontario #coronavirus https://t.co/85YuPaAxXv",4/11/2021 15:25,Month_04 Week 2,4,five public health region high number case new case toronto peel york ottawa durham,five public health region with high number case new case toronto peel york ottawa durham
1.38E+18,"Ottawa Public Health is reporting a record breaking daily COVID-19 case count, as 370 more people in Ottawa test positive for COVID-19 today. https://t.co/STKisMyZKU",4/11/2021 15:23,Month_04 Week 2,4,ottawa public health reporting record break daily covid case count people ottawa test positive covid today,ottawa public health reporting record break daily case count more people ottawa test positive today
1.38E+18,This week Ottawa has registered the highest COVID-19 numbers since the start of the pandemic. We are doing our part and continue to stay the blazes home! https://t.co/gkhUnwbXBX,4/11/2021 15:18,Month_04 Week 2,4,ottawa register high covid number start pandemic part continue stay blaze home,week ottawa register high number since start pandemic part continue stay blaze home
1.38E+18,Ottawa Public Health is reporting another daily COVID-19 case count RECORD as 370 more people in Ottawa have tested positive for COVID-19. https://t.co/R5slgp87OM,4/11/2021 15:17,Month_04 Week 2,4,ottawa public health reporting daily covid case count record people ottawa test positive covid,ottawa public health reporting another daily case count record more people ottawa test positive
1.38E+18,"Hear Directly from Women Leading the World Through the Pandemic. Experience the #IWW Event Hosted by the @ICDCanada &amp; @Invest_Ottawa  (Vimeo): https://t.co/a1noVt4OgM Special thanks to @CPHO_Canada, @MMT_Steele, Dr. Linda Maxwell, Theresa Oswald, @mikegtremblay &amp; Rahul K Bhardwaj https://t.co/4g13a41d49",4/11/2021 15:16,Month_04 Week 2,4,hear directly woman lead world pandemic experience event host amp vimeo special thanks linda maxwell theresa oswald amp rahul bhardwaj,hear directly woman lead world pandemic experience event host amp vimeo special thanks linda maxwell theresa oswald amp rahul bhardwaj
1.38E+18,"A stay-at-home order is in effect. Please only leave home for essential purposes. Stay home, save lives. It's the law. We can beat this, Ottawa. #ottawapublichealth #oph #stayathome #publichealth #ottawa #ottawalife #covid_19 #socialdistancing #waragainstcorona @OttawaHealth https://t.co/YAxjkVqbge",4/11/2021 15:16,Month_04 Week 2,4,stay home order effect please leave home essential purpose stay home save life law beat ottawa,stay_at_home order effect please only leave home essential purpose stay home save life law can beat ottawa
1.38E+18,"@24thminute @stevensandor @fordnation They've started posting posters in my area with covid info written in English and French as well as Somali, Mandarin and others to ensure the info is understood by all in the neighborhood, so I can see in Ottawa there is an attempt to reach out to all groups and languages",4/11/2021 15:14,Month_04 Week 2,4,start post poster area covid info write english french well somali mandarin others ensure info understood neighborhood see ottawa attempt reach group language,start post poster area with info write english french well somali mandarin others ensure info understood neighborhood can see ottawa attempt reach out group language
