Tweet Id,text,date,Week,Month,text_clean_textual,text_clean_sentiment
1.38E+18,"If you live or work in the London postal code that had the highest positive #COVID19 rate in Ontario, the fastest way to get a vaccine might be to move to a fringe K2V neighbourhood in Ottawa where positivity and cases rates rank in the 200s and 300s
@fordnation @celliottability https://t.co/64UlhQM5j2",4/13/2021 17:55,Month_04 Week 2,4,live work london postal code high positive rate ontario fast way vaccine move fringe neighbourhood ottawa positivity case rate rank,live work london postal code high positive rate ontario fast way get vaccine might move fringe neighbourhood ottawa where positivity case rate rank
1.38E+18,"🚨 New investigation reveals secret oil industry / govt 'working group' 🚨

Where is Ottawa's promised ""just transition"" for oil workers?

What happened to the ""green pandemic recovery""?

Why no #GreenNewDeal for 🇨🇦? 

Here's part of the answer:

 https://t.co/LLteC54myp",4/13/2021 17:48,Month_04 Week 2,4,new investigation reveals secret oil industry govt work group ottawa promise transition oil worker happen green pandemic recovery part answer,police car light new investigation reveals secret oil industry govt work group police car light where ottawa promise just transition oil worker what happen green pandemic recovery why no_for Canada part answer
1.38E+18,Key COVID-19 numbers in the Ottawa area today https://t.co/YP9B6GRs8t #ottnews #ottawa https://t.co/4WDlL9Q6sn,4/13/2021 17:40,Month_04 Week 2,4,key covid number ottawa area today,key number ottawa area today
1.38E+18,COVID-19 in Quebec: What you need to know Tuesday https://t.co/RlcTy3rXxk #ottnews #ottawa https://t.co/xscysvCXMU,4/13/2021 17:40,Month_04 Week 2,4,covid quebec need know tuesday,quebec what need know tuesday
1.38E+18,"@CBCOttawa Vaccinating healthy 18 year olds in Toronto while im in Ottawa, HIGHEST risk, with no access to the vaccine.",4/13/2021 17:33,Month_04 Week 2,4,vaccinate healthy year old toronto ottawa high risk access vaccine,vaccinate healthy year old toronto ottawa high risk with no_access vaccine
1.38E+18,"The latest on COVID-19 in Ottawa for April 13, 2021.​  https://t.co/5MUo87Gm2J",4/13/2021 17:30,Month_04 Week 2,4,late covid ottawa,late ottawa
1.38E+18,"#RamadanMubarak Ottawa:
Tips to stay safe while observing this holy month:
🕯️-Ensure any candles or lanterns are at least 1 meter away from combustibles. 
🫕-Stay in the kitchen and watch your pan while cooking. 
🚨-Test your smoke and carbon monoxide alarms. https://t.co/Yg0p1K2xk0",4/13/2021 17:27,Month_04 Week 2,4,ottawa tip stay safe observe holy month ensure candle lantern least meter away combustible stay kitchen watch pan cooking test smoke carbon monoxide alarm,ottawa tip stay safe observe holy month candle ensure any candle lantern least meter away combustible fondue stay kitchen watch pan cooking police car light test smoke carbon monoxide alarm
1.38E+18,"The City of Ottawa is prepared to close parks three hours earlier to stop people from hanging out, and littering public space, during a provincial stay-at-home order meant to curb the spread of COVID-19  https://t.co/p1XIXQYpzA https://t.co/exrvdyC6Yn",4/13/2021 17:16,Month_04 Week 2,4,city ottawa prepared close park three earlier stop people hang litter public space provincial stay home order meant curb spread covid,city ottawa prepared close park three hour earlier stop people hang out litter public space provincial stay_at_home order meant curb spread
1.38E+18,"@Billius27 Interestingly @CBCOttawa just posted ages for COVID hospitalizations in Ottawa (ICU). Different from what we're hearing from GTA docs, biggest group is 50 - 70.

90s: 3
80s: 9 (1)
70s: 24 (8)
60s: 23 (9)
50s: 23 (8)
40s: 4 (1)
30s: 6 (2)
20s: 3 (1)
10-19: 0
0-9: 0
#ottnews",4/13/2021 17:15,Month_04 Week 2,4,interestingly post age covid hospitalization ottawa icu different hearing gta doc big group,interestingly just post age hospitalization ottawa icu different what hearing gta doc big group
1.38E+18,"@AndrewBerkshire @alexmontpetit Mete is the perfect example of when analytics meet eye test and u think he’d be really good, but then u watch him on ice. He just plays too small rn for our system. Plus he gets lots of chances but has no shot. I think he’ll do well in Ottawa. On Montreal it didn’t work",4/13/2021 17:14,Month_04 Week 2,4,mete perfect example analytics meet eye test think hed really good watch ice play small system plus lot chance shot think hell well ottawa montreal didnt work,mete perfect example when analytics meet eye test think would really good watch ice just play too small system plus get lot chance no_shot think will well ottawa montreal not_work
1.38E+18,"Ottawa’s COVID-19 cases fall below 200 on Tuesday, but weekly trends remain high https://t.co/xUyPVafYVH",4/13/2021 17:12,Month_04 Week 2,4,ottawa covid case fall tuesday weekly trend remainhigh,ottawa case fall below tuesday weekly trend remain high
1.38E+18,@Avidrea01050507 @DianeMariePosts I know my cousins in Ottawa who are eligible for the shot had to travel to Kingston &amp; Toronto to be vaccinated because of shortages. I hope there will be a lot more vaccine available soon!,4/13/2021 17:11,Month_04 Week 2,4,know cousin ottawa eligible shot travel kingston amp toronto vaccinate shortage hope lot vaccine available soon,know cousin ottawa who eligible shot travel kingston amp toronto vaccinate shortage hope will lot more vaccine available soon
1.38E+18,Good to see lots of teachers at the vaccine clinic in Ottawa!!,4/13/2021 17:11,Month_04 Week 2,4,good see lot teacher vaccine clinic ottawa,good see lot teacher vaccine clinic ottawa
1.38E+18,Ottawa-Centre MPP latest to call for Lecce resignation over handling of schools amid pandemic - CityNews Ottawa https://t.co/nRcEPXBxRY,4/13/2021 17:06,Month_04 Week 2,4,ottawa centre mpp late call lecce resignation handle school amid pandemic citynews ottawa,ottawa_centre mpp late call lecce resignation over handle school amid pandemic citynews ottawa
1.38E+18,"In booking cashmeets in Toronto. BUTTTT if you’re in Montreal, Ottawa or Van and want a cashmeet/fetish session dm me I will be traveling for sessions post vaccine so need to start planning.

Dominatrix canadiandomme asiandomme feetfetish assworship cei sph cbt joi tpe",4/13/2021 16:59,Month_04 Week 2,4,book cashmeets toronto butttt youre montreal ottawa van cashmeet fetish session travel session post vaccine need start planning dominatrix canadiandomme asiandomme feetfetish assworship cei sph cbt joi tpe,book cashmeets toronto butttt montreal ottawa van want cashmeet fetish session will travel session post vaccine need start planning dominatrix canadiandomme asiandomme feetfetish assworship cei sph cbt joi tpe
1.38E+18,@_Drink_Mee @xinlard Actually I ready an article that they have started testing areas in Ottawa at sewage plants. They say they will be able to detect Hotspot through our 💩 because we shed the virus through our 💩.,4/13/2021 16:58,Month_04 Week 2,4,drink mee actually ready article start test area ottawa sewage plant say able detect hotspot shed virus,drink mee actually ready article start test area ottawa sewage plant say will able detect hotspot pile poo shed virus pile poo
1.38E+18,I Completely 100% Agree with You Councillor @cmckenney We have to focus on Paid Sick Leave for All Essential Workers during this #Coronavirus #Covid19 Pandemic and have All Essential Workers Vaccinated and for Those in #Ottawa Hotspots https://t.co/yX5OdKoYTf,4/13/2021 16:54,Month_04 Week 2,4,completely agree councillor focus paid sick leave essential worker pandemic essential worker vaccinate hotspot,completely agree with councillor focus paid sick leave essential worker pandemic essential worker vaccinate hotspot
1.38E+18,"@odspoverty @ONSocialService @JR_Ottawa @fordnation &amp; @ToddSmithPC just decided to not give disabled $1 in increase after NOT giving the majority of disabled $1 for an entire pandemic year. Rates have not increased enough to make life on #ODSPoverty affordable, especially during a health crisis! #HumanRightsViolations https://t.co/MS05PcfQv0",4/13/2021 16:52,Month_04 Week 2,4,amp decide give disabled increase give majority disabled entire pandemic year rate increase enough make life affordable especially health crisis,amp just decide not_give disabled increase not_give majority disabled entire pandemic year rate not_increase enough make life affordable especially health crisis
1.38E+18,COVID-19 cases in Ottawa dip below 200 on Tuesday but weekly trends remain high https://t.co/Cb0JuHzd7D via @ctvottawa,4/13/2021 16:49,Month_04 Week 2,4,covid case ottawa dip tuesday weekly trend remain high via,case ottawa dip below tuesday weekly trend remain high via
1.38E+18,More COVID-19 patients in Ottawa ICUs than ever; 194 new cases of the virus city-wide https://t.co/PPhpVL5P4p https://t.co/soBXwnCUVa,4/13/2021 16:49,Month_04 Week 2,4,covid patient ottawa icu ever new case virus city wide,more patient ottawa icu ever new case virus city_wide
1.38E+18,"@nilikm I was conducting open-ended interviews last Sept with Tibetan women in Ottawa who resettled here 2013-2017 for my dissertation research. I was asking about their resettlement experiences, so the pandemic came up and many were new-ish PSWs, so I have narrative data in their voices",4/13/2021 16:48,Month_04 Week 2,4,conduct open end interview last sept tibetan woman ottawa resettle dissertation research ask resettlement experience pandemic come new ish psws narrative data voice,conduct open_ended interview last sept with tibetan woman ottawa who resettle dissertation research ask resettlement experience pandemic come many new_ish psws narrative data voice
1.38E+18,"UPDATED: Ottawa Public Health is reporting 194 more people in the city have tested positive for COVID-19. It's a low figure, but weekly trends are still on the rise and hospitalizations remain at record levels. #ottnews 

More details: https://t.co/u15iHG6T4z",4/13/2021 16:48,Month_04 Week 2,4,update ottawa public health reporting people city test positive covid low figure weekly trend still rise hospitalization remain record level detail,update ottawa public health reporting more people city test positive low figure weekly trend still rise hospitalization remain record level more detail
1.38E+18,COVID-19: Ottawa Hopes to Broaden List of Travellers Considered Essential https://t.co/5HseUp3fED via @Canada Immigration News,4/13/2021 16:47,Month_04 Week 2,4,covid ottawa hope broaden list traveller consider essential via immigration news,ottawa hope broaden list traveller consider essential via immigration news
1.38E+18,"👇as Ottawa awaits centre for complex care to replace aged hospital due @cathmckenna interference/@JustinTrudeau reversal of land granted by Harper govt, delaying by years, adding $500+M in costs, essential during pandemic, residents with serious illness now paying with lives. https://t.co/SfdlUnMVdL",4/13/2021 16:46,Month_04 Week 2,4,ottawa awaits centre complex care replace age hospital due interference reversal land grant harper govt delay year add cost essential pandemic resident serious illness pay life,backhand index point down ottawa awaits centre complex care replace age hospital due interference reversal land grant harper govt delay year add cost essential pandemic resident with serious illness pay with life
1.38E+18,@odspoverty @ONSocialService @JR_Ottawa #SOS #HELP Assisted suicide still the only current “support” offered to #ODSP #ODSPoverty #pandemic #HumanRights #HumanRightsViolations #CRPD #COPD #onpoli #LegislatedPoverty #Cruelty #Inhumane #MAiD #PovertyIsLegislated,4/13/2021 16:44,Month_04 Week 2,4,assist suicide still current support offer,assist suicide still only current support offer
1.38E+18,"Dr. Tam says she got the Pfizer vaccine at the Ottawa Hospital #cdnpoli 

https://t.co/94eP8GYBnx https://t.co/fQ6daUxBsE",4/13/2021 16:37,Month_04 Week 2,4,tam say pfizer vaccine ottawa hospital,tam say get pfizer vaccine ottawa hospital
1.38E+18,"Dr. Tam says she followed the Ottawa Health booking system to get her vaccine. 

She says she followed the same system as any Ottawa resident and received the Pfizer vaccine. https://t.co/QkkTigqTzJ",4/13/2021 16:34,Month_04 Week 2,4,tam say follow ottawa health book system vaccine say follow system ottawa resident receive pfizer vaccine,tam say follow ottawa health book system get vaccine say follow system any ottawa resident receive pfizer vaccine
1.38E+18,"Give back &amp; support local charitable Covid-19 relief efforts! Your donations made to ODBF support Ottawa charities in your community during this crucial time. Text ODBF to 613-703-5852 or visit https://t.co/ywkC2E8DZy to donate today!
#ODBF #charity #fundraiser #charities #Ottawa https://t.co/KjkgYhcq9J",4/13/2021 16:30,Month_04 Week 2,4,give back amp support local charitable covid relief effort donation make odbf support ottawa charity community crucial time text odbf visit donate today,give back amp support local charitable relief effort donation make odbf support ottawa charity community crucial time text odbf visit donate today
1.38E+18,"For those of you not in the know, this is because #Ottawa's Mayor, who has actively fought against useful public health restrictions every step of the way during this pandemic, has decided an outdoor park curfew is something he can champion so it seems that he's not doing nothing https://t.co/veXCW2exWH",4/13/2021 16:30,Month_04 Week 2,4,know mayor actively fought useful public health restriction step way pandemic decide outdoor park curfew champion seem nothing,not_in know mayor who actively fought against useful public health restriction step way pandemic decide outdoor park curfew can champion seem not_do nothing
1.38E+18,"@ctvottawa ""As of Tuesday, Ottawa Public Health said there are 95 COVID-19 patients in Ottawa hospitals, including 30 in intensive care""

Some of the ICU patients were sent here from TORONTO....the article should reflect that.",4/13/2021 16:28,Month_04 Week 2,4,tuesday ottawa public health say covid patient ottawa hospital include intensive care icu patient sent toronto article reflect,tuesday ottawa public health say patient ottawa hospital include intensive care icu patient sent toronto article should reflect
1.38E+18,The announcement by federal officials recommending a pause in the use of the Johnson and Johnson vaccine is not expected to slow down Ottawa County. https://t.co/isvmUDIf5M,4/13/2021 16:21,Month_04 Week 2,4,announcement federal official recommend pause use johnson johnson vaccine expect slow ottawa county,announcement federal official recommend pause use johnson johnson vaccine not_expect slow down ottawa county
1.38E+18,"New podcast is out! ""Help! I graduated in a pandemic!"" with insights for employers and job-seekers in communications! https://t.co/tjGZfqWf4I @CommStudies_CU @cmnuo #Ottawa #OttNews #OttJobs https://t.co/1qTd4siCK9",4/13/2021 16:17,Month_04 Week 2,4,new podcast help graduate pandemic insight employer job seeker communication,new podcast out help graduate pandemic with insight employer job_seekers communication
1.38E+18,"@CBCQueensPark K2V ""ranked 37th out of 39 in Ottawa for COVID-19 positivity during the week ending March 28. It had a COVID-19 positivity rate of 2.05 per cent compared with a rate of more than 23 per cent in the K1P postal code in central Ottawa, which is not on the province’s hot-spot list. """,4/13/2021 16:17,Month_04 Week 2,4,ranked ottawa covid positivity end covid positivity rate per cent compare rate per cent postal code central ottawa province hot spot list,ranked out ottawa positivity week end positivity rate per cent compare with rate more per cent postal code central ottawa not_on province hot_spot list
1.38E+18,The announcement by federal officials recommending a pause in the use of the Johnson and Johnson vaccine is not expected to slow down Ottawa County. https://t.co/HIPvA3wcfp,4/13/2021 16:16,Month_04 Week 2,4,announcement federal official recommend pause use johnson johnson vaccine expect slow ottawa county,announcement federal official recommend pause use johnson johnson vaccine not_expect slow down ottawa county
1.38E+18,"@MapleWaterRock @CountFloyd2020 @jengerson Either way, I am mad at all parties in Ottawa for not making this a priority since SARS 1 back in 2004. 

It's bullshit. We ""blame Mulroney"". No, Fuck that. George Bush and Barack Obama each spoke extensively about the need for US pandemic response after that. Us? 

Nada.",4/13/2021 16:13,Month_04 Week 2,4,way mad party ottawa make priority sars back bullshit blame mulroney fuck george bush barack obama spoke extensively need pandemic response nada,either way mad party ottawa not_make priority since sars back bullshit blame mulroney no_fuck george bush barack obama spoke extensively need pandemic response nada
1.38E+18,Ottawa may impose 8 p.m. curfew at parks in crackdown on pandemic partying https://t.co/vcIUts5rec https://t.co/FciFvOH0on,4/13/2021 16:10,Month_04 Week 2,4,ottawa impose curfew park crackdown pandemic party,ottawa impose curfew park crackdown pandemic party
1.38E+18,Ottawa County halts Johnson &amp; Johnson vaccine clinics after blood clot concerns https://t.co/Ml9OhSUZzw https://t.co/UEXaeGRw4m,4/13/2021 16:07,Month_04 Week 2,4,ottawa county halt johnson amp johnson vaccine clinic blood clot concern,ottawa county halt johnson amp johnson vaccine clinic blood clot concern
1.38E+18,News Release: Ottawa County health officials pause the use of the Johnson &amp; Johnson vaccine out of an abundance of caution https://t.co/ukHVH8K7TS,4/13/2021 16:03,Month_04 Week 2,4,news release ottawa county health official pause use johnson amp johnson vaccine abundance caution,news release ottawa county health official pause use johnson amp johnson vaccine out abundance caution
1.38E+18,"@winobeworld @MrLeslieRoberts @JimWatsonOttawa It’s a pandemic that’s out of control in Ottawa, ppl should be home at 8pm, not hanging around parks.🤦🏻‍♀️",4/13/2021 16:00,Month_04 Week 2,4,pandemic thats control ottawa ppl home hang around park,pandemic out control ottawa ppl should home not_hang around park woman facepalming light skin tone
1.38E+18,I signed this as a part-time grocery store worker with no idea what’s going on with vaccine rollout. Give this petition a signature too—it might help Ottawa prioritize their vaccination schedule. https://t.co/KnTPzfnhgV,4/13/2021 15:58,Month_04 Week 2,4,sign part time grocery store worker idea whats vaccine rollout give petition signature tooit help ottawa prioritize vaccination schedule,sign part_time grocery store worker with no_idea what with vaccine rollout give petition signature too might help ottawa prioritize vaccination schedule
1.38E+18,"The headline bugs me. We would have been horrified by 214 a week ago
COVID-19: Case counts dip as Ottawa mulls parks curfew; CHEO to accept young adult critical care cases. https://t.co/UfU33wLEsM",4/13/2021 15:57,Month_04 Week 2,4,headline bug horrify ago covid case count dip ottawa mull park curfew cheo accept young adult critical care case,headline bug would horrify week ago case count dip ottawa mull park curfew cheo accept young adult critical care case
1.38E+18,Ottawa-Centre MPP latest to call for Lecce resignation over handling of schools amid pandemic https://t.co/ExGOWB39po https://t.co/IPAhSct0Mo,4/13/2021 15:56,Month_04 Week 2,4,ottawa centre mpp late call lecce resignation handle school amid pandemic,ottawa_centre mpp late call lecce resignation over handle school amid pandemic
1.38E+18,"@OttawaHealth NOTE: Today marks a new pandemic record with 30 #COVID19 patients in ICU. 

Here's the age breakdown for hospitalizations in #Ottawa (ICU):

90s: 3
80s: 9 (1)
70s: 24 (8)
60s: 23 (9)
50s: 23 (8)
40s: 4 (1)
30s: 6 (2)
20s: 3 (1)
10-19: 0
0-9: 0
#ottnews",4/13/2021 15:50,Month_04 Week 2,4,note today mark new pandemic record patient icu age breakdown hospitalization icu,note today mark new pandemic record with patient icu age breakdown hospitalization icu
1.38E+18,"@WearySky @jkwan_md Oh I know but at this point, and with seemingly no end to either this pandemic or leadership incompetency in the foreseeable future, I will take one day of deluding myself to give my mental health a tiny break until later today when the Ottawa numbers come out",4/13/2021 15:48,Month_04 Week 2,4,know point seemingly end pandemic leadership incompetency foreseeable future take one delude give mental health tiny break later today ottawa number come,know point with seemingly no_end either pandemic leadership incompetency foreseeable future will take one day delude give mental health tiny break later today when ottawa number come out
1.38E+18,"NEW: #Ottawa is now at 2,617 active confirmed cases of #COVID19.
 
New: 194 (20,267)
Newly resolved: 196 (17,174)
7-Day Avg. of New Cases per Day: 259 (🔽)

Hospitalizations: 95, 30 in ICU (-1, +1 in ICU)
Deaths: 476 (↔)
7-day average test positivity: 9.9% (↔)
#ottnews",4/13/2021 15:45,Month_04 Week 2,4,new active confirm case new newly resolve avg new case per hospitalization icu icu death average test positivity,new active confirm case new newly resolve day avg new case per day downwards button hospitalization icu icu death left_right arrow day average test positivity left_right arrow
1.38E+18,"@OttawaHealth 

Ottawa Public Health, Last Day of Covid 19-pandemic will be held on Wednesday, June 30, 2021.",4/13/2021 15:35,Month_04 Week 2,4,ottawa public health last covid pandemic held wednesday,ottawa public health last day pandemic will held wednesday
1.38E+18,Ottawa and Air Canada have settled on an aid package that will provide as much as $5.9 billion to the airline to help it recover from the economic damage brought about by the COVID-19 pandemic. https://t.co/vYjqdGllHo,4/13/2021 15:35,Month_04 Week 2,4,ottawa air canada settle aid package provide much billion airline help recover economic damage brought covid pandemic,ottawa air canada settle aid package will provide much billion airline help recover economic damage brought pandemic
1.38E+18,"@ottawacity 

City of Ottawa, Canada, Ontario in North America, Last Day of Covid 19-pandemic will be held on Wednesday, June 30, 2021.",4/13/2021 15:28,Month_04 Week 2,4,city ottawa canada ontario north america last covid pandemic held wednesday,city ottawa canada ontario north america last day pandemic will held wednesday
1.38E+18,COVID-19: Case counts dip as Ottawa mulls parks curfew; CHEO to accept young adult critical care cases https://t.co/rpg35f4wvA,4/13/2021 15:28,Month_04 Week 2,4,covid case count dip ottawa mull park curfew cheo accept young adult critical care case,case count dip ottawa mull park curfew cheo accept young adult critical care case
1.38E+18,COVID-19: Case counts dip as Ottawa mulls parks curfew; CHEO to accept young adult critical care cases https://t.co/vMpEZakBIO https://t.co/I4V6iNC4uO,4/13/2021 15:27,Month_04 Week 2,4,covid case count dip ottawa mull park curfew cheo accept young adult critical care case,case count dip ottawa mull park curfew cheo accept young adult critical care case
1.38E+18,"Ontario health officials are reporting 214 new COVID-19 cases in Ottawa, a drop compared to three days of more than 300 cases reported each day. #ottnews #onpoli https://t.co/H6RXPBguoO",4/13/2021 15:19,Month_04 Week 2,4,ontario health official reporting new covid case ottawa drop compare three case report,ontario health official reporting new case ottawa drop compare three day more case report day
1.38E+18,"CHEO is readying ICU beds for adults who require critical care for COVID-19 in Ottawa so they don't have to be transferred elsewhere. 

That's where we're at now.

https://t.co/zyo2muCyXo",4/13/2021 15:16,Month_04 Week 2,4,cheo ready icu bed adult require critical care covid ottawa transfer,cheo ready icu bed adult who require critical care ottawa not_have transfer elsewhere where
1.38E+18,"@hypsauce 100% - they aren’t even counting outbreaks in unlicensed settings towards the child care COVID numbers, and it’s estimated that only 1 in 3 kids in Ottawa has access to a licensed space

Vaccinate all child care providers now!",4/13/2021 15:14,Month_04 Week 2,4,arent even counting outbreak unlicensed setting towards child care covid number estimate kid ottawa access license space vaccinate child care provider,not_even counting outbreak unlicensed setting towards child care number estimate only kid ottawa access license space vaccinate child care provider
1.38E+18,"COVID-19: After a days of dire COVID-19 case counts, the number of new infections reported Tuesday dipped in Ottawa and across Ontario https://t.co/p3RtaD1oL3 https://t.co/RbLezi2l2B",4/13/2021 15:13,Month_04 Week 2,4,covid dire covid case count number new infection report tuesday dipped ottawa across ontario,day dire case count number new infection report tuesday dipped ottawa across ontario
1.38E+18,"NEW: @CHEO will begin accepting adult patients with #COVID19 who require critical care to ensure they stay in #Ottawa.

""This is unprecedented in CHEO’s 47-year history and reflects how serious the third wave of the pandemic is."" - @AlexMunter

#ottnews https://t.co/TGfzOGEMQS",4/13/2021 15:12,Month_04 Week 2,4,new begin accept adult patient require critical care ensure stay unprecedented cheos year history reflect serious third wave pandemic,new will begin accept adult patient with who require critical care ensure stay unprecedented cheo year history reflect serious third wave pandemic
