Tweet Id,text,date,Week,Month,text_clean_textual,text_clean_sentiment
1.38E+18,"Ontario opposition, Councillors question K2V (Ottawa) included on list of COVID-19 postal code hot spots https://t.co/2KDekMkBgB",4/14/2021 23:57,Month_04 Week 2,4,ontario opposition councillor question ottawa include list covid postal code hot spot,ontario opposition councillor question ottawa include list postal code hot spot
1.38E+18,"Ontario sees vaccine supply issues, Ottawa keeps AstraZeneca on the market https://t.co/5de5D7EHFh",4/14/2021 23:46,Month_04 Week 2,4,ontario see vaccine supply issue ottawa keep astrazeneca market,ontario see vaccine supply issue ottawa keep astrazeneca market
1.38E+18,@ImpairedCRONIC @glen_mcgregor Which has nothing to do with the point Ottawa can very easily step in and take over the vaccine rollout whenever it wants legally.,4/14/2021 23:45,Month_04 Week 2,4,nothing point ottawa easily step take vaccine rollout legally,nothing with point ottawa can very easily step take over vaccine rollout whenever want legally
1.38E+18,"What we heard today from @OttawaHealth: this is unlike what we’ve been through before. On March 18, 24 patients were admitted to #Ottawa hospitals w/ COVID. As of April 11: 96. That # is expected to reach 200 next week &amp; potentially 400 w/ 120 patients in ICU, if trend continues. https://t.co/cWfDBuYc9L",4/14/2021 23:43,Month_04 Week 2,4,heard today unlike weve patient admit hospital covid expect reach next amp potentially patient icu trend continue,what heard today unlike what patient admit hospital expect reach next week amp potentially patient icu trend continue
1.38E+18,Ottawa's COVID situation ‘the worst that it’s been to date’ https://t.co/xSdi2hVU0n,4/14/2021 23:41,Month_04 Week 2,4,ottawa covid situation bad date,ottawa situation bad date
1.38E+18,"He really does need the work from home collection !
Liberal MP caught stark naked during House of Commons video conference 
https://t.co/qSAD0ao4l8 via @CTVNews 

#jmflavors #pandemic #CanadianParliament #Ottawa #online #officeattire #surprise #newbraveworld #Quebec #working https://t.co/8qJcJiwX4g",4/14/2021 23:37,Month_04 Week 2,4,really need work home collection liberal caught stark naked house common video conference via,really need work home collection liberal caught stark naked house common video conference via
1.38E+18,"Owen is joyful &amp; resilient! After a failed newborn screening test for hearing brought him to #CHEO, his first yr of life was spent in search of a diagnosis, visiting specialists all over Ottawa. Our #1door4care hub will mean better access to care for Owen: https://t.co/tgvdQaLAKm https://t.co/0aLI6DXqCp",4/14/2021 23:30,Month_04 Week 2,4,owen joyful amp resilient fail newborn screen test hearing brought first life spent search diagnosis visit specialist ottawa hub mean well access care owen,owen joyful amp resilient fail newborn screen test hearing brought first life spent search diagnosis visit specialist over ottawa hub will mean well access care owen
1.38E+18,@JohnMcEwen21 @EdTubb Toronto has only been out since the 7th.  TDSB  kids and staff are still receiving outbreak notices from tph as contacts from the Tuesday after Easter are turning up covid positive.  I think Ottawa was in school even longer?,4/14/2021 23:19,Month_04 Week 2,4,toronto tdsb kid staff still receive outbreak notice tph contact tuesday easter turn covid positive think ottawa school even longer,toronto only out since tdsb kid staff still receive outbreak notice tph contact tuesday easter turn positive think ottawa school even longer
1.38E+18,@kinsellawarren I did that 8 years ago and have never looked back. Went a little further down the road to beautiful @KingstonON. I am so glad I’m living here and not in TO or my hometown of Ottawa during the pandemic—less crowded and easier access to nature.,4/14/2021 23:11,Month_04 Week 2,4,year ago never look back little far road beautiful glad living hometown ottawa pandemicless crowd easy access nature,year ago never look back little far down road beautiful glad living not_in hometown ottawa pandemic less crowd easy access nature
1.38E+18,"@TheMemeticist Our system is not set up to deal well with a pandemic and nobody has had the cojones to change it so that it would work better. Even now, the premiers of the provinces in most trouble blame Ottawa - I don't see them letting Ottawa take charge.",4/14/2021 23:06,Month_04 Week 2,4,system set deal well pandemic nobody cojones change work well even premier province trouble blame ottawa see ottawa take charge,system not_set deal well with pandemic nobody cojones change would work well even premier province most trouble blame ottawa not_see ottawa take charge
1.38E+18,@IsToffoli i am an essential worker in a jail in Ottawa and not a word of us getting the vaccine.  But if work tell us we have to go in a quarantine cause we were supposedly in contact with a positive case we have to use our own sick time and lose pay.  happy for u you're geting the vaccine,4/14/2021 22:58,Month_04 Week 2,4,essential worker jail ottawa word vaccine work tell quarantine cause supposedly contact positive case use sick time lose pay happy vaccine,essential worker jail ottawa not_a word get vaccine work tell quarantine cause supposedly contact with positive case use sick time lose pay happy get vaccine
1.38E+18,"Ottawa schools to getting nearly $57M to upgrade, protect against COVID-19 https://t.co/BdE5hZypAA This is a great idea #ableg when will #Alberta update &amp; upgrade school infrastructureto ensure kids are safe &amp; protected ?",4/14/2021 22:47,Month_04 Week 2,4,ottawa school nearly upgrade protect covid great idea update amp upgrade school infrastructureto ensure kid safe amp protect,ottawa school get nearly upgrade protect against great idea when will update amp upgrade school infrastructureto ensure kid safe amp protect
1.38E+18,"For audio issues and Q/A section, please refer to their recorded live video on their youtube channel, Ottawa City Council!

#coronavirus #updates #Canada",4/14/2021 22:38,Month_04 Week 2,4,audio issue section please refer record live video youtube channel ottawa city council,audio issue section please refer record live video youtube channel ottawa city council
1.38E+18,"Everyone applying for the city of Ottawa funding due tomorrow. We are almost there. We all need post-trauma community care after this. Unlike COVID, at least we know this trauma is coming to an end tomorrow at 5 pm😹. Sending you all positive vibes ♥️",4/14/2021 22:35,Month_04 Week 2,4,apply city ottawa funding due tomorrow almost need post trauma community care unlike covid least know trauma come end tomorrow send positive vibe,apply city ottawa funding due tomorrow almost need post_trauma community care unlike least know trauma come end tomorrow cat with tear joy send positive vibe heart suit
1.38E+18,"@drewmckevitt Maybe I'm misunderstanding, but this is how I was taught. I had to do this for my driving test. My driving instructor specifically had me practice this because I would have to do it due to the location of the driving test centre. That was in Ottawa, ON Canada 🤷‍♀️",4/14/2021 22:32,Month_04 Week 2,4,misunderstand taught drive test drive instructor specifically practice due location drive test centre ottawa canada,maybe misunderstand taught drive test drive instructor specifically practice would due location drive test centre ottawa canada woman shrug
1.38E+18,"The city of Ottawa is looking to fill a ""gap"" in its COVID-19 vaccine supply following a delay in delivery of Moderna vaccines. #ottnews https://t.co/Eln0r6FNaQ",4/14/2021 22:30,Month_04 Week 2,4,city ottawa look fill gap covid vaccine supply follow delay delivery moderna vaccine,city ottawa look fill gap vaccine supply follow delay delivery moderna vaccine
1.38E+18,No doubt this will be solved by the brave Section 22 order to be issued perhaps this weekend by our MOH that will &lt;checks notes from today's Ottawa city COVID briefing&gt; call on people to wear masks while outdoors in parks. https://t.co/ThM5b9zgPE,4/14/2021 22:24,Month_04 Week 2,4,doubt solve brave section order issue weekend moh check note today ottawa city covid briefing call people wear mask outdoors park,no_doubt will solve brave section order issue perhaps weekend moh will check note today ottawa city briefing call people wear mask outdoors park
1.38E+18,"PRECISELY! Here in Ottawa, if you have a mental health melt down or you are suffering from addiction there is help. If you are stressed &amp; struggling with pain while trying to juggle parenthood &amp; pandemic - U’RE ON YOUR OWN! @mcmasternpc @CanadianPain @OPHA_Ontario @GovCanHealth https://t.co/fVLAlCfhK6",4/14/2021 22:20,Month_04 Week 2,4,precisely ottawa mental health melt suffer addiction help stress amp struggle pain try juggle parenthood amp pandemic ure,precisely ottawa mental health melt down suffer addiction help stress amp struggle with pain try juggle parenthood amp pandemic
1.38E+18,@NGriffin1969 @lanerebecca @PoleWitch @CheriDiNovo Did you ever get an appointment email - I got a call about getting the vaccine on Saturday from an Ottawa hospital but have yet to receive anything regarding an actual appointment yet 😞,4/14/2021 22:17,Month_04 Week 2,4,ever appointment email call vaccine saturday ottawa hospital receive regard actual appointment,ever get appointment email get call get vaccine saturday ottawa hospital yet receive anything regard actual appointment yet disappointed face
1.38E+18,COVID-19 cases in Ottawa back above 300 after one-day dip https://t.co/WRAwoCRWM4 via @ctvottawa,4/14/2021 22:13,Month_04 Week 2,4,covid case ottawa back one dip via,case ottawa back one_day dip via
1.38E+18,Ottawa City Council updates citizen their future plans and current intakes on COVID-19 https://t.co/z1W85QiCti,4/14/2021 22:10,Month_04 Week 2,4,ottawa city council update citizen future plan current intake covid,ottawa city council update citizen future plan current intake
1.38E+18,Ottawa-Centre MPP latest to call for Lecce resignation over handling of schools amid pandemic https://t.co/tFT7dHWibv via @citynewsottawa,4/14/2021 22:02,Month_04 Week 2,4,ottawa centre mpp late call lecce resignation handle school amid pandemic via,ottawa_centre mpp late call lecce resignation over handle school amid pandemic via
1.38E+18,Staff at the Ottawa Hospital are sharing their concerns about the rising number of COVID-19 patients who have been hospitalized in recent days.​  https://t.co/6nkJ5LzMap,4/14/2021 22:00,Month_04 Week 2,4,staff ottawa hospital share concern rise number covid patient hospitalize recent,staff ottawa hospital share concern rise number patient who hospitalize recent day
1.38E+18,"NEW: Delay in Moderna COVID-19 vaccine shipment creating 'gap' in Ottawa's supply, city says  #ottnews 

https://t.co/y8uph8ZNTu",4/14/2021 21:49,Month_04 Week 2,4,new delay moderna covid vaccine shipment create gap ottawa supply city say,new delay moderna vaccine shipment create gap ottawa supply city say
1.38E+18,"HIGH ACHIEVERS: Stay-At-Home Edition
The wheels are in motion for a Little League Baseball season in Ottawa, but will this bus full of players, coaches and umpires play a full season or will COVID-19 force public health officials to hit the brakes? @llont @d6llo @LittleLeagueCAN",4/14/2021 21:49,Month_04 Week 2,4,high achiever stay home edition wheel motion little league baseball season ottawa bus full player coach umpire play full season covid force public health official hit brake,high achiever stay_at_home edition wheel motion little league baseball season ottawa will bus full player coach umpire play full season will force public health official hit brake
1.38E+18,"Ontario Sees Vaccine Supply Issues, Ottawa Keeps AstraZeneca on the Market https://t.co/hPgOIvIeaG via EpochTimesWorld https://t.co/W642FRyiHI",4/14/2021 21:44,Month_04 Week 2,4,ontario see vaccine supply issue ottawa keep astrazeneca market via epochtimesworld,ontario see vaccine supply issue ottawa keep astrazeneca market via epochtimesworld
1.38E+18,"Ontario sees vaccine supply issues, Ottawa keeps AstraZeneca on the market https://t.co/wFGhk2gkdm via @StCatStandard",4/14/2021 21:36,Month_04 Week 2,4,ontario see vaccine supply issue ottawa keep astrazeneca market via,ontario see vaccine supply issue ottawa keep astrazeneca market via
1.38E+18,"Ontario sees vaccine supply issues, Ottawa keeps AstraZeneca on the market https://t.co/lsx08MgVhX via @WellandTribune",4/14/2021 21:32,Month_04 Week 2,4,ontario see vaccine supply issue ottawa keep astrazeneca market via,ontario see vaccine supply issue ottawa keep astrazeneca market via
1.38E+18,"“University of Ottawa epidemiologist Raywat Deonandan compares COVID-19 vaccines to airbags in cars. The airbags greatly diminish your chance of dying, but they don't always save your life, he said.” https://t.co/1ID77UK9IF",4/14/2021 21:31,Month_04 Week 2,4,university ottawa epidemiologist raywat deonandan compare covid vaccine airbags car airbags greatly diminish chance die always save life say,university ottawa epidemiologist raywat deonandan compare vaccine airbags car airbags greatly diminish chance die not_always save life say
1.38E+18,"Evening Update: AstraZeneca’s COVID-19 vaccine to remain on the Canadian market; Ottawa aims to make 90,000 temporary workers and graduated students permanent residents https://t.co/gbEr7oosWe",4/14/2021 21:31,Month_04 Week 2,4,even update astrazenecas covid vaccine remain canadian market ottawa aim make temporary worker graduate student permanent resident,even update astrazeneca vaccine remain canadian market ottawa aim make temporary worker graduate student permanent resident
1.38E+18,@JR_Ottawa Are these the same funds that were previously allocated for HVAC at my son’s school and the implementation was postponed due to Covid?? Or are these new funds? Please clarify so I can inform our @WAPSCouncil https://t.co/2cMEqTwm8N,4/14/2021 21:24,Month_04 Week 2,4,fund previously allocate hvac son school implementation postpone due covid new fund please clarify inform,fund previously allocate hvac son school implementation postpone due new fund please clarify can inform
1.38E+18,"@Twisted61260848 @CP24 get your facts straight ... they ordered a record number and the reason we ran out was Ottawa public health decided to urge more people to get it due to worry over covid ...  
https://t.co/V94C9cpjb8",4/14/2021 21:21,Month_04 Week 2,4,fact straight order record number reason ran ottawa public health decide urge people due worry covid,get fact straight order record number reason ran out ottawa public health decide urge more people get due worry over
1.38E+18,"Ottawa schools getting nearly $57M to upgrade, protect against COVID-19 #ottnews
https://t.co/8ym5Ygfs5s https://t.co/SNi3WkaYJi",4/14/2021 21:19,Month_04 Week 2,4,ottawa school nearly upgrade protect covid,ottawa school get nearly upgrade protect against
1.38E+18,@Aaron_Derfel hi Aaron. What is the validity of this 3 months Covid positive after you’ve got it but not being contagious? Ottawa want to send my positive father in law back to us for post heart op and Covid stroke care without a negative test. Says he’ll be positive for 3 months,4/14/2021 21:19,Month_04 Week 2,4,aaron validity month covid positive youve contagious ottawa send positive father law back post heart covid stroke care negative test say hell positive month,aaron what validity month positive get not_be contagious ottawa want send positive father law back post heart stroke care without test say will positive month
1.38E+18,"Important read 👇
#TrudeauVaccineFail #TrudeauVaccineFailure #cdnpoli 

Days after announcing deal, Ottawa learned China blocked CanSino’s vaccine shipment https://t.co/d6hNKSgXcM via @ipoliticsca",4/14/2021 21:16,Month_04 Week 2,4,important read announce deal ottawa learn china block cansinos vaccine shipment via,important read backhand index point down day announce deal ottawa learn china block cansino_be vaccine shipment via
1.38E+18,My friend and doctor @nilikm is offering to vaccinate anyone in Ottawa 55+ with the AZ vaccine. Her office # is below. Leave a message and she will book you in for next week. https://t.co/uYXHuPYMrT,4/14/2021 21:15,Month_04 Week 2,4,friend doctor offering vaccinate ottawa vaccine office leave message book next,friend doctor offering vaccinate anyone ottawa with vaccine office below leave message will book next week
1.38E+18,"COVID-19: Ontario sees vaccine supply issues, Ottawa keeps AstraZeneca on the market. ⁦⁦@jaketapper⁩   These are some of the real facts.  https://t.co/9JuZ81oSKJ",4/14/2021 21:12,Month_04 Week 2,4,covid ontario see vaccine supply issue ottawa keep astrazeneca market real fact,ontario see vaccine supply issue ottawa keep astrazeneca market real fact
1.38E+18,"@DrJacobsRad Thanks Dr J! Hopefully the feds can secure more vaccine and I can visit my dad in Montreal, and friends in Ottawa and Toronto. Would be great if we could grab a coffee later this year if I am there and you are free!",4/14/2021 21:12,Month_04 Week 2,4,thanks hopefully fed secure vaccine visit dad montreal friend ottawa toronto great grab coffee later year free,thanks hopefully fed can secure more vaccine can visit dad montreal friend ottawa toronto would great could grab coffee later year free
1.38E+18,New rules for gathering limits and mandatory masks at summer amenities in city of Ottawa parks will be in place by this weekend as the city looks to limit COVID-19 transmission. #ottnews https://t.co/fuccLsd7I6,4/14/2021 21:09,Month_04 Week 2,4,new rule gathering limit mandatory mask summer amenity city ottawa park place weekend city look limit covid transmission,new rule gathering limit mandatory mask summer amenity city ottawa park will place weekend city look limit transmission
1.38E+18,It's a pandemic. People are largely working from home here in Ottawa and bylaw is out issuing numerous tickets for on street parking in a suburb.,4/14/2021 21:08,Month_04 Week 2,4,pandemic people largely work home ottawa bylaw issue numerous ticket street parking suburb,pandemic people largely work home ottawa bylaw out issue numerous ticket street parking suburb
1.38E+18,"Evening Update: AstraZeneca’s COVID-19 vaccine to remain on the Canadian market; Ottawa aims to make 90,000 temporary workers and graduated students permanent residents https://t.co/gvw0HX2ZzF",4/14/2021 21:04,Month_04 Week 2,4,even update astrazenecas covid vaccine remain canadian market ottawa aim make temporary worker graduate student permanent resident,even update astrazeneca vaccine remain canadian market ottawa aim make temporary worker graduate student permanent resident
1.38E+18,"We had one or two parks - where drinking is already outlawed ... and mayor grandstanded ... instead of @OttawaBylaw doing their jobs. One would be lead by publicity that this was the cause of all increased Covid outcomes - when real issue is home gatherings
.
💔 #Ottawa #ottnews",4/14/2021 20:58,Month_04 Week 2,4,one two park drinking outlaw mayor grandstand instead job one lead publicity cause increase covid outcome real issue home gathering,one two park where drinking already outlaw mayor grandstand instead job one would lead publicity cause increase outcome when real issue home gathering broken heart
1.38E+18,"Key points from today's COVID-19 update in #Ottawa from associate medical officer of health: 

- Worst it has been 
- Hospitalizations doubling every 12 days 
- Hospital / ICU stays higher than ever 
- We are actually in a fifth wave 
- We could see more rules relating to parks https://t.co/IQAGPwc5aM",4/14/2021 20:58,Month_04 Week 2,4,key point today covid update associate medical officer health bad hospitalization double hospital icu stay high ever actually fifth wave see rule relate park,key point today update associate medical officer health bad hospitalization double day hospital icu stay high ever actually fifth wave could see more rule relate park
1.38E+18,"Ottawa COVID-19 hospitalizations pushing health system to limits: Dr. Moloughney
#Health #Coronavirus #Covid #Dr.BrentMoloughney #OntarioStayHomeOrder #OttawaCovid #OttawaCovidHospitalizations #OttawaCovidLevels #OttawaHospitals #OttawaPublicHealth
https://t.co/rwBQhEceDW",4/14/2021 20:49,Month_04 Week 2,4,ottawa covid hospitalization push health system limit moloughney,ottawa hospitalization push health system limit moloughney
1.38E+18,"COVID-19: Ontario sees vaccine supply issues, Ottawa keeps AstraZeneca on the market: Some immunization clinics in Ontario were forced to close their doors or cancel appointments due to what Premier Doug Ford said was a thrice-delayed shipment of the… https://t.co/onNI8vERj6 https://t.co/zR1HMJ88hK",4/14/2021 20:49,Month_04 Week 2,4,covid ontario see vaccine supply issue ottawa keep astrazeneca market immunization clinic ontario force close door cancel appointment due premier doug ford say thrice delayed shipment,ontario see vaccine supply issue ottawa keep astrazeneca market immunization clinic ontario force close door cancel appointment due what premier doug ford say thrice_delayed shipment
1.38E+18,"COVID-19: Ontario sees vaccine supply issues, Ottawa keeps AstraZeneca on the market https://t.co/4yKwOka2z0 https://t.co/locqny3Y9N",4/14/2021 20:49,Month_04 Week 2,4,covid ontario see vaccine supply issue ottawa keep astrazeneca market,ontario see vaccine supply issue ottawa keep astrazeneca market
1.38E+18,"COVID-19: Ontario sees vaccine supply issues, Ottawa keeps AstraZeneca on the market https://t.co/fFT0rXAhVE https://t.co/O95RbPe6Fj",4/14/2021 20:49,Month_04 Week 2,4,covid ontario see vaccine supply issue ottawa keep astrazeneca market,ontario see vaccine supply issue ottawa keep astrazeneca market
1.38E+18,"COVID-19: Ontario sees vaccine supply issues, Ottawa keeps AstraZeneca on the market https://t.co/DnDyohcLtI https://t.co/XU9X2GgFiL",4/14/2021 20:49,Month_04 Week 2,4,covid ontario see vaccine supply issue ottawa keep astrazeneca market,ontario see vaccine supply issue ottawa keep astrazeneca market
1.38E+18,"COVID-19: Ontario sees vaccine supply issues, Ottawa keeps AstraZeneca on the market https://t.co/FJBluLGHKJ https://t.co/mQ3IcD7biT",4/14/2021 20:49,Month_04 Week 2,4,covid ontario see vaccine supply issue ottawa keep astrazeneca market,ontario see vaccine supply issue ottawa keep astrazeneca market
1.38E+18,"COVID-19: Ontario sees vaccine supply issues, Ottawa keeps AstraZeneca on the market https://t.co/ZDgvgUG4gB https://t.co/Cf1GKdJkyS",4/14/2021 20:49,Month_04 Week 2,4,covid ontario see vaccine supply issue ottawa keep astrazeneca market,ontario see vaccine supply issue ottawa keep astrazeneca market
1.38E+18,Ottawa health officials are urging residents to stay home as much as possible to limit the spread of COVID-19 as coronavirus levels and hospitalizations hit record highs locally. #OttNews https://t.co/t2p835qNA5,4/14/2021 20:47,Month_04 Week 2,4,ottawa health official urge resident stay home much possible limit spread covid coronavirus level hospitalization hit record high locally,ottawa health official urge resident stay home much possible limit spread coronavirus level hospitalization hit record high locally
1.38E+18,"COVID-19: Ontario sees vaccine supply issues, Ottawa keeps AstraZeneca on the market https://t.co/SkDbdacNdb https://t.co/SxQXdjiuhz",4/14/2021 20:46,Month_04 Week 2,4,covid ontario see vaccine supply issue ottawa keep astrazeneca market,ontario see vaccine supply issue ottawa keep astrazeneca market
1.38E+18,"COVID-19: Ontario sees vaccine supply issues, Ottawa keeps AstraZeneca on the market https://t.co/yPU8xlkP3n https://t.co/yHerqRPsUD",4/14/2021 20:46,Month_04 Week 2,4,covid ontario see vaccine supply issue ottawa keep astrazeneca market,ontario see vaccine supply issue ottawa keep astrazeneca market
1.38E+18,"COVID-19: Ontario sees vaccine supply issues, Ottawa keeps AstraZeneca on the market https://t.co/klE5ay8XHE https://t.co/TJq4cJYzXG",4/14/2021 20:46,Month_04 Week 2,4,covid ontario see vaccine supply issue ottawa keep astrazeneca market,ontario see vaccine supply issue ottawa keep astrazeneca market
1.38E+18,"COVID-19: Ontario sees vaccine supply issues, Ottawa keeps AstraZeneca on the market https://t.co/MUiZeGLhrS https://t.co/sLuWTR6WCJ",4/14/2021 20:46,Month_04 Week 2,4,covid ontario see vaccine supply issue ottawa keep astrazeneca market,ontario see vaccine supply issue ottawa keep astrazeneca market
1.38E+18,"COVID-19: Ontario sees vaccine supply issues, Ottawa keeps AstraZeneca on the market https://t.co/9njhhwj9Xp https://t.co/2jyIK0ZfFu",4/14/2021 20:46,Month_04 Week 2,4,covid ontario see vaccine supply issue ottawa keep astrazeneca market,ontario see vaccine supply issue ottawa keep astrazeneca market
1.38E+18,Ottawa Hospital issues public plea as COVID-19 wave continues to stretch staff thin https://t.co/e9XVfiMOsY via @citynewsottawa,4/14/2021 20:40,Month_04 Week 2,4,ottawa hospital issue public plea covid wave continue stretch staff thin via,ottawa hospital issue public plea wave continue stretch staff thin via
1.38E+18,"NEW - OPH warning that the COVID situation in Ottawa is ‘the worst that it’s been to date.’ 

https://t.co/YMAZER4JbB via @ctvottawa",4/14/2021 20:40,Month_04 Week 2,4,new oph warn covid situation ottawa bad date via,new oph warn situation ottawa bad date via
1.38E+18,"@OttawaHealth 
Can we not do more asymptomatic testing?

What you need to know about COVID-19 in Ottawa on Wednesday, April 14 https://t.co/2okLUVcQHd",4/14/2021 20:36,Month_04 Week 2,4,asymptomatic test need know covid ottawa wednesday,can not_do more asymptomatic test what need know ottawa wednesday
