Tweet Id,text,date,Week,Month,text_clean_textual,text_clean_sentiment
1.38E+18,The pre-school program at a city of Ottawa run child care centre will close for at least 14 days after an employee tested positive for COVID-19. #ottnews https://t.co/GgiN6b2P9P,4/9/2021 16:42,Month_04 Week 2,4,pre school program city ottawa run child care centre close least employee test positive covid,pre_school program city ottawa run child care centre will close least day employee test positive
1.38E+18,Ottawa sets record with 242 new COVID-19 cases https://t.co/wVTC7bUWOf #ottnews #ottawa https://t.co/rzRk8oQahB,4/9/2021 16:40,Month_04 Week 2,4,ottawa set record new covid case,ottawa set record with new case
1.38E+18,@traviskann We will be fine :) not enough vaccine has been sent to Ottawa to do everyone 50 plus these postal codes as per @OttawaHealth,4/9/2021 16:39,Month_04 Week 2,4,fine enough vaccine sent ottawa plus postal code per,will fine happy not_enough vaccine sent ottawa plus postal code per
1.38E+18,"The levels of COVID-19 variants of concern in Ottawa are much higher than previously reported, according to the latest OPH report. #OttNews https://t.co/PzoPLvR8hK",4/9/2021 16:35,Month_04 Week 2,4,level covid variant concern ottawa much high previously report accord late oph report,level variant concern ottawa much high previously report accord late oph report
1.38E+18,"In Ottawa, there are 2030 cases of Covid. The population is over a million. 16 months in to the worst pandemic in ever, 99.982% of the City doesn't have Covid, and 99.995% didn't die while infected.

That's way more pure than Dove soap, and they spent a lot of money bragging.",4/9/2021 16:33,Month_04 Week 2,4,ottawa case covid population million month bad pandemic ever city covid die infect way pure dove soap spent lot money bragging,ottawa case population over million month bad pandemic ever city not_have not_die infect way more pure dove soap spent lot money bragging
1.38E+18,"While @DrBonnieHenry told everyone to go hug and caused a covid tsunami. 
Where the 80+ year olds dying in hospital are at their highest rates ever in British Columbia. 

Icu Icu Icu. What is that @jjhorgan wants more money from ottawa? Cause we need to pay the hospital bill now https://t.co/KqX3pNRjy9",4/9/2021 16:31,Month_04 Week 2,4,told hug cause covid tsunami year old die hospital high rate ever british columbia icu icu icu money ottawa cause need pay hospital bill,told hug cause tsunami where year old die hospital high rate ever british columbia icu icu icu what want more money ottawa cause need pay hospital bill
1.38E+18,"@kelownascott If the Provinces failed act to deal with the pandemic Ottawa has failed because they failed to step in.  Lives &amp; are at stake.
They have the power.

The jurisdiction argument is a poor excuse for lack of action by Ottawa who just want to blame the Provincial failure.

#Cdnpoli",4/9/2021 16:28,Month_04 Week 2,4,province fail act deal pandemic ottawa fail fail step life amp stake power jurisdiction argument poor excuse lack action ottawa blame provincial failure,province fail act deal with pandemic ottawa fail fail step life amp stake power jurisdiction argument poor excuse lack action ottawa who just want blame provincial failure
1.38E+18,"More work needed to support Inuit fight COVID-19: PM: ... between Ottawa and Inuit leadership. Trudeau says more work is needed to close the gaps in food security, housing and health care that Inuit face. https://t.co/H3UIrEXK8J",4/9/2021 16:25,Month_04 Week 2,4,work need support inuit fight covid ottawa inuit leadership trudeau say work need close gap food security housing health care inuit face,more work need support inuit fight ottawa inuit leadership trudeau say more work need close gap food security housing health care inuit face
1.38E+18,Hi Travis. Ottawa public health telling us and viewers they can't do that yet for everyone 50 plus. There is not enough vaccine being sent to Ottawa. Not everyone in these postal codes live in high risk neighbourhoods. Viewers who call are being told media got it wrong. https://t.co/7GdeWTERrT,4/9/2021 16:24,Month_04 Week 2,4,travis ottawa public health tell viewer plus enough vaccine sent ottawa postal code live high risk neighbourhood viewer call told medium wrong,travis ottawa public health tell viewer cannot_do yet plus not_enough vaccine sent ottawa not_everyone postal code live high risk neighbourhood viewer who call told medium get wrong
1.38E+18,"@jeweleb11 @ctvottawa There are specific neighbourhoods in Ottawa where anyone over 18 can get the vaccine. The same thing is happening in Toronto and Peel--it's not ""anyone over 18 in the entire city,"" it's ""people over 18 in these neighbourhoods.""",4/9/2021 16:23,Month_04 Week 2,4,specific neighbourhood ottawa vaccine thing happen toronto peel entire city people neighbourhood,specific neighbourhood ottawa where anyone over can get vaccine thing happen toronto peel__it not_anyone over entire city people over neighbourhood
1.38E+18,"@smwgilbert Less frightening when you think about it this way, after 16 months in to the worst pandemic ever, 99.82% of Ottawa didn't catch covid.

And 99.995% of the city didn't die while infected.",4/9/2021 16:22,Month_04 Week 2,4,less frighten think way month bad pandemic ever ottawa catch covid city die infect,less frighten when think way month bad pandemic ever ottawa not_catch city not_die infect
1.38E+18,"BMPD co-op student, Elissa Perocchio, says her coursework has helped prepare her for her work at the House of Commons, where she uses design principles and UC/UI concepts to help test functionality and redesign the interface of the streaming platform, ParlVu. 
#CarletonU #ottawa",4/9/2021 16:20,Month_04 Week 2,4,bmpd student elissa perocchio say coursework help prepare work house common design principle concept help test functionality redesign interface stream platform parlvu,bmpd co_op student elissa perocchio say coursework help prepare work house common where design principle concept help test functionality redesign interface stream platform parlvu
1.38E+18,Ottawa sees record number of new COVID-19 cases on Friday https://t.co/hyRH4te06z via @ctvottawa,4/9/2021 16:18,Month_04 Week 2,4,ottawa see record number new covid case friday via,ottawa see record number new case friday via
1.38E+18,"Latest #Ottawa vaccine stats via @OttawaHealth. 

- % Eligible with 1 dose up from 16%
- On track for busiest week for vaccinations yet (confirmation on Monday)
- 1 dose for 70-79 up from 53% of that population
- 7800 Ottawa residents were vaccinated yesterday. https://t.co/mBPJPVpyAy",4/9/2021 16:18,Month_04 Week 2,4,late vaccine stats via eligible dose track busiest vaccination confirmation monday dose population ottawa resident vaccinate yesterday,late vaccine stats via eligible with dose track busiest week vaccination yet confirmation monday dose population ottawa resident vaccinate yesterday
1.38E+18,"@Vidallena_ @CountryGardener Double checked my math with my sister-in-law who is doing her PhD in mathematics. According to the statistics in Ottawa, the new variants are three times less deadly than the old one. A novel killer virus will mutate and become less lethal because it does not actually want to https://t.co/krrDTNF9st",4/9/2021 16:13,Month_04 Week 2,4,double checked math sister law phd mathematics accord statistic ottawa new variant three time less deadly old one novel killer virus mutate become less lethal actually,double checked math with sister_in_law who phd mathematics accord statistic ottawa new variant three time less deadly old one novel killer virus will mutate become less lethal not_actually want
1.38E+18,"@VeraEtches @celliottability Three weeks ago health officials asked for more restrictions eg, travel, put schools online to avoid this. Hospitalizations soaring, positivity rate high, etc.  Ottawa sets record with 242 new COVID-19 cases | CBC News https://t.co/VyrvAbkEcL",4/9/2021 16:12,Month_04 Week 2,4,three ago health official ask restriction travel put school online avoid hospitalization soar positivity rate high etc ottawa set record new covid case cbc news,three week ago health official ask more restriction travel put school online avoid hospitalization soar positivity rate high etc ottawa set record with new case cbc news
1.38E+18,"Nothing gets ottawa bubble hornier than elxn calls or well known person possibly running ( especially since so much other news with pandemic, ukraine concerns, phillip, unemployment) then why haven't you gotten into pisding contest..major fails today in trying to inform citizens.",4/9/2021 16:09,Month_04 Week 2,4,nothing ottawa bubble hornier elxn call well know person possibly run especially much news pandemic ukraine concern phillip unemployment gotten pisding contest major fails today try inform citizen,nothing get ottawa bubble hornier elxn call well know person possibly run especially since much news with pandemic ukraine concern phillip unemployment why not_you gotten pisding contest major fails today try inform citizen
1.38E+18,"@johnsonkt47 @CBCOttawa Hi, I was managing that before OPH gave us a lot better data in a new dashboard last week. We just need a couple more updates from them under our belt before we bring another vaccine graph back that focuses just on Ottawa residents.",4/9/2021 16:04,Month_04 Week 2,4,manage oph give lot well data new dashboard last need couple update belt bring vaccine graph back focus ottawa resident,manage oph give lot well data new dashboard last week just need couple more update under belt bring another vaccine graph back focus just ottawa resident
1.38E+18,The Dementia Society of Ottawa and Renfrew County has put together a helpful document for preparing yourself and loved ones for the COVID-19 vaccine. Check out their website here https://t.co/Dpsr0YweiZ to learn what to expect and how to make the most out of this exciting day! https://t.co/OjcGHE5BqK,4/9/2021 16:03,Month_04 Week 2,4,dementia society ottawa renfrew county put helpful document prepare love one covid vaccine check website learn expect make excite,dementia society ottawa renfrew county put helpful document prepare love one vaccine check out website learn what expect make most out excite day
1.38E+18,There are more new COVID infections in under 40 y.o. (including children) vs 40+ in #Ottawa. Some are ending up in hospitals &amp; the ICU. Should schools still remain open for in-person instruction? Should essential workers still be without vaccination? @VeraEtches #ottnews #COVID19 https://t.co/wB486ILPpt,4/9/2021 16:00,Month_04 Week 2,4,new covid infection include child end hospital amp icu school still remain open person instruction essential worker still vaccination,more new infection under include child end hospital amp icu should school still remain open in_person instruction should essential worker still without vaccination
1.38E+18,"According to the open data, as of April 9, 2021 we've just had 

the top 5 highest new case days in Ottawa

in the span of the last six days, 

since the beginning of the pandemic. https://t.co/UIJnKLkici",4/9/2021 15:58,Month_04 Week 2,4,accord open data top high new case ottawa span last six begin pandemic,accord open data just top high new case day ottawa span last six day since begin pandemic
1.38E+18,"New single day record of COVID cases in Ottawa, 242, as well as province wide, 4,227 (when you factor in catch up numbers in the previous high). It is the rapid rise that spells how serious this variant driven third wave is.",4/9/2021 15:57,Month_04 Week 2,4,new single record covid case ottawa well province wide factor catch number previous high rapid rise spell serious variant driven third wave,new single day record case ottawa well province wide when factor catch number previous high rapid rise spell serious variant driven third wave
1.38E+18,"NEW: #Ottawa #COVID19 vaccine doses administered and received since Wednesday’s update:

Administered: 195,217 (+15,092)
Received: 223,150 (↔)
% Doses Administered: 84

#ottnews",4/9/2021 15:55,Month_04 Week 2,4,new vaccine dos administer receive wednesday update administer receive dos administer,new vaccine dos administer receive since wednesday update administer receive left_right arrow dos administer
1.38E+18,@OttawaHealth  is providing community update at 1pm today on the CoVID 19 pandemic and vaccination progress for Ottawa. Union presidents are meeting with @ocdsb senior staff at noon to get more info about which education workers will be prioritized and when. @OCETFO @OSSTFD25TBU,4/9/2021 15:53,Month_04 Week 2,4,provide community update today covid pandemic vaccination progress ottawa union president meeting senior staff noon info education worker prioritize,provide community update today pandemic vaccination progress ottawa union president meeting with senior staff noon get more info education worker will prioritize when
1.38E+18,"UPDATED: Ottawa Public Health reports 242 cases of COVID-19 in Ottawa on Friday - a one-day record.

Positivity rate is 9.2%. #ottnews 

https://t.co/hJx8ZUObv5",4/9/2021 15:46,Month_04 Week 2,4,update ottawa public health report case covid ottawa friday one record positivity rate,update ottawa public health report case ottawa friday one_day record positivity rate
1.38E+18,"@nilikm Ottawa? My M-i-L was really sick last summer, but had no way to access the test sites (nevermind that she would've been too sick to wait in the 3+hr line-ups they had at the time).

By the time she was well enough, she tested negative, unknown if she had Covid or not.",4/9/2021 15:46,Month_04 Week 2,4,ottawa really sick last summer way access test site nevermind sick wait line ups time time well enough test negative unknown covid,ottawa m_i_l really sick last summer no_way access test site nevermind would too sick wait line_ups time time well enough test unknown not
1.38E+18,"Today, April 9 at 1 pm, we'll have an update on the response to the COVID-19 pandemic and vaccination progress for Ottawa. Watch on Rogers TV or listen live: https://t.co/4TWqA0Hcn7  #OttCity #COVID19 #Vaccine https://t.co/kouo7kcd7U",4/9/2021 15:41,Month_04 Week 2,4,today update response covid pandemic vaccination progress ottawa watch rogers listen live,today will update response pandemic vaccination progress ottawa watch rogers listen live
1.38E+18,"@MarkSlapinski No, thanks!  Erin O'Toole never misses an opportunity to BE a tool. Has little platform.  Ontario's uneducated conservative premier has done a poor job in this pandemic.  Would have been a much worse 13 months with a conservative (be it Scheer or O'Toole) at the helm in Ottawa.",4/9/2021 15:38,Month_04 Week 2,4,thanks erin toole never miss opportunity tool little platform ontario uneducated conservative premier poor job pandemic much bad month conservative scheer toole helm ottawa,no_thanks erin notoole never miss opportunity tool little platform ontario uneducated conservative premier poor job pandemic would much bad month with conservative scheer notoole helm ottawa
1.38E+18,"NEW: #Ottawa sets 1-day record with 242 newly confirmed cases of #COVID19; 2,023 active cases.
 
New: 242 (19,030)
Newly resolved: 166 (16,536)
7-Day Avg. of New Cases: 206 (🔼)

Hospitalizations: 71, 24 in ICU (+2, +4 in ICU)
Deaths: 471 (+1)
Test positivity: 9.2% (🔼)
#ottnews",4/9/2021 15:38,Month_04 Week 2,4,new set record newly confirm case active case new newly resolve avg new case hospitalization icu icu death test positivity,new set day record with newly confirm case active case new newly resolve day avg new case upwards button hospitalization icu icu death test positivity upwards button
1.38E+18,"NEW: #Ottawa sets new #COVID19 pandemic highs today for:

Single-day case total
Weekly Average of new cases
Weekly incidence rate
Test positivity
Hospitalized cases, including ICU 
(1/2)
#ottnews",4/9/2021 15:38,Month_04 Week 2,4,new set new pandemic high today single case total weekly average new case weekly incidence rate test positivity hospitalize case include icu,new set new pandemic high today single_day case total weekly average new case weekly incidence rate test positivity hospitalize case include icu
1.38E+18,@BreenOuellette I had the same experience when I called the Ottawa Public Health unit. She said I had to wait even though I was Indigenous. I was trying to book my second Covid shot.,4/9/2021 15:36,Month_04 Week 2,4,experience call ottawa public health unit say wait even indigenous try book second covid shot,experience when call ottawa public health unit say wait even though indigenous try book second shot
1.38E+18,"Day 2 of Ontario's Stay at Home Order. Ottawa has just broken its previous one day case record. 246 new COVID cases today. Going to build a panic room to hide in with Jodie Foster until I can get my shot in (possibly) June. Stay safe, Canada! https://t.co/PeNVmi6243",4/9/2021 15:31,Month_04 Week 2,4,ontario stay home order ottawa broken previous one case record new covid case today build panic room hide jodie foster shot possibly stay safe canada,day ontario stay home order ottawa just broken previous one day case record new case today build panic room hide with jodie foster can get shot possibly stay safe canada
1.38E+18,"Ottawa 50+ residents in COVID-19 'hot spots,' moderate-priority health care workers now vaccine eligible https://t.co/UnV1zgAqNK https://t.co/OkuvVeLdNk",4/9/2021 15:27,Month_04 Week 2,4,ottawa resident covid hot spot moderate priority health care worker vaccine eligible,ottawa resident hot spot moderate_priority health care worker vaccine eligible
1.38E+18,@deonandan In Ottawa using the whole PC means whole buildings individual complexes. Better yet to provide essential workers vaccine eligibility letter through employers. Can include immediate family. Better than hit&amp;miss PC prefixes.,4/9/2021 15:26,Month_04 Week 2,4,ottawa use whole mean whole building individual complex well provide essential worker vaccine eligibility letter employer include immediate family well hit amp miss prefix,ottawa use whole mean whole building individual complex well yet provide essential worker vaccine eligibility letter employer can include immediate family well hit amp miss prefix
1.38E+18,@deonandan In Ottawa using prefix is creates averaging and to distribute vaccine like this you may hit a complex but then include a pile of single homes with everyone working from home or you may miss a complex because it is in an otherwise quiet area.,4/9/2021 15:22,Month_04 Week 2,4,ottawa use prefix creates average distribute vaccine like hit complex include pile single home work home miss complex quiet area,ottawa use prefix creates average distribute vaccine like hit complex include pile single home with work home miss complex otherwise quiet area
1.38E+18,"#Ontario added 4,227 #COVID-19 cases on Friday with 71% in the hot spots around the #GTHA and #Ottawa.
https://t.co/Gk3DWvDRPZ",4/9/2021 15:19,Month_04 Week 2,4,add case friday hot spot around,add case friday with hot spot around
1.38E+18,"It's a provincial directive, but health-care workers who aren't on the front line (working from home) can now pre-register for the vaccine in Ottawa.

Meanwhile, childcare workers and teachers on the front line: https://t.co/thidLtBIqX",4/9/2021 15:18,Month_04 Week 2,4,provincial directive health care worker front line work home pre register vaccine ottawa meanwhile childcare worker teacher front line,provincial directive health_care worker who not_on front line work home can pre_register vaccine ottawa meanwhile childcare worker teacher front line
1.38E+18,"#Ontario added 4,227 #COVID-19 cases on Friday with 71% in the hot spots around the #GTHA and #Ottawa.
https://t.co/fn2dtX4Awm",4/9/2021 15:18,Month_04 Week 2,4,add case friday hot spot around,add case friday with hot spot around
1.38E+18,"#Ontario added 4,227 #COVID-19 cases on Friday with 71% in the hot spots around the #GTHA and #Ottawa.
https://t.co/G21LWCUTHA",4/9/2021 15:17,Month_04 Week 2,4,add case friday hot spot around,add case friday with hot spot around
1.38E+18,Key COVID-19 numbers in the Ottawa area today - https://t.co/9tM0OVWUJr: Ottawa Public Health recorded 156 more COVID-19 cases on Thursday and no more deaths. https://t.co/vuGWDpkxX0 #canada #guestpost #canadanews https://t.co/FoY0L4hDtC,4/9/2021 15:13,Month_04 Week 2,4,key covid number ottawa area today ottawa public health record covid caseson thursday death,key number ottawa area today ottawa public health record more case thursday no_more death
1.38E+18,"Must read: How can Ottawa help ensure more inclusive pandemic recovery?

@LC_President @LethCollege @damyot 

In times like these, the critical role of #cdnpse, helping 🇨🇦 adapt &amp; develop the skills they need to succeed, is more important than ever. 
https://t.co/e68Jgk3Vra",4/9/2021 15:11,Month_04 Week 2,4,read ottawa help ensure inclusive pandemic recovery time like critical role help adapt amp develop skill need succeed important ever,must read can ottawa help ensure more inclusive pandemic recovery time like critical role help Canada adapt amp develop skill need succeed more important ever
1.38E+18,If anyone in Ottawa wants to go for a covid safe walk pls let me know!! :),4/9/2021 15:08,Month_04 Week 2,4,ottawa covid safe walk pls know,anyone ottawa want safe walk pls know happy
1.38E+18,"Locally, there are 1,218 new cases in Toronto, 762 in Peel, 532 in York Region, 247 in Durham and 246 in Ottawa.

There are now 1,492 people hospitalized in the province due to COVID-19 with 552 in the ICU.
https://t.co/HxQ5aHC4tH",4/9/2021 15:07,Month_04 Week 2,4,locally new case toronto peel york region durham ottawa people hospitalize province due covid icu,locally new case toronto peel york region durham ottawa people hospitalize province due with icu
1.38E+18,"@Rob54235257 @celliottability @JR_Ottawa They got vaccinated in Texas, it has just been a week of lockdown, and Texas also doesn’t care or report on covid cases anymore doesn’t mean they aren’t there",4/9/2021 15:04,Month_04 Week 2,4,vaccinate texas lockdown texas doesnt care report covid case anymore doesnt mean arent,get vaccinate texas just week lockdown texas also not_care report case anymore not_mean not_there
1.38E+18,"Today, April 9 at 1 pm, the City of Ottawa and @ottawahealth will provide an update on the response to the COVID-19 pandemic and vaccination progress for Ottawa.

Watch on Rogers TV or listen live: https://t.co/x30QDzn2pa 
#OttCity #COVID19 #Vaccine https://t.co/oipl1iisKx",4/9/2021 15:02,Month_04 Week 2,4,today city ottawa provide update response covid pandemic vaccination progress ottawa watch rogers listen live,today city ottawa will provide update response pandemic vaccination progress ottawa watch rogers listen live
1.38E+18,"Ottawa is considering expanding essential workers list for cross border.
WTF...
Covid on the rise and they want to expand instead of limiting the original causes of covid spread.
Especially from the U.S. where it went ignored for so long.
Someone slap me. I am having a nightmare.",4/9/2021 14:57,Month_04 Week 2,4,ottawa consider expand essential worker list cross border wtf covid rise expand instead limit original cause covid spread especially ignore long slap nightmare,ottawa consider expand essential worker list cross border wtf rise want expand instead limit original cause spread especially where ignore long slap nightmare
1.38E+18,"More Ontario COVID data:
4,227 new cases + 18 deaths
T.O. 1,218       
Peel 762
York 532
Durham 247
Ottawa 246
Hospitalizations +75, total 1,492
ICU + 27, total 552",4/9/2021 14:55,Month_04 Week 2,4,ontario covid data new case death peel york durham ottawa hospitalization total icu total,more ontario data new case death peel york durham ottawa hospitalization total icu total
1.38E+18,"@Yamamoto97 What’s the record against a team not called the Senators? 16-14-2, barely .500. Oilers don’t get to play Ottawa in the playoffs, they were gifted a playoff spot with the Covid divisions. Yes, enjoy it, because the broom is coming once it’s playoff time.",4/9/2021 14:49,Month_04 Week 2,4,whats record team call senator barely oiler play ottawa playoff gift playoff spot covid division yes enjoy broom come playoff time,what record against team not_call senator barely oiler not_get play ottawa playoff gift playoff spot with division yes enjoy broom come playoff time
1.38E+18,"@fordnation Please PM offer vaccine to all teachers, no matter where they worked. Ottawa was also shutdown just a few days before all ON province. If it’s important to keep the kids at school; it’s should be important keeping teachers safe. 💉 is essential to do that.",4/9/2021 14:48,Month_04 Week 2,4,please offer vaccine teacher matter work ottawa shutdown province important keep kid school important keep teacher safe essential,please offer vaccine teacher no_matter where work ottawa also shutdown just few day province important keep kid school should important keep teacher safe syringe essential
1.38E+18,"A view of Ottawa COVID-19 daily cases, still looking for the numbers to turn. https://t.co/XsTIzoAfax",4/9/2021 14:46,Month_04 Week 2,4,view ottawa covid daily case still look number turn,view ottawa daily case still look number turn
1.38E+18,"Residents aged 50 and over in three hot spot neighbourhoods in Ottawa can book an appointment to receive a COVID-19 vaccine today through OPH, but the city warns it doesn’t have enough vaccine supply to vaccinate everyone. #ottnews https://t.co/OC6hZFjQra",4/9/2021 14:44,Month_04 Week 2,4,resident age three hot spot neighbourhood ottawa book appointment receive covid vaccine today oph city warns doesnt enough vaccine supply vaccinate,resident age over three hot spot neighbourhood ottawa can book appointment receive vaccine today oph city warns not_have enough vaccine supply vaccinate
