Tweet Id,text,date,Week,Month,text_clean_textual,text_clean_sentiment
1.38972E+18,"@imgrund CTV Ottawa news poll for today so far has the majority of respondents saying they would not take the AZ vaccine if it was offered first. Not a scientific poll, but does show the damage from N.ACI",5/4/2021 22:57,Month_05 Week 1,5,ctv ottawa news poll today far majority respondent say take vaccine offer first scientific poll show damage aci,ctv ottawa news poll today far majority respondent say would not_take vaccine offer first not_a scientific poll show damage aci
1.38971E+18,"Idea for Mothers Day during #lockdown - online yoga classes! May we suggest @pranashanti ?

Check out our 6 ideas for #MothersDay #gifts during a #pandemic - https://t.co/t4J9CPDNnw

#Ottawa
#Community
#WeAreInThisTogether
#cleaningprofessional
#housecleaning
#womanownedbusiness https://t.co/nkjuSUiabW",5/4/2021 22:40,Month_05 Week 1,5,idea mother online yoga class suggest check idea,idea mother day online yoga class suggest check out idea
1.38971E+18,Passenger refund issues flagged to federal government a year before pandemic: ... advocate says he flagged problems with refund rules to Ottawa more than a year before authorities said the pandemic brought the issues to light. https://t.co/PcsH8AQC3p,5/4/2021 22:35,Month_05 Week 1,5,passenger refund issue flag federal government year pandemic advocate say flag problem refund rule ottawa year authority say pandemic brought issue light,passenger refund issue flag federal government year pandemic advocate say flag problem with refund rule ottawa more year authority say pandemic brought issue light
1.38971E+18,"LISTEN: ""We're stable and cautiously optimistic that we're starting to improve.""

Ottawa Hospital CEO Cameron Love says as COVID cases come down, hospital admissions are stabilizing. He says once they reach ""pre-Christmas"" levels, they will look to resume elective surgeries. https://t.co/Pzxsf8Zu7x",5/4/2021 22:30,Month_05 Week 1,5,listen stable cautiously optimistic start improve ottawa hospital ceo cameron love say covid case come hospital admission stabilize say reach pre christmas level look resume elective surgery,listen stable cautiously optimistic start improve ottawa hospital ceo cameron love say case come down hospital admission stabilize say reach pre_christmas level will look resume elective surgery
1.38971E+18,"@fordnation 75% decrease of cases since Quebec implemented curfew on January 9. 
Ontario only 19% decrease for same period.
It is a shame to not use curfew like other countries or Quebec. 
Management of Covid in Ontario is a  total failure.
It is useless to try to blame Ottawa for you",5/4/2021 22:28,Month_05 Week 1,5,decrease case quebec implement curfew ontario decrease period shame use curfew like country quebec management covid ontario total failure useless try blame ottawa,decrease case since quebec implement curfew ontario only decrease period shame not_use curfew like country quebec management ontario total failure useless try blame ottawa
1.38971E+18,"@youseepeeYYC @BarbLarochelle Obviously Ottawa/Trudeau.
Then something will be Nothley's fault
And personal responsibility

But, THE VIRUS DID THIS!!!",5/4/2021 22:28,Month_05 Week 1,5,obviously ottawa trudeau nothley fault personal responsibility virus,obviously ottawa trudeau will nothley fault personal responsibility virus
1.38971E+18,An air passenger rights advocate says he flagged problems with refund rules to Ottawa more than a year before authorities said the pandemic brought the issues to light. https://t.co/rGnOZz8ahL,5/4/2021 22:20,Month_05 Week 1,5,air passenger right advocate say flag problem refund rule ottawa year authority say pandemic brought issue light,air passenger right advocate say flag problem with refund rule ottawa more year authority say pandemic brought issue light
1.38971E+18,Coming up on @CBCOttawa  News at 6: A Pop-up #Covid19 #vaccination clinic targeting high risk communities opened today in #Overbrook. I'll speak to City Councillor @rawlsonking about the particular needs of some of #Ottawa's most  vulnerable residents during the #pandemic.,5/4/2021 22:14,Month_05 Week 1,5,come news pop clinic target high risk community open today speak city councillor particular need vulnerable resident,come news pop_up clinic target high risk community open today will speak city councillor particular need most vulnerable resident
1.3897E+18,@apukwa There was a worker in a LTC in Ottawa that was given the vaccine at 16 I think?,5/4/2021 22:10,Month_05 Week 1,5,worker ltc ottawa give vaccine think,worker ltc ottawa give vaccine think
1.3897E+18,"Shadow pandemic. God bless these parents and children. Unimaginable 💔
The kids are not all right: Ed­u­ca­tors worry about ab­sences as COVID-19 chal­lenges con­tinue for par­ents, stu­dents (The Globe and Mail (Ottawa/Quebec Edition)), May 04, 2021
https://t.co/6IrMiGsPqd https://t.co/Ufr1oIQAql",5/4/2021 21:56,Month_05 Week 1,5,shadow pandemic god bless parent child unimaginable kid right educator worry absence covid challenge continue parent student globe mail ottawa quebec edition,shadow pandemic god bless parent child unimaginable broken heart kid not_all right tor worry sences chal lenges con tinue par ents stu dent globe mail ottawa quebec edition
1.3897E+18,"DoFo has no plan for LTC - b4, during or after COVID. We will become the elderly who will suffer
Thou­sands of deaths later, we still have no plan for ac­tion in long-term care (The Globe and Mail (Ottawa/Quebec Edition)), May 04, 2021
https://t.co/ulfAnxR8L9 https://t.co/rxn8NJBJGr",5/4/2021 21:52,Month_05 Week 1,5,dofo plan ltc covid become elderly suffer thousand death later still plan action long term care globe mail ottawa quebec edition,dofo no_plan ltc will become elderly who will suffer thou sand death later still no_plan tion long_term care globe mail ottawa quebec edition
1.3897E+18,"@fordnation 75% decrease of cases since Quebec implemented curfew on January 9. 
Ontario only 19% decrease for same period.
It is a shame to not use curfew like other countries or Quebec. 
Management of Covid in Ontario is a  total failure.
It is useless to try to blame Ottawa for you.",5/4/2021 21:49,Month_05 Week 1,5,decrease case quebec implement curfew ontario decrease period shame use curfew like country quebec management covid ontario total failure useless try blame ottawa,decrease case since quebec implement curfew ontario only decrease period shame not_use curfew like country quebec management ontario total failure useless try blame ottawa
1.3897E+18,"@VaxHuntersCan any word on vaccine availability in Ottawa? I'm 48, registered with 7+ pharmacies in Ottawa as soon as my age range was included. I've not been contacted by a single one. Assuming there's no supply?",5/4/2021 21:48,Month_05 Week 1,5,word vaccine availability ottawa register pharmacy ottawa soon age range include contact single one assume supply,any word vaccine availability ottawa register with pharmacy ottawa soon age range include not_be contact single one assume no_supply
1.3897E+18,"Council votes near unanimously (save for 1 item) to spend/save 2020 budget surplus ($22.3M - result of bailouts from Ottawa/Queen's Park &amp; city hall cuts made early in pandemic:
*5M in reserve fund for COVID recovery
*12.3M to help address any 2021 shortfall
*3.5M for RBC Place",5/4/2021 21:43,Month_05 Week 1,5,council vote near unanimously save item spend save budget surplus result bailouts ottawa queen park amp city hall cut make early pandemic reserve fund covid recovery help address shortfall rbc place,council vote near unanimously save item spend save budget surplus result bailouts ottawa queen park amp city hall cut make early pandemic reserve fund recovery help address any shortfall rbc place
1.3897E+18,"Pfizer-BioNTech vaccine not troubled by variants so far, says CEO https://t.co/qZ3msk65ix #ottnews #ottawa https://t.co/RwF3gX3G8o",5/4/2021 21:40,Month_05 Week 1,5,pfizer biontech vaccine troubled variant far say ceo,pfizer_biontech vaccine not_troubled variant far say ceo
1.3897E+18,"New Civic campus design informed by pandemic, CEO says https://t.co/KiZ6kQHVtO #ottnews #ottawa https://t.co/tjmJaEesBm",5/4/2021 21:40,Month_05 Week 1,5,new civic campus design inform pandemic ceo say,new civic campus design inform pandemic ceo say
1.38969E+18,If you are in #Ottawa this site is a sure cure for some of the pandemic blahs. #tulips https://t.co/AstcoX8AyN,5/4/2021 21:31,Month_05 Week 1,5,site sure cure pandemic blah,site sure cure pandemic blah
1.38969E+18,"Opinion | What’s it safe to do after a COVID-19 vaccination? We’re still waiting for Ottawa to tell us. https://t.co/uAmmwv82pj

#COVIDcanada https://t.co/BsgTmXTklF",5/4/2021 21:30,Month_05 Week 1,5,opinion whats safe covid vaccination still wait ottawa tell,opinion what safe vaccination still wait ottawa tell
1.38969E+18,"Today's @TheHubCanada's Explainer notes that Ottawa's post-pandemic deficit projections assume that program spending growth will be much slower than its pre-pandemic record. If spending grows roughly 6% per year (as it averaged between 15-16 and 19-20), the deficit may be bigger. https://t.co/yHT4HLvUJW https://t.co/Sdlrl3m0VR",5/4/2021 21:29,Month_05 Week 1,5,today explainer note ottawa post pandemic deficit projection assume program spending growth much slow pre pandemic record spending grows roughly per year average deficit big,today explainer note ottawa post_pandemic deficit projection assume program spending growth will much slow pre_pandemic record spending grows roughly per year average deficit big
1.38969E+18,@AdamQuinn79 @kimmyann1111 @Dame_Lillard The Raptors had no choice but relocate for the season. I’m not calling Ottawa because I don’t mess with valid covid restrictions. Raptors definitely in the harder position - it isn’t close,5/4/2021 21:27,Month_05 Week 1,5,raptor choice relocate season call ottawa mess valid covid restriction raptor definitely harder position isnt close,raptor no_choice relocate season not_call ottawa not_mess with valid restriction raptor definitely harder position not_close
1.38969E+18,"A prediction of today's covid announcement: 
- A level 5 knock it off
- A nuclear level of concern
- Maximal personal responsibility
- Ginormous amount of blame towards Ottawa for not enough vaccines
- Laws work but they dont work so here's more laws*

* Laws already exist
#AbLeg",5/4/2021 21:07,Month_05 Week 1,5,prediction today covid announcement level knock nuclear level concern maximal personal responsibility ginormous amount blame towards ottawa enough vaccine law work work law law exist,prediction today announcement level knock off nuclear level concern maximal personal responsibility ginormous amount blame towards ottawa not_enough vaccine law work dont work more law law already exist
1.38969E+18,"@radioKristy 

3 Days now and no contact from CFRA Ottawa's Favourite Station?

Enough is Enough,

Leadership is what I and you might need.

Pendamic Covid-19 will longer keep me down to my knees.

Courage and braveness is needed more than ever.

God Bless My Mother.",5/4/2021 21:06,Month_05 Week 1,5,contact cfra ottawa favourite station enough enough leadership need pendamic covid longer keep knee courage braveness need ever god bless mother,day no_contact cfra ottawa favourite station enough enough leadership what might need pendamic will longer keep down knee courage braveness need more ever god bless mother
1.38969E+18,"What goes into the set-up of an #Ottawa pop-up vaccine clinic? It requires the help of many people and various City departments.
Go behind the scenes with Amanda Farias, Logistics Section Chief for the City’s Emergency Operations Centre: https://t.co/Wqmvq8BdXg @OttawaHealth",5/4/2021 21:02,Month_05 Week 1,5,set pop vaccine clinic require help people various city department behind scene amanda farias logistics section chief city emergency operation centre,what set_up pop_up vaccine clinic require help many people various city department behind scene with amanda farias logistics section chief city emergency operation centre
1.38968E+18,"@Summerlover_5 @BrickmanInGA @RonFilipkowski Happen in West Michigan too.  They protested their way into unsafe face to face classes, and now think they can run the schools.  No surprise that Kent/Ottawa/Newaygo counties are still surging with COVID. https://t.co/uLQCKvDvdG",5/4/2021 20:53,Month_05 Week 1,5,happen west michigan protest way unsafe face face class think run school surprise kent ottawa newaygo county still surge covid,happen west michigan too protest way unsafe face face class think can run school no_surprise kent ottawa newaygo county still surge with
1.38968E+18,"@DebRule65 We have an idiot like this in the Ottawa area, he has been officially charged twice, court dates, and fines. Other than them getting covid and suffering through it. Charges are the only solution.",5/4/2021 20:50,Month_05 Week 1,5,idiot like ottawa area officially charge twice court date fine covid suffer charge solution,idiot like ottawa area officially charge twice court date fine get suffer charge only solution
1.38968E+18,An air passenger rights advocate says he flagged problems with refund rules to Ottawa more than a year before authorities said the pandemic brought the issues to light. https://t.co/yvwbaGJIeV,5/4/2021 20:50,Month_05 Week 1,5,air passenger right advocate say flag problem refund rule ottawa year authority say pandemic brought issue light,air passenger right advocate say flag problem with refund rule ottawa more year authority say pandemic brought issue light
1.38968E+18,@CTVNewsNorthern We had 90 cases in Ottawa today... and under 3000 in Ontario. Numbers are dropping and reopening Ontario Golf creates no risk of increasing these number as there has been zero covid cases caused by golf. Our premier and health minister should resign #nohope #notrust,5/4/2021 20:41,Month_05 Week 1,5,case ottawa today ontario number drop reopen ontario golf creates risk increase number zero covid case cause golf premier health minister resign,case ottawa today under ontario number drop reopen ontario golf creates no_risk increase number zero case cause golf premier health minister should resign
1.38968E+18,"An air passenger rights advocate says he flagged problems with refund rules to Ottawa more than a year before authorities said the pandemic brought the issues to light.
https://t.co/QDEAuD2Kdu",5/4/2021 20:40,Month_05 Week 1,5,air passenger right advocate say flag problem refund rule ottawa year authority say pandemic brought issue light,air passenger right advocate say flag problem with refund rule ottawa more year authority say pandemic brought issue light
1.38968E+18,@_Lenito That’s what they’re offering here in Ottawa at the COVID clinics. Pfizer or Moderna. I also wanted to steer clear of AZ as I’ve had friends that had bad reactions to it recently.,5/4/2021 20:33,Month_05 Week 1,5,lenito thats theyre offering ottawa covid clinic pfizer moderna steer clear ive friend bad reaction recently,lenito what offering ottawa clinic pfizer moderna also want steer clear friend bad reaction recently
1.38968E+18,"PM Justin Trudeau today said summer travel may be a go for Canadians, but we need more vaccinations and lower COVID numbers. He also said Ottawa is working w/ allies on vaccine passports. https://t.co/5lfk7wjTUZ #Canada #Trudeau #TravelTuesday #travel #vaccinepassports #tourism",5/4/2021 20:32,Month_05 Week 1,5,justin trudeau today say summer travel canadian need vaccination low covid number say ottawa work ally vaccine passport,justin trudeau today say summer travel canadian need more vaccination low number also say ottawa work ally vaccine passport
1.38968E+18,@OttawaHealth announced mobile pop-up vaccine clinics starting May 3rd for registrations. Nothing. Didn’t happen. “Coming soon.” What the hell Ottawa? Do you have something against low-income essential workers? Vanier matters. Vanier is far more vulnerable than Kanata. #ottcity,5/4/2021 20:28,Month_05 Week 1,5,announce mobile pop vaccine clinic start registration nothing didnt happen come soon hell ottawa low income essential worker vanier matter vanier far vulnerable kanata,announce mobile pop_up vaccine clinic start registration nothing not_happen come soon what hell ottawa against low_income essential worker vanier matter vanier far more vulnerable kanata
1.38968E+18,"The city of Ottawa (@JimWatsonOttawa) fought hard to open a mega shelter in Vanier. And yet, Vanier isn’t a covid hotspot? Apparently Kanata is?! @MathieuFleury @cmckenney @JLeiper this is maddening!!!!! #ottcity #ottpoli this decision has undoubtedly killed people",5/4/2021 20:20,Month_05 Week 1,5,city ottawa fought hard open mega shelter vanier vanier isnt covid hotspot apparently kanata madden decision undoubtedly kill people,city ottawa fought hard open mega shelter vanier yet vanier not_a hotspot apparently kanata madden decision undoubtedly kill people
1.38967E+18,"'We are scared': Nurses plead to be fully vaccinated 

https://t.co/GXrpGatS91 

#Ottawa #Canada #Nurses #pandemic @OttawaHealth https://t.co/VJiC07DEO4",5/4/2021 20:13,Month_05 Week 1,5,scar nurse plead fully vaccinate,scar nurse plead fully vaccinate
1.38967E+18,@MindfulRat @ResearchMSVU @TheRoyalMHC Thanks. The data has been kicking around for a decade (it’s from Ottawa) - the pandemic offered a good opportunity to come back to it.,5/4/2021 20:11,Month_05 Week 1,5,thanks data kick around decade ottawa pandemic offer good opportunity come back,thanks data kick around decade ottawa pandemic offer good opportunity come back
1.38967E+18,"If you're an international student in #Ottawa that doesn't have #OHIP, you can book your #COVID19  vaccine appointment at 613-691-5505 ext. 4. Appointments are available now if you are living in one of the Ontario hotspots.",5/4/2021 20:07,Month_05 Week 1,5,international student book vaccine appointment ext appointment available living one ontario hotspot,international student not_have can book vaccine appointment ext appointment available living one ontario hotspot
1.38967E+18,"#COVID19 indicators on April 20:
Incidence rate: 200.9 
Test positivity: 10.9  
New cases/day: 271.9

Today:
Incidence rate: 109.7 
Test positivity: 7  
New cases/day: 148.3

Things are slowly getting better, #Ottawa. 

Today's data breakdown: https://t.co/qZMRxlzpBA #ottnews https://t.co/wy3edQPAFC",5/4/2021 20:00,Month_05 Week 1,5,indicator incidence rate test positivity new case today incidence rate test positivity new case thing slowly well today data breakdown,indicator incidence rate test positivity new case day today incidence rate test positivity new case day thing slowly get well today data breakdown
1.38967E+18,"@politics_ottawa @robertbenzie @politics_ottawa and @robertbenzie  re: Which Vaccine is Best  .. one concern. The more articles (or headlines) that the public sees, the greater the lack of confidence becomes ... about vaccines in general. (I believe in knowing the facts, but this concern is also relevant.)",5/4/2021 19:58,Month_05 Week 1,5,vaccine best one concern article headline public see great lack confidence becomes vaccine general believe know fact concern relevant,vaccine best one concern more article headline public see great lack confidence becomes vaccine general believe know fact concern also relevant
1.38967E+18,"@AlbSeparation @Cangal21Isback @NormalGuy223 @whip4life @TrueNorthCentre We both know it’s a pander to lefties, selling out to climate alarmism and non-position on relevant issues like lockdowns and vaccine passports.  Same as is the politics that makes Ottawa undesirable, maybe if we separate Mav’s way we’ll require vaccine status upon immigration🤷‍♂️",5/4/2021 19:51,Month_05 Week 1,5,know pander lefty sell climate alarmism non position relevant issue like lockdown vaccine passport politics make ottawa undesirable separate mavs way well require vaccine status immigration,know pander lefty sell out climate alarmism non_position relevant issue like lockdown vaccine passport politics make ottawa undesirable maybe separate mav way will require vaccine status upon immigration man shrug
1.38967E+18,"@adam_stanley @MacLeodLisa @TheGolfOntario @ngcoacanada @GolfCanada I guess I will continue to follow the recommendations and attend the weekly Farmers Market here in Ottawa where 1,000s of other people are attending. @JimWatsonOttawa I guess the Farmers Market is a Covid free space....who would have thought.",5/4/2021 19:49,Month_05 Week 1,5,guess continue follow recommendation attend weekly farmer market ottawa people attend guess farmer market covid free space thought,guess will continue follow recommendation attend weekly farmer market ottawa where people attend guess farmer market free space who would thought
1.38967E+18,"@VanessaKW3 At a store called Ms Tiggywinkles in Ottawa, which unfortunately closed down right before the pandemic :( It was great for stethoscope animals that light up and make sounds - truly hypnotizing for babies.",5/4/2021 19:42,Month_05 Week 1,5,store call tiggywinkles ottawa unfortunately close right pandemic great stethoscope animal light make sound truly hypnotize baby,store call tiggywinkles ottawa unfortunately close down right pandemic sad great stethoscope animal light make sound truly hypnotize baby
1.38966E+18,"Doug Ford on Ottawa handling Ontario’s pandemic response:

“I'll tell you, he'd have a kick-back like he's never seen.”

Good luck Doug. 

#onpoli https://t.co/dQ296XpkWf",5/4/2021 19:34,Month_05 Week 1,5,doug ford ottawa handle ontario pandemic response tell kick back like never see good luck doug,doug ford ottawa handle ontario pandemic response will tell would kick_back like never see good luck doug
1.38966E+18,"At an Ottawa news conference today, Trudeau suggested Canadians could begin travelling outside the country again by summer, and that Canada will align with other countries on any documents needed with some form of certification to prove vaccinations against COVID-19. https://t.co/bijdHtXq4K",5/4/2021 19:32,Month_05 Week 1,5,ottawa news conference today trudeau suggest canadian begin travel outside country summer canada align country document need form certification prove vaccination covid,ottawa news conference today trudeau suggest canadian could begin travel outside country again summer canada will align with country any document need with form certification prove vaccination against
1.38966E+18,"Covid-19 Mobile Testing Clinic with @OttawaHealth 
Wednesday, May 5, 2021
2:00 PM to 4:00 PM
Rideau-Rockcliffe Community Resource Centre
815 St. Laurent Blvd., Ottawa ON K1K 3A7
NOTE: No appointment needed 
#covid19 https://t.co/h41f3ChO4T",5/4/2021 19:30,Month_05 Week 1,5,covid mobile test clinic wednesday rideau rockcliffe community resource centre laurent blvd ottawa note appointment need,mobile test clinic with wednesday rideau_rockcliffe community resource centre laurent blvd ottawa note no_appointment need
1.38966E+18,@fordnation Maybe start by enforcing non essential travel from within the provinces lot of people shopping in our small town from Toronto Ottawa Montreal been that way since start of the pandemic #wakeup #FordfailedOntario,5/4/2021 19:28,Month_05 Week 1,5,start enforce non essential travel within province lot people shopping small town toronto ottawa montreal way start pandemic,maybe start enforce non essential travel within province lot people shopping small town toronto ottawa montreal way since start pandemic
1.38966E+18,Ottawa Mayor Jim Watson to receive COVID-19 vaccine Wednesday https://t.co/jKTPMNqYNN,5/4/2021 19:20,Month_05 Week 1,5,ottawa mayor jim watson receive covid vaccine wednesday,ottawa mayor jim watson receive vaccine wednesday
1.38966E+18,"@sproudfoot Having had COVID come home from school at Easter and witnessing firsthand the crappy tracing (basically non-existent), community transmission needs to be back where it was in Sept before anyone ponders reopening schools in Ottawa.",5/4/2021 19:13,Month_05 Week 1,5,covid come home school easter witness firsthand crappy trace basically non existent community transmission need back sept ponders reopen school ottawa,come home school easter witness firsthand crappy trace basically non_existent community transmission need back where sept anyone ponders reopen school ottawa
1.38966E+18,"our apologies for not announcing a time to announce the latest restrictions

our committee is working overtime to come up with new and creative solutions to blame ottawa for our current pandemic situation

#abed #ableg #abpoli",5/4/2021 19:04,Month_05 Week 1,5,apology announce time announce late restriction committee work overtime come new creative solution blame ottawa current pandemic situation,apology not_announce time announce late restriction committee work overtime come with new creative solution blame ottawa current pandemic situation
1.38966E+18,"now past time to bring bloated, useless Ottawa under control &amp; stop the current madness ...LILLEY: Thousands of COVID-infected travellers enter Canada https://t.co/E3rTp8UmKh",5/4/2021 19:04,Month_05 Week 1,5,past time bring bloat useless ottawa control amp stop current madness lilley thousand covid infect traveller enter canada,past time bring bloat useless ottawa under control amp stop current madness lilley thousand covid_infected traveller enter canada
1.38966E+18,"@narendramodi @HCI_Ottawa Dude, you guys have one fucking job right now, get rid of Covid 19.
What part of that don’t you get???",5/4/2021 19:00,Month_05 Week 1,5,dude guy one fuck job right rid covid part,dude guy one fuck job right get rid what part not_you get
