Tweet Id,text,date,Week,Month,text_clean_textual,text_clean_sentiment
1.38901E+18,"GoFundMe for the family of Dave Dutton, the Ottawa Citizen editor who passed away from COVID on Friday  https://t.co/w4xuM4ilhg",5/2/2021 23:57,Month_05 Week 1,5,gofundme family dave dutton ottawa citizen editor pass away covid friday,gofundme family dave dutton ottawa citizen editor who pass away friday
1.389E+18,"Unfortunately, in contrast with the provincial timeline released last week, #Ottawa residents with high-risk health conditions (people on immunosuppressants) can’t book their 1st #COVID-19 vaccine appointment this week. https://t.co/ejjMNbjJMd",5/2/2021 23:51,Month_05 Week 1,5,unfortunately contrast provincial timeline release last resident high risk health condition people immunosuppressant book vaccine appointment,unfortunately contrast with provincial timeline release last week resident with high_risk health condition people immunosuppressant cannot_book vaccine appointment week
1.389E+18,"Two people who'd never died before: Ottawa sees 174 new COVID-19 cases, two new deaths Sunday.
https://t.co/lA12dBM984

via @GoogleNews",5/2/2021 23:50,Month_05 Week 1,5,two people never die ottawa see new covid case two new death sunday via,two people who would never die ottawa see new case two new death sunday via
1.389E+18,"FYI Ottawa folks: for COVID-19 vaccines info, @OttawaHealth &amp; the City have a super helpful newsletter you can sign up for to get the latest on availability and links to register when you're eligible.

https://t.co/U2BXEJ8EBr https://t.co/raf0R0mx5A",5/2/2021 23:42,Month_05 Week 1,5,fyi ottawa folk covid vaccine info amp city super helpful newsletter sign late availability link register eligible,fyi ottawa folk vaccine info amp city super helpful newsletter can sign get late availability link register when eligible
1.389E+18,"Ottawa Age limit for COVID-19 vaccine appointments lowered to 18 and older for hot spot communities, 50 and older for community clinics -- wow you would think there is plenty of vaccine if you read this",5/2/2021 23:32,Month_05 Week 1,5,ottawa age limit covid vaccine appointment lower old hot spot community old community clinic wow think plenty vaccine read,ottawa age limit vaccine appointment lower old hot spot community old community clinic wow would think plenty vaccine read
1.389E+18,Terribly sad.. South Africa variant in Perth/Ottawa?? #ottnews #COVID19Ontario https://t.co/5PqbDm3CEu,5/2/2021 23:24,Month_05 Week 1,5,terribly sad south africa variant perth ottawa,terribly sad south africa variant perth ottawa
1.389E+18,"Starting Thursday, May 6th at 8:00am, all Ottawa residents born in or before 1971 (50+) may book their vaccine appointment at a community clinic by visiting https://t.co/hKF4javLTy or by calling 1-833-943-3900. 

Complete vaccine booking updates below ⬇️⬇️⬇️

2/2 https://t.co/gQ6wHGfOGM",5/2/2021 23:20,Month_05 Week 1,5,start thursday ottawa resident born book vaccine appointment community clinic visit call complete vaccine book update,start thursday ottawa resident born book vaccine appointment community clinic visit call complete vaccine book update below down arrow down arrow down arrow
1.389E+18,"@VaxHuntersCan @VaxHuntersCan  Could you Help!
An Ottawa man's struggle for a timely second vaccine dose.  Ottawa needs 2nd dose by May 17th 
Jackie Perez, CTV News Ottawa
Jackie Perez
Multi-Skilled Journalist
@JackiePerez__ Contact",5/2/2021 23:15,Month_05 Week 1,5,help ottawa man struggle timely second vaccine dose ottawa need dose jackie perez ctv news ottawa jackie perez multi skilled journalist contact,could help ottawa man struggle timely second vaccine dose ottawa need dose jackie perez ctv news ottawa jackie perez multi_skilled journalist contact
1.38899E+18,@jkenney you are a piece of shit floating ( no sinking as floating is good) that runs away when Covid is killing us. Go to a rodeo and fuck off back to Ottawa,5/2/2021 23:09,Month_05 Week 1,5,piece shit float sinking float good run away covid kill rodeo fuck back ottawa,piece shit float no_sinking float good run away when kill rodeo fuck off back ottawa
1.38899E+18,Ottawa Public Health says 174 more people in Ottawa have tested positive for COVID-19 and two more people have died.​  https://t.co/KXjK5qvxmL,5/2/2021 23:00,Month_05 Week 1,5,ottawa public health say people ottawa test positive covid two people die,ottawa public health say more people ottawa test positive two more people die
1.38899E+18,"Ottawa's new daily COVID-19 cases increase but stay below 200; hospitalizations continue to drop

https://t.co/awbm91ycWG",5/2/2021 23:00,Month_05 Week 1,5,ottawa new daily covid case increase stay hospitalization continue drop,ottawa new daily case increase stay below hospitalization continue drop
1.38899E+18,"Expanding the vaccine rollout, the new Civic Campus, and lower speed limits: Five stories to watch in Ottawa https://t.co/Jzs0EfxnKj via @ctvottawa",5/2/2021 22:37,Month_05 Week 1,5,expand vaccine rollout new civic campus low speed limit five story watch ottawa via,expand vaccine rollout new civic campus low speed limit five story watch ottawa via
1.38899E+18,An Ottawa man's struggle for a timely second vaccine dose https://t.co/EskUuIKb5e via @ctvottawa,5/2/2021 22:35,Month_05 Week 1,5,ottawa man struggle timely second vaccine dose via,ottawa man struggle timely second vaccine dose via
1.38899E+18,"@JackiePerez__ Fyi...I called Ottawa Public Health &amp;  cause I have a super rare auto immune disorder, only 250 worldwide, and they said there are NO exceptions and everyone no matter if doctors do notes to them ALL residents have to do the vaccine 4 months apart.",5/2/2021 22:34,Month_05 Week 1,5,fyi call ottawa public health amp cause super rare auto immune disorder worldwide say exception matter doctor note resident vaccine month apart,fyi call ottawa public health amp cause super rare auto immune disorder only worldwide say no_exception no_matter doctor note resident vaccine month apart
1.38898E+18,@Liams_Hockey Liam .....your thoughts gut feel whatever ...if Covid didn’t exsist....how do u think Ottawa fans would be reacting to this team/ home attendance? This young group have worked their butts off and been entertaining...deserve support in the rink.,5/2/2021 22:31,Month_05 Week 1,5,liam thought gut feel covid didnt exsist think ottawa fan react team home attendance young group work butt entertain deserve support rink,liam thought gut feel whatever not_exsist think ottawa fan would react team home attendance young group work butt off entertain deserve support rink
1.38898E+18,"@TailspinPaluch Christ Almighty! That entire Liberal led crew in Ottawa needs to go! Doesn't take a rocket scientist to see that. The bigger problem, is how to actually get rid of all these corrupt Liberal politicians, after they've bribed the Eastern Canadian population with Liberal Covid $$$$$",5/2/2021 22:28,Month_05 Week 1,5,christ almighty entire liberal lead crew ottawa need take rocket scientist see big problem actually rid corrupt liberal politician bribed eastern canadian population liberal covid,christ almighty entire liberal lead crew ottawa need not_take rocket scientist see big problem actually get rid corrupt liberal politician bribed eastern canadian population with liberal
1.38898E+18,"I could only find an appt. at a clinic outside the city, but more days opened up in Ottawa and I was easily able to reschedule my appointment to a local vaccine clinic.  I received both an email and a text message with my appointment confirmation code and location details. 3/",5/2/2021 22:06,Month_05 Week 1,5,find appt clinic outside city open ottawa easily able reschedule appointment local vaccine clinic receive email text message appointment confirmation code location detail,could only find appt clinic outside city more day open ottawa easily able reschedule appointment local vaccine clinic receive email text message with appointment confirmation code location detail
1.38898E+18,"Yesterday I got my COVID-19 vaccine in Ottawa and it was a very positive experience.  Unlike the start of the Ontario provincial booking system, it now seems to be running very smoothly.  It was easy to use the system, find a location and timeslot and book my appointment.  2/",5/2/2021 22:06,Month_05 Week 1,5,yesterday covid vaccine ottawa positive experience unlike start ontario provincial book system seem run smoothly easy use system find location timeslot book appointment,yesterday get vaccine ottawa very positive experience unlike start ontario provincial book system seem run very smoothly easy use system find location timeslot book appointment
1.38898E+18,"COVID-19: My vaccination experience in Ottawa &amp; what I can do now

This is a long thread but some people are anxious about the process to get their vaccine so I hope the information is helpful to some people. 🧵1/",5/2/2021 22:06,Month_05 Week 1,5,covid vaccination experience ottawa amp long thread people anxious process vaccine hope information helpful people,vaccination experience ottawa amp what can long thread people anxious process get vaccine hope information helpful people thread
1.38898E+18,"@FoodieAndFamily This whole covid shit is a scam. Give it up, stop living in fear and stop doing what the media and the idiots in Ottawa tell you to do..  the media dosent report about the suicides from people losing these business.",5/2/2021 22:05,Month_05 Week 1,5,whole covid shit scam give stop living fear stop medium idiot ottawa tell medium dosent report suicide people lose business,whole shit scam give stop living fear stop what medium idiot ottawa tell medium dosent report suicide people lose business
1.38898E+18,Dave Dutton (1951-2021): A 'loveable curmudgeon' — COVID claims motorcycle-racing editor | Ottawa Citizen https://t.co/C77npV6AjB,5/2/2021 22:04,Month_05 Week 1,5,dave dutton loveable curmudgeon covid claim motorcycle race editor ottawa citizen,dave dutton loveable curmudgeon claim motorcycle_racing editor ottawa citizen
1.38898E+18,"Weekly Ottawa County COVID-19 Vaccine Update - May 2, 2021
 https://t.co/8TtdLKh9D0",5/2/2021 21:56,Month_05 Week 1,5,weekly ottawa county covid vaccine update,weekly ottawa county vaccine update
1.38897E+18,An Ottawa man's struggle for a timely 2nd vaccine dose ⁦@TheHerleBurly⁩ ⁦@gmbutts⁩ ⁦@telfordk⁩ ⁦@BMC_Patients⁩ ⁦@MLInstitute⁩ ⁦@picardonhealth⁩ ⁦@kinsellawarren⁩ ⁦@RobynUrback⁩ ⁦@PnPCBC⁩ ⁦⁦ https://t.co/WfXezRndFU,5/2/2021 21:47,Month_05 Week 1,5,ottawa man struggle timely vaccine dose,ottawa man struggle timely vaccine dose
1.38897E+18,The Ontario government says adults 18 and older in three Ottawa neighbourhoods will be eligible to book a COVID-19 vaccine appointment through the provincial system starting Monday.​  https://t.co/n1XNZ7mDTs,5/2/2021 21:30,Month_05 Week 1,5,ontario government say adult old three ottawa neighbourhood eligible book covid vaccine appointment provincial system start monday,ontario government say adult old three ottawa neighbourhood will eligible book vaccine appointment provincial system start monday
1.38897E+18,"According to  #Ottawa Public Health, new and daily cases of #COVID19 declining compare to April 14th. But vaccine eligibility expanded on Monday to 18 and older in three Ottawa hot spots. Almost everything is closed, so, is it increasing or decreasing? @OttawaHealth😕😕 https://t.co/KwLFbfgt1L",5/2/2021 21:29,Month_05 Week 1,5,accord public health new daily case decline compare vaccine eligibility expand monday old three ottawa hot spot almost close increase decrease,accord public health new daily case decline compare vaccine eligibility expand monday old three ottawa hot spot almost close increase decrease
1.38897E+18,"Anyone in Ontario 50 and older will be eligible to book a vaccine appointment through the provincial system as of 8 a.m. Thursday, May 6th.  Go to https://t.co/scRohD5lz1 or call 1-833-943-3900. #COVID19Vaccine #Ottawa #Vaccines",5/2/2021 21:24,Month_05 Week 1,5,ontario old eligible book vaccine appointment provincial system thursday call,anyone ontario old will eligible book vaccine appointment provincial system thursday call
1.38897E+18,"Starting at 8 a.m. Monday persons 18 and older in postal codes starting with K1T, K1V, or K2V will be able to schedule an appointment to get a #COVID19 vaccine on the province's online booking portal https://t.co/U99r5PDp59 or by calling 1-833-943-3900 #Ottawa #COVIDVaccination",5/2/2021 21:20,Month_05 Week 1,5,start monday person old postal code start able schedule appointment vaccine province online book portal call,start monday person old postal code start with will able schedule appointment get vaccine province online book portal call
1.38896E+18,"Notley says last spring we didn't know as much about the pandemic, and they did propose having other protocols like Ottawa's virtual sittings. 

Says they would be happy to have detailed convos about moving to something similar as the virtual committee meetings.",5/2/2021 21:13,Month_05 Week 1,5,notley say last spring know much pandemic propose protocol like ottawa virtual sitting say happy detailed convos move similar virtual committee meeting,notley say last spring not_know much pandemic propose protocol like ottawa virtual sitting say would happy detailed convos move similar virtual committee meeting
1.38896E+18,"Pretty sure the only reason @jkenney doesn’t ask for help from the feds regarding #COVID19AB is because then he would have to admit that Ottawa is helping Alberta, taking away his scapegoat for why the @Alberta_UCP sucks so badly at everything in this pandemic. #AbLeg",5/2/2021 21:08,Month_05 Week 1,5,pretty sure reason doesnt ask help fed regard admit ottawa help alberta take away scapegoat suck badly pandemic,pretty sure only reason not_ask help fed regard would admit ottawa help alberta take away scapegoat why suck badly pandemic
1.38896E+18,"@Mom2364 @jkenney AND, he has the audacity to complain that Ottawa isn’t sending enough vaccine.  He literally accepts responsibility for nothing he has done wrong and it’s a LONG list.",5/2/2021 21:07,Month_05 Week 1,5,audacity complain ottawa isnt send enough vaccine literally accepts responsibility nothing wrong long list,audacity complain ottawa not_send enough vaccine literally accepts responsibility nothing wrong long list
1.38896E+18,@BBFarhadi Az appts are impossible get in ottawa....so yeah tomorrow will qualify for other ones...the first appt I get will be the vaccine I get,5/2/2021 20:43,Month_05 Week 1,5,appts impossible ottawa yeah tomorrow qualify one first appt vaccine,appts impossible get ottawa yeah tomorrow will qualify one first appt get will vaccine get
1.38896E+18,Active COVID-19 cases in Ottawa drop below 2000 on Saturday - CTV News Ottawa: Ottawa Public Health is reporting 156 more people in the city have tested positive for COVID-19 and three more people have died. https://t.co/qmd8xTe8ZY #saudiarabia #saudi #arabicemirates https://t.co/VfS7JYNR1h,5/2/2021 20:34,Month_05 Week 1,5,active covid case ottawa drop saturday ctv news ottawa ottawa public health reporting people city test positive covid three people die,active case ottawa drop below saturday ctv news ottawa ottawa public health reporting more people city test positive three more people die
1.38896E+18,"COVID-19: Two More Deaths In Ottawa, None In Outaouais |  Coronavirus: Ontario
https://t.co/zkC03d0oht https://t.co/3JwMcRRCzK",5/2/2021 20:34,Month_05 Week 1,5,covid two death ottawa none outaouais coronavirus ontario,two more death ottawa none outaouais coronavirus ontario
1.38895E+18,@Krista_B_85 Maybe I'll see you on that plane . . . I'm headed to the Island to see my dad 22 days after my second vaccine (as long as dad hasn't already headed to Ottawa to see his youngest grandkids before I get that chance!),5/2/2021 19:56,Month_05 Week 1,5,see plane head island see dad second vaccine long dad head ottawa see young grandkids chance,maybe will see plane head island see dad day second vaccine long dad not_already head ottawa see young grandkids get chance
1.38894E+18,"@JimmyMac2021 @VictorFedeli @PMOIndia @icbc_org @HCI_Ottawa @IndiainToronto @OntarioinIndia @_apoorvasri @TradeTeamIndia @Ajaybis @IndoCanadaCC @CanadaIndiaBiz @ICOBC @htTweets 1) The Feds tried. People ignored it and called it a violation of the Charter.
2) Ask Brian Mulroney who got rid of Connaught Labs. Also, it takes time to get a lab like that running. 3) 7 billion people need the vaccine with only a few labs around the world are making it.",5/2/2021 19:51,Month_05 Week 1,5,apoorvasri fed try people ignore call violation charter ask brian mulroney rid connaught lab take time lab like run billion people need vaccine lab around world make,apoorvasri fed try people ignore call violation charter ask brian mulroney who get rid connaught lab also take time get lab like run billion people need vaccine with only few lab around world make
1.38894E+18,"Teachers, grocery store workers, HCWs, and food service employees will all still be required to show up or not get paid, while the @UCPCaucus hides from accountability &amp; gets paid for doing nothing.
Time for Ottawa to step in and take over Alberta's Covid response #ableg #cdnpoli https://t.co/Bf4HR0LZqO",5/2/2021 19:42,Month_05 Week 1,5,teacher grocery store worker hcws food service employee still require show paid hide accountability amp paid nothing time ottawa step take alberta covid response,teacher grocery store worker hcws food service employee will still require show not_get paid hide accountability amp get paid nothing time ottawa step take over alberta response
1.38894E+18,Adults 18 and older in three Ottawa postal codes eligible for COVID-19 vaccines as of Monday https://t.co/8cU3FiFZDc via @ctvottawa,5/2/2021 19:41,Month_05 Week 1,5,adult old three ottawa postal code eligible covid vaccine monday via,adult old three ottawa postal code eligible vaccine monday via
1.38894E+18,Key COVID-19 numbers in the Ottawa area today https://t.co/eJk9glFFip #ottnews #ottawa https://t.co/sKcj3dNKae,5/2/2021 19:40,Month_05 Week 1,5,key covid number ottawa area today,key number ottawa area today
1.38894E+18,"@mestizachick @VictorFedeli @PMOIndia @icbc_org @HCI_Ottawa @IndiainToronto @OntarioinIndia @_apoorvasri @TradeTeamIndia @Ajaybis @IndoCanadaCC @CanadaIndiaBiz @ICOBC @htTweets Why did we not control the airports and the variants coming in?

Why didn't manufacture our own vaccine?

Why couldn't get more in the beginning?

I think we know why....",5/2/2021 19:29,Month_05 Week 1,5,apoorvasri control airport variant come manufacture vaccine begin think know,apoorvasri why not_control airport variant come why not_manufacture vaccine why could not_get more begin think know why
1.38894E+18,"HAPPENING NOW: Toledoans of various faiths and backgrounds gather for a unity event being held at Ottawa Park, in accordance with CDC COVID-19 guidance, hosted by the City of Toledo Human Relations Commission. The full story, coming up. https://t.co/UcHoCJejhq",5/2/2021 19:22,Month_05 Week 1,5,happen toledoans various faith background gather unity event held ottawa park accordance cdc covid guidance host city toledo human relation commission full story come,happen toledoans various faith background gather unity event held ottawa park accordance with cdc guidance host city toledo human relation commission full story come
1.38894E+18,"Great to be feeling this winning sensation again!
All the way from Ottawa, thanks to everyone at @Inter_en
For allowing Interisti around the world to feel immense joy during this long and tough pandemic.
Forza Inter per sempre! https://t.co/VSIRT0YLz9",5/2/2021 19:16,Month_05 Week 1,5,great feel win sensation way ottawa thanks allow interisti around world feel immense joy long tough pandemic forza inter per sempre,great feel win sensation again way ottawa thanks allow interisti around world feel immense joy long tough pandemic forza inter per sempre
1.38893E+18,@MichalLeblanc @Climatelou @SwitchHealthCA @GouvCanSante @GouvCanSante Ottawa’s airport isn’t even currently operating international flights. Total waste of time for travellers arriving in Montreal to send their Covid home test kits to @SwitchHealthCA in OTTAWA. Then Switch sends to a subcontractor! Who is the genius behind this plan?!,5/2/2021 19:07,Month_05 Week 1,5,ottawa airport isnt even currently operating international flight total waste time traveller arrive montreal send covid home test kit ottawa switch sends subcontractor genius behind plan,ottawa airport not_even currently operating international flight total waste time traveller arrive montreal send home test kit ottawa switch sends subcontractor who genius behind plan
1.38893E+18,"CPHO Sunday Edition – May 2, 2021 – Highlighting Canada's Research Contributions: Polio and COVID-19 Vaccines: OTTAWA, May 2, 2021 /CNW/ - This past week was National Immunization Awareness Week (NIAW), an annual event… https://t.co/k8mWbn6hcq #BlogArchive #Markets Seoul, Korea https://t.co/NJgPs7BxAE",5/2/2021 18:52,Month_05 Week 1,5,cpho sunday edition highlight canada research contribution polio covid vaccine ottawa cnw past national immunization awareness niaw annual event seoul korea,cpho sunday edition highlight canada research contribution polio vaccine ottawa cnw past week national immunization awareness week niaw annual event seoul korea
1.38893E+18,Adults 18 and older in three @jkenney and you can’t seem to keep a supply. Tell me again how well your representation is???Ottawa postal codes eligible for COVID-19 vaccines as of Monday - CTV Edmonton https://t.co/3xNrvNNwNx via @GoogleNews,5/2/2021 18:46,Month_05 Week 1,5,adult old three seem keep supply tell well representation ottawa postal code eligible covid vaccine monday ctv edmonton via,adult old three cannot_seem keep supply tell again well representation ottawa postal code eligible vaccine monday ctv edmonton via
1.38892E+18,"@CBCOttawa @OttawaHealth How are people in Ottawa still spreading COVID? Do we know?Schools are closed, people who can still working from home, stores and restaurants curb side pickup except groceries, no activities.",5/2/2021 18:32,Month_05 Week 1,5,people ottawa still spread covid know school close people still work home store restaurant curb side pickup grocery activity,people ottawa still spread know school close people who can still work home store restaurant curb side pickup except grocery no_activity
1.38892E+18,Active COVID-19 cases in Ottawa drop below 2000 on Saturday - CTV News Ottawa: Ottawa Public Health is reporting 156 more people in the city have tested positive for COVID-19 and three more people have died. https://t.co/Zw9FBi2FAQ #saudiarabia #saudi #arabicemirates,5/2/2021 18:30,Month_05 Week 1,5,active covid case ottawa drop saturday ctv news ottawa ottawa public health reporting people city test positive covid three people die,active case ottawa drop below saturday ctv news ottawa ottawa public health reporting more people city test positive three more people die
1.38892E+18,"@EmilyWisemanPhD @JimWatsonOttawa @OttawaHealth Yes @OttawaHealth did split the Lowertown area in two. 

I have raised the issue since Jan. as both have very similar COVID cases.

I believe they used the description from Ottawa Neighbourhood Study.

They identify LT East as a priority but not the western portion of LT.",5/2/2021 18:28,Month_05 Week 1,5,yes split lowertown area two raise issue jan similar covid case believe use description ottawa neighbourhood study identify east priority western portion,yes split lowertown area two raise issue since jan very similar case believe use description ottawa neighbourhood study identify east priority not_the western portion
1.38892E+18,@raymond_bradly @minister65 @SAndersonshpk @jkenney The vaccine shortage and letting the UK variants in ARE Ottawa's problem.. unfortunately for us.. https://t.co/v0HaXKAySR,5/2/2021 18:27,Month_05 Week 1,5,vaccine shortage variant ottawa problem unfortunately,vaccine shortage variant ottawa problem unfortunately
1.38892E+18,"Fighting Stigma :  Adults 18 and older in three Ottawa postal codes eligible for COVID-19 vaccines as of Monday: Ottawa Public Health has said it also intends to expand the rollout of ... building programs, licensed home child care and in-home service… https://t.co/99l4d6GuFu",5/2/2021 18:08,Month_05 Week 1,5,fight stigma adult old three ottawa postal code eligible covid vaccine monday ottawa public health say intend expand rollout building program license home child care home service,fight stigma adult old three ottawa postal code eligible vaccine monday ottawa public health say also intend expand rollout building program license home child care in_home service
1.38891E+18,Thank you Dr Kyeremanteng! He works tirelessly in a covid 19 ICU unit in Ottawa. Worth a watch. @OttawaHealth https://t.co/ojv4Vs8pMs,5/2/2021 17:54,Month_05 Week 1,5,thank kyeremanteng work tirelessly covid icu unit ottawa worth watch,thank kyeremanteng work tirelessly icu unit ottawa worth watch
1.38891E+18,Residents over 18 in #Ottawa hotspots eligible to book #COVID-19 vaccine this week https://t.co/56p5iuhNJ7 via @citynewsottawa,5/2/2021 17:47,Month_05 Week 1,5,resident hotspot eligible book vaccine via,resident over hotspot eligible book vaccine week via
1.38891E+18,"I’m hearing #Ottawa has reached 360,000 vaccine doses administered. Approximately 1,640,000 to go.",5/2/2021 17:43,Month_05 Week 1,5,hearing reach vaccine dos administer approximately,hearing reach vaccine dos administer approximately
