Tweet Id,text,date,Week,Month,text_clean_textual,text_clean_sentiment
1.39082E+18,"@ottawacity @ONgov Ottawa: . The experts recommend going outside as it is safer than indoors. 13 yr old boy, alone, on his birthday and your city clowns give him a $880 ticket for playing at the park That's ignorant. Not one covid infection anywhere in Canada caused by playground equipment",5/7/2021 23:59,Month_05 Week 1,5,ottawa expert recommend outside safer indoors old boy alone birthday city clown give ticket play park ignorant one covid infection anywhere canada cause playground equipment,ottawa expert recommend outside safer indoors old boy alone birthday city clown give ticket play park ignorant not_one infection anywhere canada cause playground equipment
1.39082E+18,"@MessierOnFire Getting mine tomorrow! #Ottawa #Ontario #Canada #AstraZeneca #CommunityImmunity #COVID
#Jabapalooza #GenXZeneca",5/7/2021 23:51,Month_05 Week 1,5,tomorrow,get tomorrow
1.39082E+18,"As Moderna COVID-19 vaccine shipments began arriving at Ottawa pharmacies in hot spot postal codes, two pharmacies expect to run out of doses within 24 hours. #ottnews https://t.co/jPtAC1s2ya",5/7/2021 23:51,Month_05 Week 1,5,moderna covid vaccine shipment begin arrive ottawa pharmacy hot spot postal code two pharmacy expect run dos within,moderna vaccine shipment begin arrive ottawa pharmacy hot spot postal code two pharmacy expect run out dos within hour
1.39082E+18,"When I signed up at #ShoppersDrugMart for a #COVID19Vaccine, I chose to get a shot in a store in my area instead of picking a specific store. I just got offered a vaccine in Toronto. I live in Ottawa. Thanks, but no thanks.",5/7/2021 23:51,Month_05 Week 1,5,sign chose shot store area instead pick specific store offer vaccine toronto live ottawa thanks thanks,when sign chose get shot store area instead pick specific store just get offer vaccine toronto live ottawa thanks no_thanks
1.39082E+18,This pandemic is far too important to be left to Ottawa - https://t.co/o8U2iEoWEH https://t.co/3Ogt2M2XTU,5/7/2021 23:49,Month_05 Week 1,5,pandemic far important left ottawa,pandemic far too important left ottawa
1.39081E+18,Why is this Ottawa-designed vaccine system being used in N.S. and not Ontario? https://t.co/4D5YlBjtMS,5/7/2021 23:40,Month_05 Week 1,5,ottawa design vaccine system use ontario,why ottawa_designed vaccine system use not_ontario
1.39081E+18,Ottawa sends COVID-19 rapid tests directly to businesses https://t.co/ODaOxqN9aZ via @torontostar @StephanieLevitz #cdnpoli #cdnecon,5/7/2021 23:32,Month_05 Week 1,5,ottawa sends covid rapid test directly business via,ottawa sends rapid test directly business via
1.39081E+18,Help Support Ottawa ICU Staff During COVID https://t.co/UGKShJFsA0,5/7/2021 23:32,Month_05 Week 1,5,help support ottawa icu staff covid,help support ottawa icu staff
1.39081E+18,"@ParagonCause @ottawacity https://t.co/TdYNoTiCbO
How can you talk about taking all the precautions needed to stop the spread of Covid and the pandemic. Yet here you are hosting a kids birthday party in one of the busiest skate parks in Ottawa, stop using your child as a shield for your own mistakes",5/7/2021 23:29,Month_05 Week 1,5,talk take precaution need stop spread covid pandemic host kid birthday party one busiest skate park ottawa stop use child shield mistake,can talk take precaution need stop spread pandemic yet host kid birthday party one busiest skate park ottawa stop use child shield mistake
1.39081E+18,Air Canada urges Ottawa to lift hotel quarantine as it reports $1.3B Q1 loss https://t.co/bBgOGnpMRV  .. love how AC is putting profit aheD of safety. We need to crush covid before world travel.,5/7/2021 23:27,Month_05 Week 1,5,air canada urge ottawa lift hotel quarantine report loss love put profit ahed safety need crush covid world travel,air canada urge ottawa lift hotel quarantine report loss love put profit ahed safety need crush world travel
1.3908E+18,We are literally dying from COVID STILL AND THESE TWATS .... Air Canada urges Ottawa to lift hotel quarantine as it reports $1.3B Q1 loss | https://t.co/5lAuL7jHjn - https://t.co/1KffiyFOD5,5/7/2021 22:55,Month_05 Week 1,5,literally die covid still twat air canada urge ottawa lift hotel quarantine report loss,literally die still twat air canada urge ottawa lift hotel quarantine report loss
1.3908E+18,Pellerin: Long-term care COVID deaths were predictable and preventable | Ottawa Citizen this needs to stay in the headlines every day until the election. ⁦@fordnation⁩ Dumb Ass will lie about he’s done for seniors. He killed them. #onpoli  https://t.co/3JmeoblRkf,5/7/2021 22:54,Month_05 Week 1,5,pellerin long term care covid death predictable preventable ottawa citizen need stay headline election dumb lie senior kill,pellerin long_term care death predictable preventable ottawa citizen need stay headline day election dumb will lie senior kill
1.3908E+18,"Pellerin: Long-term care COVID deaths were predictable and preventable | Ottawa Citizen ⁦@fordnation⁩ ⁦@celliottability⁩ ⁦@DrFullertonMPP⁩ lying, murdering bags of dirt. Every day. #onpoli #FordLiedPeopleDied #FordMustResign #DougFraud  https://t.co/3JmeoblRkf",5/7/2021 22:52,Month_05 Week 1,5,pellerin long term care covid death predictable preventable ottawa citizen lie murder bag dirt,pellerin long_term care death predictable preventable ottawa citizen lie murder bag dirt day
1.3908E+18,"@kahnkidz @fordnation Here is another fun one: 

Mother’s Day Cards = legal 
Birthday Cards = illegal

Not a joke &amp; confirmed at 2 separate stores in Ottawa. Smart virus.",5/7/2021 22:46,Month_05 Week 1,5,fun one mother card legal birthday card illegal joke amp confirm separate store ottawa smart virus,another fun one mother day card legal birthday card illegal not_a joke amp confirm separate store ottawa smart virus
1.3908E+18,One day in Ottawa and a catastrophe of vaccine messaging https://t.co/wSVOiG70Ct,5/7/2021 22:39,Month_05 Week 1,5,one ottawa catastrophe vaccine message,one day ottawa catastrophe vaccine message
1.3908E+18,"Meet Gabe. He's 5 years old and he loves tornado sirens.  And today, he got to start Ottawa County's monthly test of them: https://t.co/hhf2Iq9JYu https://t.co/iufDir2jbP",5/7/2021 22:30,Month_05 Week 1,5,meet gabe year old love tornado siren today start ottawa county monthly test,meet gabe year old love tornado siren today get start ottawa county monthly test
1.39079E+18,"@shesgotitgoinon @Northerngent4 Since the subject of poop is the topic, did you read an article about the Covid virus being very high in the poop in the city of Ottawa?? Yes the poop is being tested. To be exact the wastewater.",5/7/2021 22:25,Month_05 Week 1,5,subject poop topic read article covid virus high poop city ottawa yes poop test exact wastewater,since subject poop topic read article virus very high poop city ottawa yes poop test exact wastewater
1.39079E+18,"Interning during COVID
Last day for another excellent EUCAnet @CFGS_UVic @POLISWater intern: Sarah Cool-Fergus is an #Erasmus MA student and was collaborating with us from Ottawa for the past three months. We wish her all the best for her future! https://t.co/oudj4QOem8 https://t.co/eIpElkeOIC",5/7/2021 22:18,Month_05 Week 1,5,intern covid last excellent eucanet intern sarah cool fergus student collaborate ottawa past three month wish best future,intern last day another excellent eucanet intern sarah cool_fergus student collaborate with ottawa past three month wish best future
1.39079E+18,"""There are 1,000 people on the waiting list for a COVID-19 vaccine at Bridle Path Pharmacy, while 3,000 names are on the list for a vaccine at Promed Pharmacy.""

#Ottawa #OttNews 
https://t.co/JtSxvWOoKD via @ctvottawa",5/7/2021 22:16,Month_05 Week 1,5,people wait list covid vaccine bridle path pharmacy name list vaccine promed pharmacy via,people wait list vaccine bridle path pharmacy name list vaccine promed pharmacy via
1.39079E+18,"COVID Orphans - India’s shadow pandemic
In­dia’s emerg­ing cri­sis: Thou­sands of chil­dren left orphaned and vul­ner­a­ble by coun­try’s sec­ond wave of COVID-19 deaths (The Globe and Mail (Ottawa/Quebec Edition)), May 07, 2021
https://t.co/ihCDmypFbR https://t.co/vABeHANrtX",5/7/2021 22:10,Month_05 Week 1,5,covid orphan india shadow pandemic india emerge crisis thousand child left orphan vulnerable country second wave covid death globe mail ottawa quebec edition,orphan india shadow pandemic dia emerg ing cri thou sand chil dren left orphan vul ner ble coun try sec ond wave death globe mail ottawa quebec edition
1.39079E+18,"@AmberDawnWrites Yeah! Last time I saw the lady in Ottawa it was at the Lookout a couple of years ago! I have been thinking of her with the pandemic, and hoping she was doing all right.",5/7/2021 22:08,Month_05 Week 1,5,yeah last time saw lady ottawa lookout couple year ago think pandemic hop right,yeah last time saw lady ottawa lookout couple year ago think with pandemic hop right
1.39079E+18,Air Canada calls on Ottawa to disclose pandemic reopening plan https://t.co/8tGtcC6e6t,5/7/2021 22:04,Month_05 Week 1,5,air canada call ottawa disclose pandemic reopen plan,air canada call ottawa disclose pandemic reopen plan
1.39079E+18,"CTV News Ottawa: These Ottawa pharmacies will receive the Moderna COVID-19 vaccine.
https://t.co/PJkgLyEjZs

via @GoogleNews",5/7/2021 22:00,Month_05 Week 1,5,ctv news ottawa ottawa pharmacy receive moderna covid vaccine via,ctv news ottawa ottawa pharmacy will receive moderna vaccine via
1.39079E+18,Ottawa Public Health reported 110 new cases of COVID-19 in Ottawa on Friday.​  https://t.co/oQvAFheSPB,5/7/2021 22:00,Month_05 Week 1,5,ottawa public health report new case covid ottawa friday,ottawa public health report new case ottawa friday
1.39079E+18,COVID-19 in Ottawa: Weekly roundup - April 30 https://t.co/5qZEjDoVn5,5/7/2021 21:57,Month_05 Week 1,5,covid ottawa weekly roundup,ottawa weekly roundup
1.39079E+18,@kvallevand @ottriverkeeper @CanMusHistory @weathernetwork @MurphTWN @Ottawa_Tourism @CdnTulipfest @TourOutaouais @TulipCrush @NCC_CCN Really nice shot. I  so miss popping over the the Quebec side. Stupid COVID.,5/7/2021 21:57,Month_05 Week 1,5,really nice shot miss pop quebec side stupid covid,really nice shot miss pop over quebec side stupid
1.39078E+18,"Kenney declines Ottawa’s initial offer of help, requests assistance to acquire vaccine doses from U.S.

🇨🇦🗳🗳🗳🇨🇦
#ThanksKenney 
#abpoli #Covid19
 https://t.co/VOWI0qMaXh",5/7/2021 21:40,Month_05 Week 1,5,kenney decline ottawa initial offer help request assistance acquire vaccine dos,kenney decline ottawa initial offer help request assistance acquire vaccine dos Canada ballot box with ballot ballot box with ballot ballot box with ballot Canada
1.39078E+18,@sharath_peter @SwitchHealthCA @PHAC_GC Order random junk on Amazon Prime and get it next-day across Canada. But in a PANDEMIC @SwitchHealthCA and @GovCanHealth think it is OK not to have same-day dedicated pick-up couriers at least in 4 major cities! It took 4 days for Purolator to get my kit to Ottawa from Montreal!,5/7/2021 21:27,Month_05 Week 1,5,order random junk amazon prime next across canada pandemic think dedicate pick courier least major city take purolator kit ottawa montreal,order random junk amazon prime get next_day across canada pandemic think not_to same_day dedicate pick_up courier least major city take day purolator get kit ottawa montreal
1.39078E+18,"A smart Prime Minister would have made tried and true treatments available, last year.

We could have been done with this pandemic last summer, if it weren't for the clowns in Ottawa who call themselves, ""government"" https://t.co/1ePsH5wsh1",5/7/2021 21:24,Month_05 Week 1,5,smart prime minister make try true treatment available last year pandemic last summer clown ottawa call government,smart prime minister would make try true treatment available last year could with pandemic last summer not_for clown ottawa who call government
1.39078E+18,@Aaron79600573 @CBCCalgary Really? Does Ottawa have some extra vaccine we don’t know about?,5/7/2021 21:23,Month_05 Week 1,5,really ottawa extra vaccine know,really ottawa extra vaccine not_know
1.39078E+18,"@StephanieKusie I think Ottawa is a little further than you need to look, regarding failing Alberta. Kenney has plenty of covid and economic blood on his hands. #RealTalkRJ",5/7/2021 21:19,Month_05 Week 1,5,think ottawa little far need look regard fail alberta kenney plenty covid economic blood hand,think ottawa little far need look regard fail alberta kenney plenty economic blood hand
1.39078E+18,"Well Ottawa, you have something to be proud of this weekend.

First @nilikm, has her vaccine clinic running tomorrow on the field at @ImmaculataOCSB.

Second, a group of small business owners called @OttSpecEvents and rented a tent to cover the people lining up.

Pretty awesome.",5/7/2021 21:18,Month_05 Week 1,5,well ottawa proud weekend first vaccine clinic run tomorrow field second group small business owner call rent tent cover people line pretty awesome,well ottawa proud weekend first vaccine clinic run tomorrow field second group small business owner call rent tent cover people line pretty awesome
1.39077E+18,"We caught up with local non-profit @ancoura_ottawa about its work supporting persons living with mental illness, how that work has been impacted by the pandemic and how the organization has adapted.

#Ottawa #MentalHealthWeek
#Kitchissippi

https://t.co/BoX9Ij1sYh",5/7/2021 21:00,Month_05 Week 1,5,caught local non profit work support person living mental illness work impact pandemic organization adapt,caught with local non_profit work support person living with mental illness work impact pandemic organization adapt
1.39077E+18,"NEW: As Moderna COVID-19 vaccine shipments began arriving at Ottawa pharmacies in hot spot postal codes, two pharmacies expect to run out of doses within 24 hours.  #Ottnews 

https://t.co/sFzkaj6bNh",5/7/2021 20:59,Month_05 Week 1,5,new moderna covid vaccine shipment begin arrive ottawa pharmacy hot spot postal code two pharmacy expect run dos within,new moderna vaccine shipment begin arrive ottawa pharmacy hot spot postal code two pharmacy expect run out dos within hour
1.39077E+18,"NEW: As Moderna COVID-19 vaccine shipments began arriving at Ottawa pharmacies in hot spot postal codes, two pharmacies expect to run out of doses within 24 hours.  #Ottnews 

https://t.co/yGjAKDFDqN",5/7/2021 20:59,Month_05 Week 1,5,new moderna covid vaccine shipment begin arrive ottawa pharmacy hot spot postal code two pharmacy expect run dos within,new moderna vaccine shipment begin arrive ottawa pharmacy hot spot postal code two pharmacy expect run out dos within hour
1.39077E+18,"Canada’s job recovery hit a snag in April as a third wave of lockdowns and COVID-19 restrictions led to fresh employment losses.

The country shed 207,100 jobs last month, Statistics Canada reported Friday from Ottawa, partially erasing large gains over the previous two months. https://t.co/r8ebsaTCK2",5/7/2021 20:54,Month_05 Week 1,5,canada job recovery hit snag third wave lockdown covid restriction lead fresh employment loss country shed job last month statistic canada report friday ottawa partially erase large gain previous two month,canada job recovery hit snag third wave lockdown restriction lead fresh employment loss country shed job last month statistic canada report friday ottawa partially erase large gain over previous two month
1.39077E+18,"@AndFreedoms @sqirlgirly @globalnews Ottawa: ""Hey Alberta, need some help in fighting COVID-19?""

Alberta: ""Nah man, I'm good.""

*later*

Alberta: ""Wah wah wah! Ottawa does nothing for me!""

🙄 😒",5/7/2021 20:54,Month_05 Week 1,5,ottawa hey alberta need help fight covid alberta nah man good later alberta wah wah wah ottawa nothing,ottawa hey alberta need help fight alberta nah man good later alberta wah wah wah ottawa nothing face with roll eye unamused face
1.39077E+18,"Toronto COVID-19 patients no longer being transferred to Ottawa Hospital, CEO says https://t.co/BfKRj3qtqh",5/7/2021 20:47,Month_05 Week 1,5,toronto covid patient longer transfer ottawa hospital ceo say,toronto patient no_longer transfer ottawa hospital ceo say
1.39077E+18,COVID-19: Air Canada calls on Ottawa to lift hotel quarantine as it prepares for recovery: The federal government requires anyone flying into Canada to isolate at a hotel for three nights to reduce the risk of spreading COVID-19 https://t.co/medF5f4Iz6 https://t.co/CwNUYaGJxX,5/7/2021 20:28,Month_05 Week 1,5,covid air canada call ottawa lift hotel quarantine prepares recovery federal government require fly canada isolate hotel three night reduce risk spread covid,air canada call ottawa lift hotel quarantine prepares recovery federal government require anyone fly canada isolate hotel three night reduce risk spread
1.39077E+18,COVID-19: Air Canada calls on Ottawa to lift hotel quarantine as it prepares for recovery https://t.co/M91hmfzIPs https://t.co/06t8cunhY8,5/7/2021 20:28,Month_05 Week 1,5,covid air canada call ottawa lift hotel quarantine prepares recovery,air canada call ottawa lift hotel quarantine prepares recovery
1.39077E+18,COVID-19: Air Canada calls on Ottawa to lift hotel quarantine as it prepares for recovery https://t.co/ar9mus9Ic0 https://t.co/rhBRIo8DmQ,5/7/2021 20:28,Month_05 Week 1,5,covid air canada call ottawa lift hotel quarantine prepares recovery,air canada call ottawa lift hotel quarantine prepares recovery
1.39077E+18,COVID-19: Air Canada calls on Ottawa to lift hotel quarantine as it prepares for recovery https://t.co/i0TdB4O8y7 https://t.co/vxok8tP9Wi,5/7/2021 20:28,Month_05 Week 1,5,covid air canada call ottawa lift hotel quarantine prepares recovery,air canada call ottawa lift hotel quarantine prepares recovery
1.39077E+18,COVID-19: Air Canada calls on Ottawa to lift hotel quarantine as it prepares for recovery https://t.co/bPpkZM7BIB https://t.co/ushLkvT6K2,5/7/2021 20:28,Month_05 Week 1,5,covid air canada call ottawa lift hotel quarantine prepares recovery,air canada call ottawa lift hotel quarantine prepares recovery
1.39076E+18,COVID-19: Air Canada calls on Ottawa to lift hotel quarantine as it prepares for recovery https://t.co/wY16K4Jyjw https://t.co/HiNVny3Irj,5/7/2021 20:24,Month_05 Week 1,5,covid air canada call ottawa lift hotel quarantine prepares recovery,air canada call ottawa lift hotel quarantine prepares recovery
1.39076E+18,COVID-19: Air Canada calls on Ottawa to lift hotel quarantine as it prepares for recovery https://t.co/y9TkcfcesF https://t.co/XLa8Lb4jVa,5/7/2021 20:24,Month_05 Week 1,5,covid air canada call ottawa lift hotel quarantine prepares recovery,air canada call ottawa lift hotel quarantine prepares recovery
1.39076E+18,COVID-19: Air Canada calls on Ottawa to lift hotel quarantine as it prepares for recovery https://t.co/bXk5BzcImU https://t.co/Lq233Zcjig,5/7/2021 20:24,Month_05 Week 1,5,covid air canada call ottawa lift hotel quarantine prepares recovery,air canada call ottawa lift hotel quarantine prepares recovery
1.39076E+18,COVID-19: Air Canada calls on Ottawa to lift hotel quarantine as it prepares for recovery https://t.co/YQXpWLBjZm https://t.co/SZdtKrQ7at,5/7/2021 20:24,Month_05 Week 1,5,covid air canada call ottawa lift hotel quarantine prepares recovery,air canada call ottawa lift hotel quarantine prepares recovery
1.39076E+18,"3424 new cases of COVID-19 across Ontario on Thursday, 108 in Ottawa - CTV Edmonton https://t.co/jRbOcUBqUW",5/7/2021 20:20,Month_05 Week 1,5,new case covid across ontario thursday ottawa ctv edmonton,new case across ontario thursday ottawa ctv edmonton
1.39076E+18,@VaxHuntersCan ..Rexall on walkley might have some appointments to get the Moderna vaccine... Let's go OTTAWA..summer is coming👍👍,5/7/2021 20:06,Month_05 Week 1,5,rexall walkley appointment moderna vaccine ottawa summer come,rexall walkley might appointment get moderna vaccine ottawa summer come thumb thumb
1.39076E+18,"With COVID out of control in Alberta, Premier Jason Kenney refuses Ottawa’s offer to help and requests assistance from the US instead. https://t.co/LJrJhdpoZa",5/7/2021 20:06,Month_05 Week 1,5,covid control alberta premier jason kenney refuse ottawa offer help request assistance instead,with out control alberta premier jason kenney refuse ottawa offer help request assistance instead
1.39076E+18,"This pandemic is far too important to be left to Ottawa - Macleans. ca

https://t.co/BIgH9HWVPC. The Virus when informed about it FREELAND an DICTATOR just bloody danced around about it.Kept it secret couldn't answer a question properly an people are dying because of it.",5/7/2021 20:05,Month_05 Week 1,5,pandemic far important left ottawa macleans virus inform freeland dictator bloody dance around kept secret answer question properly people die,pandemic far too important left ottawa macleans virus when inform freeland dictator just bloody dance around kept secret could not_answer question properly people die
1.39076E+18,Rexall on walkley...Ottawa may have some appointments to get the Moderna a vaccine for monday,5/7/2021 20:04,Month_05 Week 1,5,rexall walkley ottawa appointment moderna vaccine monday,rexall walkley ottawa appointment get moderna vaccine monday
1.39076E+18,"@JanetcEarl @UHN @BogochIsaac @MaryFernando_ @zchagla @guthealthmd I’m hearing very similar things in Ottawa. Ministry says yes to a 2nd dose at 28-days, and even gives a confirmation number, but they can’t change the date if the first dose was given by @OttawaHealth. And then @OttawaHealth refuses to change the date. Vaccine coordination = 🤮",5/7/2021 20:04,Month_05 Week 1,5,hearing similar thing ottawa ministry say yes dose even give confirmation number change date first dose give refuse change date vaccine coordination,hearing very similar thing ottawa ministry say yes dose days even give confirmation number cannot_change date first dose give refuse change date vaccine coordination face vomit
1.39076E+18,"This pandemic is far too important to be left to Ottawa - Macleans. ca

https://t.co/LTCCl8AKQH. Well look at this people are starting to see just what kinds if crap the DICTATOR TRUDEAU AN LIBERALS are really all about an agreeing that they should just go play pretty in the yard",5/7/2021 20:02,Month_05 Week 1,5,pandemic far important left ottawa macleans well look people start see kind crap dictator trudeau liberal really agree play pretty yard,pandemic far too important left ottawa macleans well look people start see just what kind crap dictator trudeau liberal really agree should just play pretty yard
1.39076E+18,"From a television appearance by NACI's chair to a confounding response by the health minister, #RSJalum @sproudfoot wrote about how one day of  catastrophe of vaccine messaging in Ottawa caused confidence in COVID vaccines to take a beating via @macleans https://t.co/FzgLTwFQkO",5/7/2021 20:00,Month_05 Week 1,5,television appearance naci chair confound response health minister write one catastrophe vaccine message ottawa cause confidence covid vaccine take beating via,television appearance naci chair confound response health minister write one day catastrophe vaccine message ottawa cause confidence vaccine take beating via
1.39075E+18,"@drlorileeoates Yep , once the federal election is over and Covid is behind us you’ll soon find out what Ottawa has in store for NL no matter what govt is in Ottawa . Oh yes and interest rates will rise before 2023 !!",5/7/2021 19:44,Month_05 Week 1,5,yep federal election covid behind youll soon find ottawa store matter govt ottawa yes interest rate rise,yep federal election over behind will soon find out what ottawa store no_matter what govt ottawa yes interest rate will rise
1.39075E+18,"3 ER visits, 2 doctor visits, 2 Eye Clinic visits, a COVID test, several blood and urine tests  — and 3 different diagnoses later — and my kid’s eyes are finally on the mend. 

The Opthamology group at @CHEO has been life changing. It’s nice to see my boy’s spark back. #Ottawa",5/7/2021 19:39,Month_05 Week 1,5,visit doctor visit eye clinic visit covid test several blood urine test different diagnosis later kid eye finally mend opthamology group life change nice see boy spark back,visit doctor visit eye clinic visit test several blood urine test different diagnosis later kid eye finally mend opthamology group life change nice see boy spark back
1.39075E+18,"Pressure builds on Ottawa to suspend COVID vaccine patents
https://t.co/QLcJcTUwLv",5/7/2021 19:35,Month_05 Week 1,5,pressure build ottawa suspend covid vaccine patent,pressure build ottawa suspend vaccine patent
1.39075E+18,This pandemic is far too important to be left to Ottawa https://t.co/zRr0mlB6LB,5/7/2021 19:31,Month_05 Week 1,5,pandemic far important left ottawa,pandemic far too important left ottawa
1.39075E+18,"I was pleasantly surprised to hear my premier not being a dick...until I saw he was still pointing the finger at Ottawa. Fuck right off. 

Stricter public health orders coming to Manitoba today as COVID-19 cases soar | CBC News https://t.co/c2yJ8VFaLk",5/7/2021 19:25,Month_05 Week 1,5,pleasantly surprised hear premier dick saw still point finger ottawa fuck right stricter public health order come manitoba today covid case soar cbc news,pleasantly surprised hear premier not_be dick saw still point finger ottawa fuck right off stricter public health order come manitoba today case soar cbc news
1.39075E+18,"@VeraEtches 

People are saying that a large percentage of hospitalized COVID patients in Ottawa were vaccinated. Can you PLEASE debunk this rumour?",5/7/2021 19:22,Month_05 Week 1,5,people say large percentage hospitalize covid patient ottawa vaccinate please debunk rumour,people say large percentage hospitalize patient ottawa vaccinate can please debunk rumour
