Tweet Id,text,date,Week,Month,text_clean_textual,text_clean_sentiment
1.39033E+18,"3,424 new cases of COVID-19 across Ontario on Thursday, 108 in Ottawa
The 108 new cases of COVID-19 in Ottawa on Thursday follows 141 new cases on Wednesday. https://t.co/sP4yHo5t2G",5/6/2021 15:36,Month_05 Week 1,5,new case covid across ontario thursday ottawa new case covid ottawa thursday follow new case wednesday,new case across ontario thursday ottawa new case ottawa thursday follow new case wednesday
1.39033E+18,"3,424 new cases of COVID-19 across Ontario on Thursday, 108 in Ottawa https://t.co/7NTFKgV0V2 via @ctvottawa",5/6/2021 15:36,Month_05 Week 1,5,new case covid across ontario thursday ottawa via,new case across ontario thursday ottawa via
1.39033E+18,@CityNewsOttawa Not sure why! I had mine during Ottawa’s lockdown! Busy but my appt was not cancelled! These preventative tests are so important! Ladies pls don’t cancel out of Covid fear!,5/6/2021 15:30,Month_05 Week 1,5,sure ottawa lockdown busy appt cancel preventative test important lady pls cancel covid fear,not_sure why ottawa lockdown busy appt not_cancel preventative test important lady pls not_cancel out fear
1.39033E+18,CANImmunize is the Ottawa-based company behind Nova Scotia’s widely praised vaccine booking website.,5/6/2021 15:30,Month_05 Week 1,5,canimmunize ottawa base company behind nova scotias widely praise vaccine book website,canimmunize ottawa_based company behind nova scotia widely praise vaccine book website
1.39033E+18,Why is this Ottawa-designed vaccine system being used in N.S. and not Ontario? https://t.co/4mEVgNeZYH via @CTVNews,5/6/2021 15:22,Month_05 Week 1,5,ottawa design vaccine system use ontario via,why ottawa_designed vaccine system use not_ontario via
1.39032E+18,@ctvottawa @VeraEtches @JimWatsonOttawa @fordnation @celliottability...so my colleague in Montreal (40+) was eligible to book this Tuesday &amp; had his Pfizer shot the very next day (yesterday)!!! What is #Ottawa and #Ontario doing wrong? #OntarioIsSoFarBehind #COVID19 #COVID19ON #Covid,5/6/2021 15:13,Month_05 Week 1,5,colleague montreal eligible book tuesday amp pfizer shot next yesterday wrong,colleague montreal eligible book tuesday amp pfizer shot very next day yesterday what wrong
1.39032E+18,"Coronavirus: Ottawa-designed vaccine system gains praise in N.S., company says it wasn’t approached by Ontario https://t.co/BhgX8VSdMF",5/6/2021 15:08,Month_05 Week 1,5,coronavirus ottawa design vaccine system gain praise company say wasnt approach byontario,coronavirus ottawa_designed vaccine system gain praise company say not_approach ontario
1.39032E+18,Ottawa must boost financial support for health research for post-pandemic recovery.  #cdnpoli #healthresearch #COVID19recovery  @TheHillTimes    https://t.co/fcj6JfITKj,5/6/2021 15:06,Month_05 Week 1,5,ottawa boost financial support health research post pandemic recovery,ottawa must boost financial support health research post_pandemic recovery
1.39032E+18,An Ottawa-designed immunization booking system is gaining praise in Nova Scotia for its simplicity and effectiveness compared to the COVID-19 vaccine rollout in other provinces.​  https://t.co/vkQ5TtUE9R,5/6/2021 14:58,Month_05 Week 1,5,ottawa design immunization book system gain praise nova scotia simplicity effectiveness compare covid vaccine rollout province,ottawa_designed immunization book system gain praise nova scotia simplicity effectiveness compare vaccine rollout province
1.39032E+18,"What you need to know about COVID-19 in Ottawa on Thursday, May 6 | CBC News https://t.co/0X1rgLRDqs",5/6/2021 14:56,Month_05 Week 1,5,need know covid ottawa thursday cbc news,what need know ottawa thursday cbc news
1.39032E+18,"Why is this Ottawa-designed vaccine system being used in N.S. and not Ontario? https://t.co/qnmABDB49w via @CTVNews 

Our COO Katherine Atkinson speaks to @BenMulroney on @YourMorning about partnering with @nsgov to help with the COVID-19 vaccine rollout. Collaboration is key.",5/6/2021 14:43,Month_05 Week 1,5,ottawa design vaccine system use ontario via coo katherine atkinson speaks partner help covid vaccine rollout collaboration key,why ottawa_designed vaccine system use not_ontario via coo katherine atkinson speaks partner with help with vaccine rollout collaboration key
1.39032E+18,"@fordnation @ottawacity what is the point of saying hotspot vaccine is available from 9a-7p if you're going to start at 5a and run out by 7am?
#vaccine #onpoli #ottawa #COVID19",5/6/2021 14:42,Month_05 Week 1,5,point say hotspot vaccine available start run,what point say hotspot vaccine available start run out
1.39032E+18,"Ontario sees 3,424 new COVID-19 cases, new high of more than 141,000 vaccines https://t.co/cu2Lry9bCx #ottnews #ottawa https://t.co/vHuTqh0nGr",5/6/2021 14:40,Month_05 Week 1,5,ontario see new covid case new high vaccine,ontario see new case new high more vaccine
1.39032E+18,Ottawa home prices up 42 per cent in April despite COVID-19 restrictions impacting the market https://t.co/S8qDwPUlQg,5/6/2021 14:39,Month_05 Week 1,5,ottawa home price per cent despite covid restriction impact market,ottawa home price per cent despite restriction impact market
1.39032E+18,"@OceanSoulBooks @charlesadler The same media operates across Canada, yet only one province stands out with exceptionally high COVID infection rates. A province whose premier spent years stoking anti-Ottawa sentiment, coincidentally. Kenney's rhetoric has done nothing but divide and sow mistrust of government.",5/6/2021 14:39,Month_05 Week 1,5,medium operates across canada one province stand exceptionally high covid infection rate province premier spent year stoke anti ottawa sentiment coincidentally kenney rhetoric nothing divide sow mistrust government,medium operates across canada yet only one province stand out with exceptionally high infection rate province whose premier spent year stoke anti_ottawa sentiment coincidentally kenney rhetoric nothing divide sow mistrust government
1.39031E+18,Why is this Ottawa-designed vaccine system being used in N.S. and not Ontario? https://t.co/Iz5j6oS8oR https://t.co/lSfZwctmoe TORONTO — An Ottawa-designed immunization booking system is gaining praise in Nova Scotia for its simplicity and effectiveness compared to the COVID-1…,5/6/2021 14:37,Month_05 Week 1,5,ottawa design vaccine system use ontario toronto ottawa design immunization book system gain praise nova scotia simplicity effectiveness compare covid,why ottawa_designed vaccine system use not_ontario toronto ottawa_designed immunization book system gain praise nova scotia simplicity effectiveness compare
1.39031E+18,"Thursday vaccine booking details: 

Ottawa residents 50 and older, some essential workers now eligible to book COVID-19 vaccine appointments.
 https://t.co/Pxs4KavO1i",5/6/2021 14:37,Month_05 Week 1,5,thursday vaccine book detail ottawa resident old essential worker eligible book covid vaccine appointment,thursday vaccine book detail ottawa resident old essential worker eligible book vaccine appointment
1.39031E+18,"Instead of putting a specific date on when the order should end, he said new COVID-19 cases need to drop significantly to below a rate of 20 per 100,000 people per week. Ontario was at 166 on May 1 and Ottawa was at 102 as of Wednesday. It hasn't been around 20 since late Nov.",5/6/2021 14:36,Month_05 Week 1,5,instead put specific date order end say new covid case need drop significantly rate per people per ontario ottawa wednesday around late nov,instead put specific date when order should end say new case need drop significantly below rate per people per week ontario ottawa wednesday not_be around since late nov
1.39031E+18,"Yesterday, Ontario administered an additional 141,038 doses of COVID19 vaccine, bringing our total vaccinations to 5,740,761. 

Locally, Ottawa has administered 391,251 doses of COVID19 vaccine. https://t.co/eJZSL2gVxI",5/6/2021 14:33,Month_05 Week 1,5,yesterday ontario administer additional dos covid vaccine bring total vaccination locally ottawa administer dos covid vaccine,yesterday ontario administer additional dos vaccine bring total vaccination locally ottawa administer dos vaccine
1.39031E+18,1 The pandemic has accelerated and/or annihilated all sorts of nascent trends... the small businesses that have been the foundation of our communities are under assault ...  Egan: Welcome to store-free Ottawa — the giant warehouse with home delivery https://t.co/nGQvWfETRK ..2,5/6/2021 14:33,Month_05 Week 1,5,pandemic accelerate annihilate sort nascent trend small business foundation community assault egan welcome store free ottawa giant warehouse home delivery,pandemic accelerate annihilate sort nascent trend small business foundation community under assault egan welcome store_free ottawa giant warehouse with home delivery
1.39031E+18,@erdocAA @Hannah_Bananaz Just read that in Ottawa there using the how much poop is in the sewer system to tell them how high the numbers are of covid 🤔👀🤦‍♂️🥴💩,5/6/2021 14:23,Month_05 Week 1,5,read ottawa use much poop sewer system tell high number covid,just read ottawa use much poop sewer system tell high number think face eye man facepalming woozy face pile poo
1.39031E+18,"#BREAKING: Ontario is reporting  3,424 new cases of COVID-19 today.

Another 26 people have died due to the virus.

The data is based on 54,100 tests. 

Local breakdown: 

Ottawa: 108
Eastern Ontario: 23
Leeds, Grenville &amp; Lanark: 10
Renfrew County: 7

#ottnews https://t.co/HXYBgKA71E",5/6/2021 14:20,Month_05 Week 1,5,ontario reporting new case covid today people die due virus data base test local breakdown ottawa eastern ontario leeds grenville amp lanark renfrew county,ontario reporting new case today another people die due virus data base test local breakdown ottawa eastern ontario leeds grenville amp lanark renfrew county
1.39031E+18,"COVID Protocols: Summer camp registration is now open, however, the operation of summer camps is dependent on Ottawa Public Health regulations. If summer camps are cancelled, the Ottawa Catholic School Board will refund the camp fee in full.",5/6/2021 14:10,Month_05 Week 1,5,covid protocol summer camp registration open operation summer camp dependent ottawa public health regulation summer camp cancel ottawa catholic school board refund camp fee full,protocol summer camp registration open however operation summer camp dependent ottawa public health regulation summer camp cancel ottawa catholic school board will refund camp fee full
1.39031E+18,"NEW: Public Health Ontario reports 108 new cases of COVID-19 in Ottawa today.

Ottawa Public Health will provide the full snapshot on COVID-19 at 12 p.m. #ottnews 

https://t.co/lrzM0MdAS1",5/6/2021 14:10,Month_05 Week 1,5,new public health ontario report new case covid ottawa today ottawa public health provide full snapshot covid,new public health ontario report new case ottawa today ottawa public health will provide full snapshot
1.39031E+18,"NEW: Public Health Ontario reports 108 new cases of COVID-19 in Ottawa today.

Ottawa Public Health will provide the full snapshot on COVID-19 at 12 p.m. #ottnews 

https://t.co/YPMEC4gJHV",5/6/2021 14:10,Month_05 Week 1,5,new public health ontario report new case covid ottawa today ottawa public health provide full snapshot covid,new public health ontario report new case ottawa today ottawa public health will provide full snapshot
1.39031E+18,The study found a total of 526 people were admitted to hospital and 113 people died in what the research team called “vaccine failures” 🤦‍♂️ #UK #Canada #Toronto #Ottawa #LdnOnt #onpoli 🚨🚨🚨⬇️⬇️⬇️ https://t.co/CgzFuY67uB,5/6/2021 14:04,Month_05 Week 1,5,study found total people admit hospital people die research team call vaccine failure,study found total people admit hospital people die what research team call vaccine failure man facepalming police car light police car light police car light down arrow down arrow down arrow
1.39031E+18,"OTTAWA, ON, May 6, 2021 /CNW/ - Government of Canada officials will hold a technical briefing to provide an overview on the roll-out of COVID-19 vaccines. https://t.co/aW2Rn2WfLh",5/6/2021 14:03,Month_05 Week 1,5,ottawa cnw government canada official hold technical briefing provide overview roll covid vaccine,ottawa cnw government canada official will hold technical briefing provide overview roll_out vaccine
1.39031E+18,"In this podcast, I am joined by a special guest, Hetal Kushwaha of Marks &amp; Clerk.  Hetal is a Partner and Canadian Patent Agent based at Marks &amp; Clerk’s Ottawa, Ontario office. We discuss how COVID has changed networking and more in the following episode. https://t.co/OiY9ui9WcI https://t.co/3dcyTXLPLO",5/6/2021 14:00,Month_05 Week 1,5,podcast join special guest hetal kushwaha mark amp clerk hetal partner canadian patent agent base mark amp clerk ottawa ontario office discus covid change networking follow episode,podcast join special guest hetal kushwaha mark amp clerk hetal partner canadian patent agent base mark amp clerk ottawa ontario office discus change networking more follow episode
1.3903E+18,Why is this Ottawa-designed vaccine system being used in N.S. and not Ontario? https://t.co/U4eaXncmMv,5/6/2021 13:56,Month_05 Week 1,5,ottawa design vaccine system use notontario,why ottawa_designed vaccine system use not_ontario
1.3903E+18,"JUST IN: Public Health Ontario reports 108 new cases of COVID-19 in Ottawa, 3,424 across the province. #ottnews #onpoli",5/6/2021 13:55,Month_05 Week 1,5,public health ontario report new case covid ottawa across province,just public health ontario report new case ottawa across province
1.3903E+18,Why is this Ottawa-designed vaccine system being used in N.S. and not Ontario? https://t.co/4D5YlBjtMS,5/6/2021 13:55,Month_05 Week 1,5,ottawa design vaccine system use ontario,why ottawa_designed vaccine system use not_ontario
1.3903E+18,Why is this Ottawa-designed vaccine system being used in N.S. and not Ontario? https://t.co/z4QCIWkQPR,5/6/2021 13:54,Month_05 Week 1,5,ottawa design vaccine system use ontario,why ottawa_designed vaccine system use not_ontario
1.3903E+18,"Ottawa residents 50 and older, some essential workers now eligible to book COVID-19 vaccine appointments https://t.co/s8o4DKNHLw via @ctvottawa",5/6/2021 13:50,Month_05 Week 1,5,ottawa resident old essential worker eligible book covid vaccine appointment via,ottawa resident old essential worker eligible book vaccine appointment via
1.3903E+18,@AmazonHelp @amazonca @JeffBezos #Ottawa #Canada #shopping A reliable pulse oxymeter is vital for a proper covid response in Canada. You already have a great selection of inexpensive pulse oxymeters available in the USA. We have none. Can you please them available in Canada? https://t.co/ouJ8A2M3Mk,5/6/2021 13:39,Month_05 Week 1,5,reliable pulse oxymeter vital proper covid response canada great selection inexpensive pulse oxymeters available usa none please available canada,reliable pulse oxymeter vital proper response canada already great selection inexpensive pulse oxymeters available usa none can please available canada
1.3903E+18,@CharJackson82 Good for you - apparently its next to impossible to contact Covid from surfaces (CDC) of course Ottawa as usual is flogging lies.,5/6/2021 13:38,Month_05 Week 1,5,good apparently next impossible contact covid surface cdc course ottawa usual flog lie,good apparently next impossible contact surface cdc course ottawa usual flog lie
1.3903E+18,"New fail safe Covid test 😂 #undercover #péter #fart #smell #thursday #😂 #technosportottawa en Ottawa, Canada https://t.co/CihgaWISPq",5/6/2021 13:37,Month_05 Week 1,5,new fail safe covid test ottawa canada,new fail safe test face with tear joy face with tear joy ottawa canada
1.3903E+18,"A Canadian family of 4 is stranded in India after rushing there to be with a sick relative. That country is the global COVID epicentre right now, and Ottawa's ban on direct flights means they can't get home. #CBCNN https://t.co/DddQDDJJru",5/6/2021 13:37,Month_05 Week 1,5,canadian family strand india rush sick relative country global covid epicentre right ottawa ban direct flight mean home,canadian family strand india rush with sick relative country global epicentre right ottawa ban direct flight mean cannot_get home
1.3903E+18,"NEW: Ottawa home prices up 42 per cent in April despite COVID-19 restrictions impacting the market  #ottnews 
https://t.co/uxG7oCSzll",5/6/2021 13:25,Month_05 Week 1,5,new ottawa home price per cent despite covid restriction impact market,new ottawa home price per cent despite restriction impact market
1.3903E+18,Did you book your COVID-19 vaccine in Ottawa today? How did the process go? @LeahCTV wants to talk to you via Zoom/Skype. Leah.Larocque@bellmedia.ca. https://t.co/HdlGkMwUpb,5/6/2021 13:21,Month_05 Week 1,5,book covid vaccine ottawa today process talk via zoom skype leah larocque,book vaccine ottawa today process want talk via zoom skype leah larocque
1.3903E+18,"@jmt_18325 I don't know anybody who thought signing anything with Pfizer or Moderna was risky, they along with Oxford were always seen as the top prospects to produce a viable vaccine, however most people did raise eyebrows when Ottawa signed with CanSino.",5/6/2021 13:19,Month_05 Week 1,5,know anybody thought signing pfizer moderna risky along oxford always see top prospect produce viable vaccine people raise eyebrow ottawa sign cansino,not_know anybody who thought signing anything with pfizer moderna risky along with oxford always see top prospect produce viable vaccine however most people raise eyebrow when ottawa sign with cansino
1.39029E+18,1st and 2nd covid 19 vaccinations booked on the Ontario book vaccine website. 21 minute wait at 8 am today. Had to redo a couple of dates. I get my 1st jab at the Nepean Sportsplex May 21th! #Ottawa @ONgov @ONThealth @OttawaHealth @JimWatsonOttawa,5/6/2021 13:16,Month_05 Week 1,5,covid vaccination book ontario book vaccine website wait today redo couple date jab nepean sportsplex,vaccination book ontario book vaccine website minute wait today redo couple date get jab nepean sportsplex
1.39029E+18,"@XelaEpop @OverbrookCA Did you end up getting in? Also do they give you an option on vaccine? 

#Overbrook #Ottawa",5/6/2021 13:14,Month_05 Week 1,5,end give option vaccine,end get also give option vaccine
1.39029E+18,"@79Merlot @OttawaHealth What are you going to do to make people participate? Moreover, what about moderates who are not flaming anti-maskers and covid hoaxers who have been giving enough for a year? 65% of Singaporeans are using contact tracing - how many in Ottawa according to @OttawaHealth?",5/6/2021 13:13,Month_05 Week 1,5,make people participate moreover moderate flame anti masker covid hoaxer give enough year singaporean use contact trace ottawa accord,what make people participate moreover what moderate who not_flame anti_maskers hoaxer who give enough year singaporean use contact trace many ottawa accord
1.39029E+18,"Stunt driving on the rise since start of COVID-19 pandemic, police say. Residents of Barrhaven are furious. Ottawa police say the problem of excessive speeding isn't limited to Barrhaven, but happens across the city

https://t.co/nA5H15zvfU

#Ottawa",5/6/2021 13:05,Month_05 Week 1,5,stunt drive rise start covid pandemic police say resident barrhaven furious ottawa police say problem excessive speed limited barrhaven happens across city,stunt drive rise since start pandemic police say resident barrhaven furious ottawa police say problem excessive speed not_limited barrhaven happens across city
1.39029E+18,Amen 🙏🏻 finally some common sense #Ottawa as we need to learn how to “live” with this Covid endemic with an actual plan to re-opening #ottnews https://t.co/vCwZxD6Ij2,5/6/2021 12:53,Month_05 Week 1,5,amen finally common sense need learn live covid endemic actual plan opening,amen fold hand light skin tone finally common sense need learn live with endemic with actual plan re_opening
1.39029E+18,"2. It wasn’t. 
A Global News investigation found that — after refusing employee requests for mandatory masking — the CSIS HQ building in Ottawa had three outbreaks in 10 days. The director himself got the virus.",5/6/2021 12:52,Month_05 Week 1,5,wasnt global news investigation found refuse employee request mandatory mask csis building ottawa three outbreak director virus,not_a global news investigation found refuse employee request mandatory mask csis building ottawa three outbreak day director get virus
1.39029E+18,"Finally getting an appointment for my first jab in Ottawa has to be the most relief that I’ve felt in the last year. After having COVID and thinking I might die, I’m in tears just for knowing I finally have an appointment.",5/6/2021 12:51,Month_05 Week 1,5,finally appointment first jab ottawa relief ive felt last year covid think die tear know finally appointment,finally get appointment first jab ottawa most relief felt last year think might die tear just know finally appointment
1.39029E+18,"Fighting Stigma :  Three have now tested positive at city hall child-care centre: Two more people, including a child and an employee, have tested positive for COVID-19 at St. Luke's Child Care Centre at Ottawa City Hall, a memo ... https://t.co/YAMwk7ga9c",5/6/2021 12:46,Month_05 Week 1,5,fight stigma three test positive city hall child care centre two people include child employee test positive covid luke child care centre ottawa city hall memo,fight stigma three test positive city hall child_care centre two more people include child employee test positive luke child care centre ottawa city hall memo
1.39029E+18,"City of Ottawa closes 613 Lift, a gym for weightlifters that repeatedly defied COVID-19 restrictions https://t.co/bVDy9pfSes",5/6/2021 12:45,Month_05 Week 1,5,city ottawa close lift gym weightlifter repeatedly defy covid restriction,city ottawa close lift gym weightlifter repeatedly defy restriction
1.39029E+18,"And #Ottawa - you never fail us.  Middle of a pandemic, everyone already so Zoom-fatigued, and here you are, taking part ion our event on a freakin' Wednesday! We are always grateful for your support! https://t.co/Z0LbZd5tjY",5/6/2021 12:44,Month_05 Week 1,5,never fail middle pandemic zoom fatigue take part ion event freakin wednesday always grateful support,never fail middle pandemic already zoom_fatigued take part ion event freakin wednesday always grateful support
1.39029E+18,@globalnews Seriously?? Like WTF??? What would JK do (has DONE) if Trudeau had offered to step in?? MORE covid support money has come ABs way than ANY other Province!! I’m so f*cking tired of Kenney &amp; co blaming Ottawa for THEIR incompetence!! #FUCP,5/6/2021 12:43,Month_05 Week 1,5,seriously like wtf trudeau offer step covid support money come way province cking tire kenney amp blame ottawa incompetence,seriously like wtf what would trudeau offer step more support money come way any province cking tire kenney amp blame ottawa incompetence
1.39029E+18,How many COVID-19 vaccines can Ontario administer per day? We did the math https://t.co/7SYWRBkYjt #ottnews #ottawa https://t.co/MQtBv10ax8,5/6/2021 12:40,Month_05 Week 1,5,covid vaccine ontario administer per math,many vaccine can ontario administer per day math
1.39028E+18,"One flip flop after another. 

One day in Ottawa and a catastrophe of vaccine messaging - https://t.co/gPEGePTAju https://t.co/UIPF27B3np",5/6/2021 12:37,Month_05 Week 1,5,one flip flop one ottawa catastrophe vaccine message,one flip flop another one day ottawa catastrophe vaccine message
1.39028E+18,"Cooking with ingredients inspires home cooks to test your skill and be creative with the ingredients in your kitchen. @ Ottawa, Ontario https://t.co/CEQK16aKFz",5/6/2021 12:34,Month_05 Week 1,5,cooking ingredient inspires home cook test skill creative ingredient kitchen ottawa ontario,cooking with ingredient inspires home cook test skill creative with ingredient kitchen ottawa ontario
1.39028E+18,Botha: “It will extend the timeline a bit because there’s more people to immunize and the supply will only stretch so far” — why not say “as supply comes in?”  What’s with the Pallister talking point about limited vaccine supply from Ottawa? https://t.co/j4ziCZDtzv,5/6/2021 12:23,Month_05 Week 1,5,botha extend timeline bit people immunize supply stretch far say supply come whats pallister talk point limited vaccine supply ottawa,botha will extend timeline bit more people immunize supply will only stretch far why not_say supply come what with pallister talk point limited vaccine supply ottawa
1.39028E+18,"“Dr. Vera Etches, Ottawa’s medical officer of health, said Wednesday that all three cases are linked to travel. The variant was confirmed after each of the individuals completed quarantines after returning to the country, Etches said.” https://t.co/SOtRToCJkP",5/6/2021 12:21,Month_05 Week 1,5,vera etches ottawa medical officer health say wednesday three case link travel variant confirm individual complete quarantine return country etches say,vera etches ottawa medical officer health say wednesday three case link travel variant confirm individual complete quarantine return country etches say
1.39028E+18,My first vaccine appointment is booked for Sunday and I’m so ready! 💉Thank you city of Ottawa for an excellent Mother’s Day present!,5/6/2021 12:19,Month_05 Week 1,5,first vaccine appointment book sunday ready thank city ottawa excellent mother present,first vaccine appointment book sunday ready syringe thank city ottawa excellent mother day present
